"No.","Time","Source","Destination","Protocol","Length","Info"
"1","0.000000","IntelCor_8e:ca:bf","XiaomiCo_64:96:e3","ARP","42","Who has 10.0.0.3? Tell 10.0.0.7"
"2","0.021243","XiaomiCo_64:96:e3","IntelCor_8e:ca:bf","ARP","60","10.0.0.3 is at a4:50:46:64:96:e3"
"3","0.526015","XiaomiCo_64:96:e3","IntelCor_8e:ca:bf","ARP","60","Who has 10.0.0.7? Tell 10.0.0.3"
"4","0.526082","IntelCor_8e:ca:bf","XiaomiCo_64:96:e3","ARP","42","10.0.0.7 is at 68:54:5a:8e:ca:bf"
"5","0.682401","2a03:2880:f242:c8:face:b00c:0:167","2a06:c701:46db:1a00:21d9:6346:9b9b:3579","TLSv1.2","151","Application Data"
"6","0.737266","2a06:c701:46db:1a00:21d9:6346:9b9b:3579","2a03:2880:f242:c8:face:b00c:0:167","TCP","74","51770  >  443 [ACK] Seq=1 Ack=78 Win=515 Len=0"
"7","0.846825","2a06:c701:46db:1a00:21d9:6346:9b9b:3579","2a00:1450:4028:800::200a","UDP","91","51173  >  443 Len=29"
"8","0.858573","2a00:1450:4028:800::200a","2a06:c701:46db:1a00:21d9:6346:9b9b:3579","UDP","87","443  >  51173 Len=25"
"9","1.134686","HeightsT_99:7d:3b","Broadcast","0x1ee4","206","Ethernet II"
"10","1.844546","10.0.0.7","199.232.82.132","TCP","55","51886  >  443 [ACK] Seq=1 Ack=1 Win=511 Len=1 [TCP segment of a reassembled PDU]"
"11","1.891966","199.232.82.132","10.0.0.7","TCP","66","443  >  51886 [ACK] Seq=1 Ack=2 Win=290 Len=0 SLE=1 SRE=2"
"12","2.033041","10.0.0.7","34.218.162.254","TLSv1.2","116","Application Data"
"13","2.033136","10.0.0.7","34.218.162.254","TLSv1.2","100","Application Data"
"14","2.033159","10.0.0.7","34.218.162.254","TLSv1.2","2375","Application Data"
"15","2.246885","34.218.162.254","10.0.0.7","TCP","54","443  >  51905 [ACK] Seq=1 Ack=109 Win=394 Len=0"
"16","2.246885","34.218.162.254","10.0.0.7","TLSv1.2","100","Application Data"
"17","2.250806","34.218.162.254","10.0.0.7","TCP","56","443  >  51905 [ACK] Seq=47 Ack=2430 Win=425 Len=0"
"18","2.256585","34.218.162.254","10.0.0.7","TLSv1.2","279","Application Data"
"19","2.256585","34.218.162.254","10.0.0.7","TLSv1.2","92","Application Data"
"20","2.256694","10.0.0.7","34.218.162.254","TCP","54","51905  >  443 [ACK] Seq=2430 Ack=310 Win=516 Len=0"
"21","2.257295","10.0.0.7","34.218.162.254","TLSv1.2","96","Application Data"
"22","2.310526","2a03:2880:f242:c8:face:b00c:0:167","2a06:c701:46db:1a00:21d9:6346:9b9b:3579","TLSv1.2","726","Application Data"
"23","2.358436","2a06:c701:46db:1a00:21d9:6346:9b9b:3579","2a03:2880:f242:c8:face:b00c:0:167","TCP","74","51770  >  443 [ACK] Seq=1 Ack=730 Win=512 Len=0"
"24","2.375010","20.199.120.151","10.0.0.7","TLSv1.2","433","Application Data"
"25","2.375314","2a06:c701:46db:1a00:21d9:6346:9b9b:3579","2a03:2880:f242:c8:face:b00c:0:167","TLSv1.2","170","Application Data"
"26","2.385604","10.0.0.7","20.199.120.151","TLSv1.2","188","Application Data"
"27","2.426131","2a03:2880:f242:c8:face:b00c:0:167","2a06:c701:46db:1a00:21d9:6346:9b9b:3579","TCP","74","443  >  51770 [ACK] Seq=730 Ack=97 Win=339 Len=0"
"28","2.494718","20.199.120.151","10.0.0.7","TCP","60","443  >  49605 [ACK] Seq=380 Ack=135 Win=7085 Len=0"
"29","2.512724","34.218.162.254","10.0.0.7","TCP","56","443  >  51905 [ACK] Seq=310 Ack=2472 Win=425 Len=0"
"30","2.543278","2a06:c701:46db:1a00:21d9:6346:9b9b:3579","2600:9000:21f8:6400:1b:1fa2:78c0:93a1","TLSv1.2","133","Application Data"
"31","2.543368","2a06:c701:46db:1a00:21d9:6346:9b9b:3579","2600:9000:21f8:6400:1b:1fa2:78c0:93a1","TLSv1.2","113","Application Data"
"32","2.552795","2600:9000:21f8:6400:1b:1fa2:78c0:93a1","2a06:c701:46db:1a00:21d9:6346:9b9b:3579","TCP","74","443  >  51778 [ACK] Seq=1 Ack=60 Win=133 Len=0"
"33","2.552795","2600:9000:21f8:6400:1b:1fa2:78c0:93a1","2a06:c701:46db:1a00:21d9:6346:9b9b:3579","TCP","74","443  >  51778 [ACK] Seq=1 Ack=99 Win=133 Len=0"
"34","2.552795","2600:9000:21f8:6400:1b:1fa2:78c0:93a1","2a06:c701:46db:1a00:21d9:6346:9b9b:3579","TLSv1.2","113","Application Data"
"35","2.579611","2a06:c701:46db:1a00:21d9:6346:9b9b:3579","2a03:2880:f242:c6:face:b00c:0:7260","TCP","86","51908  >  5222 [SYN] Seq=0 Win=64800 Len=0 MSS=1440 WS=256 SACK_PERM"
"36","2.606472","2a06:c701:46db:1a00:21d9:6346:9b9b:3579","2600:9000:21f8:6400:1b:1fa2:78c0:93a1","TCP","74","51778  >  443 [ACK] Seq=99 Ack=40 Win=511 Len=0"
"37","2.627340","2a03:2880:f242:c6:face:b00c:0:7260","2a06:c701:46db:1a00:21d9:6346:9b9b:3579","TCP","86","5222  >  51908 [SYN, ACK] Seq=0 Ack=1 Win=65535 Len=0 MSS=1392 SACK_PERM WS=256"
"38","2.627606","2a06:c701:46db:1a00:21d9:6346:9b9b:3579","2a03:2880:f242:c6:face:b00c:0:7260","TCP","74","51908  >  5222 [ACK] Seq=1 Ack=1 Win=132096 Len=0"
"39","2.628553","2a06:c701:46db:1a00:21d9:6346:9b9b:3579","2a03:2880:f242:c6:face:b00c:0:7260","TCP","312","51908  >  5222 [PSH, ACK] Seq=1 Ack=1 Win=132096 Len=238 [TCP segment of a reassembled PDU]"
"40","2.678739","2a03:2880:f242:c6:face:b00c:0:7260","2a06:c701:46db:1a00:21d9:6346:9b9b:3579","TCP","74","5222  >  51908 [ACK] Seq=1 Ack=239 Win=66816 Len=0"
"41","2.782858","2a03:2880:f242:c6:face:b00c:0:7260","2a06:c701:46db:1a00:21d9:6346:9b9b:3579","TCP","131","5222  >  51908 [PSH, ACK] Seq=1 Ack=239 Win=66816 Len=57 [TCP segment of a reassembled PDU]"
"42","2.782858","2a03:2880:f242:c6:face:b00c:0:7260","2a06:c701:46db:1a00:21d9:6346:9b9b:3579","TCP","124","5222  >  51908 [PSH, ACK] Seq=58 Ack=239 Win=66816 Len=50 [TCP segment of a reassembled PDU]"
"43","2.783158","2a06:c701:46db:1a00:21d9:6346:9b9b:3579","2a03:2880:f242:c6:face:b00c:0:7260","TCP","74","51908  >  5222 [ACK] Seq=239 Ack=108 Win=132096 Len=0"
"44","2.804480","2600:9000:21f8:6400:1b:1fa2:78c0:93a1","2a06:c701:46db:1a00:21d9:6346:9b9b:3579","TLSv1.2","447","Application Data"
"45","2.854612","2a06:c701:46db:1a00:21d9:6346:9b9b:3579","2600:9000:21f8:6400:1b:1fa2:78c0:93a1","TCP","74","51778  >  443 [ACK] Seq=99 Ack=413 Win=514 Len=0"
"46","2.905288","2a03:2880:f242:c6:face:b00c:0:7260","2a06:c701:46db:1a00:21d9:6346:9b9b:3579","TCP","120","5222  >  51908 [PSH, ACK] Seq=108 Ack=239 Win=66816 Len=46 [TCP segment of a reassembled PDU]"
"47","2.905288","2a03:2880:f242:c6:face:b00c:0:7260","2a06:c701:46db:1a00:21d9:6346:9b9b:3579","TCP","127","5222  >  51908 [PSH, ACK] Seq=154 Ack=239 Win=66816 Len=53 [TCP segment of a reassembled PDU]"
"48","2.905447","2a06:c701:46db:1a00:21d9:6346:9b9b:3579","2a03:2880:f242:c6:face:b00c:0:7260","TCP","74","51908  >  5222 [ACK] Seq=239 Ack=207 Win=131840 Len=0"
"49","2.906321","2a06:c701:46db:1a00:21d9:6346:9b9b:3579","2a03:2880:f242:c6:face:b00c:0:7260","TCP","109","51908  >  5222 [PSH, ACK] Seq=239 Ack=207 Win=131840 Len=35 [TCP segment of a reassembled PDU]"
"50","2.906631","2a06:c701:46db:1a00:21d9:6346:9b9b:3579","2a03:2880:f242:c6:face:b00c:0:7260","TCP","119","51908  >  5222 [PSH, ACK] Seq=274 Ack=207 Win=131840 Len=45 [TCP segment of a reassembled PDU]"
"51","2.906718","2a03:2880:f242:c6:face:b00c:0:7260","2a06:c701:46db:1a00:21d9:6346:9b9b:3579","TCP","119","5222  >  51908 [PSH, ACK] Seq=207 Ack=239 Win=66816 Len=45 [TCP segment of a reassembled PDU]"
"52","2.906829","2a06:c701:46db:1a00:21d9:6346:9b9b:3579","2a03:2880:f242:c6:face:b00c:0:7260","TCP","113","51908  >  5222 [PSH, ACK] Seq=319 Ack=207 Win=131840 Len=39 [TCP segment of a reassembled PDU]"
"53","2.906952","2a03:2880:f242:c6:face:b00c:0:7260","2a06:c701:46db:1a00:21d9:6346:9b9b:3579","TCP","702","5222  >  51908 [PSH, ACK] Seq=252 Ack=239 Win=66816 Len=628 [TCP segment of a reassembled PDU]"
"54","2.907032","2a06:c701:46db:1a00:21d9:6346:9b9b:3579","2a03:2880:f242:c6:face:b00c:0:7260","TCP","74","51908  >  5222 [ACK] Seq=358 Ack=880 Win=131328 Len=0"
"55","2.907287","2a06:c701:46db:1a00:21d9:6346:9b9b:3579","2a03:2880:f242:c6:face:b00c:0:7260","TCP","108","51908  >  5222 [PSH, ACK] Seq=358 Ack=880 Win=131328 Len=34 [TCP segment of a reassembled PDU]"
"56","2.907488","2a03:2880:f242:c6:face:b00c:0:7260","2a06:c701:46db:1a00:21d9:6346:9b9b:3579","TCP","111","5222  >  51908 [PSH, ACK] Seq=880 Ack=239 Win=66816 Len=37 [TCP segment of a reassembled PDU]"
"57","2.907743","2a06:c701:46db:1a00:21d9:6346:9b9b:3579","2a03:2880:f242:c6:face:b00c:0:7260","TCP","204","51908  >  5222 [PSH, ACK] Seq=392 Ack=917 Win=131072 Len=130 [TCP segment of a reassembled PDU]"
"58","2.917335","2a06:c701:46db:1a00:21d9:6346:9b9b:3579","2a03:2880:f242:c6:face:b00c:0:7260","TCP","141","51908  >  5222 [PSH, ACK] Seq=522 Ack=917 Win=131072 Len=67 [TCP segment of a reassembled PDU]"
"59","2.917457","2a06:c701:46db:1a00:21d9:6346:9b9b:3579","2a03:2880:f242:c6:face:b00c:0:7260","TCP","114","51908  >  5222 [PSH, ACK] Seq=589 Ack=917 Win=131072 Len=40 [TCP segment of a reassembled PDU]"
"60","2.919582","2a06:c701:46db:1a00:21d9:6346:9b9b:3579","2a03:2880:f242:c6:face:b00c:0:7260","TCP","393","51908  >  5222 [PSH, ACK] Seq=629 Ack=917 Win=131072 Len=319 [TCP segment of a reassembled PDU]"
"61","2.954337","2a03:2880:f242:c6:face:b00c:0:7260","2a06:c701:46db:1a00:21d9:6346:9b9b:3579","TCP","74","5222  >  51908 [ACK] Seq=917 Ack=274 Win=66816 Len=0"
"62","2.955253","2a03:2880:f242:c6:face:b00c:0:7260","2a06:c701:46db:1a00:21d9:6346:9b9b:3579","TCP","74","5222  >  51908 [ACK] Seq=917 Ack=319 Win=66816 Len=0"
"63","2.955253","2a03:2880:f242:c6:face:b00c:0:7260","2a06:c701:46db:1a00:21d9:6346:9b9b:3579","TCP","74","5222  >  51908 [ACK] Seq=917 Ack=358 Win=66816 Len=0"
"64","2.956033","2a03:2880:f242:c6:face:b00c:0:7260","2a06:c701:46db:1a00:21d9:6346:9b9b:3579","TCP","74","5222  >  51908 [ACK] Seq=917 Ack=392 Win=66816 Len=0"
"65","2.956033","2a03:2880:f242:c6:face:b00c:0:7260","2a06:c701:46db:1a00:21d9:6346:9b9b:3579","TCP","74","5222  >  51908 [ACK] Seq=917 Ack=522 Win=67840 Len=0"
"66","2.964662","2a03:2880:f242:c6:face:b00c:0:7260","2a06:c701:46db:1a00:21d9:6346:9b9b:3579","TCP","74","5222  >  51908 [ACK] Seq=917 Ack=589 Win=67840 Len=0"
"67","2.964662","2a03:2880:f242:c6:face:b00c:0:7260","2a06:c701:46db:1a00:21d9:6346:9b9b:3579","TCP","74","5222  >  51908 [ACK] Seq=917 Ack=629 Win=67840 Len=0"
"68","2.968476","2a03:2880:f242:c6:face:b00c:0:7260","2a06:c701:46db:1a00:21d9:6346:9b9b:3579","TCP","74","5222  >  51908 [ACK] Seq=917 Ack=948 Win=68864 Len=0"
"69","3.052481","2a03:2880:f242:c6:face:b00c:0:7260","2a06:c701:46db:1a00:21d9:6346:9b9b:3579","TCP","115","5222  >  51908 [PSH, ACK] Seq=917 Ack=948 Win=68864 Len=41 [TCP segment of a reassembled PDU]"
"70","3.054722","2a03:2880:f242:c6:face:b00c:0:7260","2a06:c701:46db:1a00:21d9:6346:9b9b:3579","TCP","113","5222  >  51908 [PSH, ACK] Seq=958 Ack=948 Win=68864 Len=39 [TCP segment of a reassembled PDU]"
"71","3.054800","2a06:c701:46db:1a00:21d9:6346:9b9b:3579","2a03:2880:f242:c6:face:b00c:0:7260","TCP","74","51908  >  5222 [ACK] Seq=948 Ack=997 Win=131072 Len=0"
"72","3.074756","2a03:2880:f242:c6:face:b00c:0:7260","2a06:c701:46db:1a00:21d9:6346:9b9b:3579","TCP","592","5222  >  51908 [PSH, ACK] Seq=997 Ack=948 Win=68864 Len=518 [TCP segment of a reassembled PDU]"
"73","3.078717","2a06:c701:46db:1a00:21d9:6346:9b9b:3579","2a03:2880:f242:c8:face:b00c:0:167","TLSv1.2","115","Application Data"
"74","3.086535","2a03:2880:f242:c6:face:b00c:0:7260","2a06:c701:46db:1a00:21d9:6346:9b9b:3579","TCP","116","5222  >  51908 [PSH, ACK] Seq=1515 Ack=948 Win=68864 Len=42 [TCP segment of a reassembled PDU]"
"75","3.086535","2a03:2880:f242:c6:face:b00c:0:7260","2a06:c701:46db:1a00:21d9:6346:9b9b:3579","TCP","116","5222  >  51908 [PSH, ACK] Seq=1557 Ack=948 Win=68864 Len=42 [TCP segment of a reassembled PDU]"
"76","3.086638","2a06:c701:46db:1a00:21d9:6346:9b9b:3579","2a03:2880:f242:c6:face:b00c:0:7260","TCP","74","51908  >  5222 [ACK] Seq=948 Ack=1599 Win=132096 Len=0"
"77","3.095576","2a06:c701:46db:1a00:21d9:6346:9b9b:3579","2a03:2880:f242:c8:face:b00c:0:167","TLSv1.2","144","Application Data"
"78","3.120178","2a03:2880:f242:c6:face:b00c:0:7260","2a06:c701:46db:1a00:21d9:6346:9b9b:3579","TCP","178","5222  >  51908 [PSH, ACK] Seq=1599 Ack=948 Win=68864 Len=104 [TCP segment of a reassembled PDU]"
"79","3.120268","2a06:c701:46db:1a00:21d9:6346:9b9b:3579","2a03:2880:f242:c6:face:b00c:0:7260","TCP","74","51908  >  5222 [ACK] Seq=948 Ack=1703 Win=132096 Len=0"
"80","3.122194","2a03:2880:f242:c6:face:b00c:0:7260","2a06:c701:46db:1a00:21d9:6346:9b9b:3579","TCP","260","5222  >  51908 [PSH, ACK] Seq=1703 Ack=948 Win=68864 Len=186 [TCP segment of a reassembled PDU]"
"81","3.126347","2a03:2880:f242:c8:face:b00c:0:167","2a06:c701:46db:1a00:21d9:6346:9b9b:3579","TCP","74","443  >  51892 [ACK] Seq=1 Ack=42 Win=265 Len=0"
"82","3.126591","2a03:2880:f242:c8:face:b00c:0:167","2a06:c701:46db:1a00:21d9:6346:9b9b:3579","TLSv1.2","109","Application Data"
"83","3.126679","2a06:c701:46db:1a00:21d9:6346:9b9b:3579","2a03:2880:f242:c8:face:b00c:0:167","TCP","74","51892  >  443 [ACK] Seq=42 Ack=36 Win=1023 Len=0"
"84","3.127320","2a03:2880:f242:c8:face:b00c:0:167","2a06:c701:46db:1a00:21d9:6346:9b9b:3579","TCP","1466","443  >  51892 [ACK] Seq=36 Ack=42 Win=265 Len=1392 [TCP segment of a reassembled PDU]"
"85","3.127320","2a03:2880:f242:c8:face:b00c:0:167","2a06:c701:46db:1a00:21d9:6346:9b9b:3579","TLSv1.2","1107","Application Data, Application Data"
"86","3.127414","2a06:c701:46db:1a00:21d9:6346:9b9b:3579","2a03:2880:f242:c8:face:b00c:0:167","TCP","74","51892  >  443 [ACK] Seq=42 Ack=2461 Win=1024 Len=0"
"87","3.142012","2a03:2880:f242:c8:face:b00c:0:167","2a06:c701:46db:1a00:21d9:6346:9b9b:3579","TCP","74","443  >  51770 [ACK] Seq=730 Ack=167 Win=339 Len=0"
"88","3.148405","2a06:c701:46db:1a00:21d9:6346:9b9b:3579","2a00:1450:4028:800::200e","QUIC","1292","Initial, DCID=6e2867091f62f7ff, PKN: 1, CRYPTO, CRYPTO, PADDING, CRYPTO, PADDING, CRYPTO, CRYPTO, PADDING, CRYPTO, PADDING"
"89","3.148418","2a06:c701:46db:1a00:21d9:6346:9b9b:3579","2a00:1450:4028:800::200e","HTTP3","140","0-RTT, DCID=6e2867091f62f7ff, PKN: 2, STREAM(2), SETTINGS"
"90","3.167219","2a06:c701:46db:1a00:21d9:6346:9b9b:3579","2a03:2880:f242:c6:face:b00c:0:7260","TCP","74","51908  >  5222 [ACK] Seq=948 Ack=1889 Win=131840 Len=0"
"91","3.188865","2a00:1450:4028:800::200e","2a06:c701:46db:1a00:21d9:6346:9b9b:3579","QUIC","1292","Initial, SCID=ee2867091f62f7ff, PKN: 1, ACK, PADDING"
"92","3.213375","2a06:c701:46db:1a00:21d9:6346:9b9b:3579","2a00:1450:4028:800::200e","QUIC","1292","Initial, DCID=ee2867091f62f7ff, PKN: 4, PADDING, PING, PADDING"
"93","3.224003","2a00:1450:4028:800::200e","2a06:c701:46db:1a00:21d9:6346:9b9b:3579","HTTP3","1292","Protected Payload (KP0), PKN: 4, STREAM(3), SETTINGS"
"94","3.224788","2a06:c701:46db:1a00:21d9:6346:9b9b:3579","2a00:1450:4028:800::200e","QUIC","140","Handshake, DCID=ee2867091f62f7ff, PKN: 5, ACK, CRYPTO"
"95","3.225173","2a00:1450:4028:800::200e","2a06:c701:46db:1a00:21d9:6346:9b9b:3579","QUIC","690","Protected Payload (KP0), PKN: 5, CRYPTO"
"96","3.225408","2a06:c701:46db:1a00:21d9:6346:9b9b:3579","2a00:1450:4028:800::200e","HTTP3","1288","Protected Payload (KP0), DCID=ee2867091f62f7ff, PKN: 6, ACK, STREAM(2), PRIORITY_UPDATE, STREAM(10)"
"97","3.225504","2a06:c701:46db:1a00:21d9:6346:9b9b:3579","2a00:1450:4028:800::200e","HTTP3","1288","Protected Payload (KP0), DCID=ee2867091f62f7ff, PKN: 7, STREAM(10), STREAM(0), HEADERS"
"98","3.225559","2a06:c701:46db:1a00:21d9:6346:9b9b:3579","2a00:1450:4028:800::200e","QUIC","1292","Protected Payload (KP0), DCID=ee2867091f62f7ff, PKN: 8, STREAM(0)"
"99","3.225631","2a06:c701:46db:1a00:21d9:6346:9b9b:3579","2a00:1450:4028:800::200e","HTTP3","866","Protected Payload (KP0), DCID=ee2867091f62f7ff, PKN: 9, STREAM(0), DATA"
"100","3.225804","2a00:1450:4028:800::200e","2a06:c701:46db:1a00:21d9:6346:9b9b:3579","QUIC","87","Protected Payload (KP0), PKN: 6, ACK"
"101","3.227382","2a00:1450:4028:800::200e","2a06:c701:46db:1a00:21d9:6346:9b9b:3579","HTTP3","1292","Protected Payload (KP0), PKN: 9, STREAM(3), SETTINGS"
"102","3.227781","2a06:c701:46db:1a00:21d9:6346:9b9b:3579","2a00:1450:4028:800::200e","HTTP3","1292","Protected Payload (KP0), DCID=ee2867091f62f7ff, PKN: 11, ACK, STREAM(2), PRIORITY_UPDATE, STREAM(10)"
"103","3.228815","2a03:2880:f242:c8:face:b00c:0:167","2a06:c701:46db:1a00:21d9:6346:9b9b:3579","TLSv1.2","146","Application Data"
"104","3.235944","2a00:1450:4028:800::200e","2a06:c701:46db:1a00:21d9:6346:9b9b:3579","QUIC","182","Protected Payload (KP0), PKN: 10, DONE, NT, NCI"
"105","3.236175","2a06:c701:46db:1a00:21d9:6346:9b9b:3579","2a00:1450:4028:800::200e","QUIC","95","Protected Payload (KP0), DCID=ee2867091f62f7ff, PKN: 12, ACK"
"106","3.239145","2a00:1450:4028:800::200e","2a06:c701:46db:1a00:21d9:6346:9b9b:3579","QUIC","87","Protected Payload (KP0), PKN: 11, ACK"
"107","3.241125","2a00:1450:4028:800::200e","2a06:c701:46db:1a00:21d9:6346:9b9b:3579","HTTP3","91","Protected Payload (KP0), PKN: 12, ACK, STREAM(7)"
"108","3.241290","2a06:c701:46db:1a00:21d9:6346:9b9b:3579","2a00:1450:4028:800::200e","QUIC","95","Protected Payload (KP0), DCID=ee2867091f62f7ff, PKN: 13, ACK"
"109","3.243282","2a00:1450:4028:800::200e","2a06:c701:46db:1a00:21d9:6346:9b9b:3579","QUIC","87","Protected Payload (KP0), PKN: 13, ACK"
"110","3.244486","2a00:1450:4028:800::200e","2a06:c701:46db:1a00:21d9:6346:9b9b:3579","QUIC","87","Protected Payload (KP0), PKN: 14, ACK"
"111","3.245982","2a00:1450:4028:800::200e","2a06:c701:46db:1a00:21d9:6346:9b9b:3579","QUIC","89","Protected Payload (KP0), PKN: 15, ACK"
"112","3.274162","2a06:c701:46db:1a00:21d9:6346:9b9b:3579","2a03:2880:f242:c8:face:b00c:0:167","TCP","74","51770  >  443 [ACK] Seq=167 Ack=802 Win=512 Len=0"
"113","3.323139","2a00:1450:4028:800::200e","2a06:c701:46db:1a00:21d9:6346:9b9b:3579","HTTP3","623","Protected Payload (KP0), PKN: 16, STREAM(11), STREAM(0), HEADERS, DATA"
"114","3.323638","2a06:c701:46db:1a00:21d9:6346:9b9b:3579","2a00:1450:4028:800::200e","HTTP3","97","Protected Payload (KP0), DCID=ee2867091f62f7ff, PKN: 14, ACK, STREAM(6)"
"115","3.323991","2a00:1450:4028:800::200e","2a06:c701:46db:1a00:21d9:6346:9b9b:3579","QUIC","119","Protected Payload (KP0), PKN: 17, PADDING, STREAM(0)"
"116","3.349985","2a06:c701:46db:1a00:21d9:6346:9b9b:3579","2a00:1450:4028:800::200e","QUIC","94","Protected Payload (KP0), DCID=ee2867091f62f7ff, PKN: 15, ACK"
"117","3.358044","2a00:1450:4028:800::200e","2a06:c701:46db:1a00:21d9:6346:9b9b:3579","QUIC","86","Protected Payload (KP0), PKN: 18, ACK"
"118","4.068392","2a06:c701:46db:1a00:21d9:6346:9b9b:3579","2a00:1450:4028:800::200a","UDP","91","51173  >  443 Len=29"
"119","4.079980","2a00:1450:4028:800::200a","2a06:c701:46db:1a00:21d9:6346:9b9b:3579","UDP","87","443  >  51173 Len=25"
"120","4.467952","2a06:c701:46db:1a00:21d9:6346:9b9b:3579","2a00:1450:4028:801::200e","QUIC","1292","Initial, DCID=25515d4cd6505b6a, PKN: 1, PADDING, CRYPTO, PADDING, CRYPTO, PADDING, PING, PING, CRYPTO, PADDING"
"121","4.467966","2a06:c701:46db:1a00:21d9:6346:9b9b:3579","2a00:1450:4028:801::200e","HTTP3","140","0-RTT, DCID=25515d4cd6505b6a, PKN: 2, STREAM(2), SETTINGS"
"122","4.507514","2a00:1450:4028:801::200e","2a06:c701:46db:1a00:21d9:6346:9b9b:3579","QUIC","1292","Initial, SCID=e5515d4cd6505b6a, PKN: 1, ACK, PADDING"
"123","4.521234","2001:4cd0:dc00:1::684d:ca63","2a06:c701:46db:1a00:21d9:6346:9b9b:3579","TLSv1.2","98","Application Data"
"124","4.521309","2a06:c701:46db:1a00:21d9:6346:9b9b:3579","2001:4cd0:dc00:1::684d:ca63","TCP","74","51875  >  443 [ACK] Seq=1 Ack=25 Win=1023 Len=0"
"125","4.522261","2001:4cd0:dc00:1::684d:ca63","2a06:c701:46db:1a00:21d9:6346:9b9b:3579","TCP","74","443  >  51875 [FIN, ACK] Seq=25 Ack=1 Win=1850 Len=0"
"126","4.522289","2a06:c701:46db:1a00:21d9:6346:9b9b:3579","2001:4cd0:dc00:1::684d:ca63","TCP","74","51875  >  443 [ACK] Seq=1 Ack=26 Win=1023 Len=0"
"127","4.541400","2a00:1450:4028:801::200e","2a06:c701:46db:1a00:21d9:6346:9b9b:3579","HTTP3","1292","Protected Payload (KP0), PKN: 4, STREAM(3), SETTINGS"
"128","4.541987","2a06:c701:46db:1a00:21d9:6346:9b9b:3579","2a00:1450:4028:801::200e","QUIC","140","Handshake, DCID=e5515d4cd6505b6a, PKN: 3, ACK, CRYPTO"
"129","4.542367","2a00:1450:4028:801::200e","2a06:c701:46db:1a00:21d9:6346:9b9b:3579","QUIC","865","Protected Payload (KP0), PKN: 5, CRYPTO"
"130","4.542376","2a06:c701:46db:1a00:21d9:6346:9b9b:3579","2a00:1450:4028:801::200e","HTTP3","1288","Protected Payload (KP0), DCID=e5515d4cd6505b6a, PKN: 4, ACK, STREAM(2), PRIORITY_UPDATE, STREAM(10), STREAM(0), HEADERS"
"131","4.542449","2a06:c701:46db:1a00:21d9:6346:9b9b:3579","2a00:1450:4028:801::200e","QUIC","1292","Protected Payload (KP0), DCID=e5515d4cd6505b6a, PKN: 5, STREAM(0)"
"132","4.542502","2a06:c701:46db:1a00:21d9:6346:9b9b:3579","2a00:1450:4028:801::200e","HTTP3","811","Protected Payload (KP0), DCID=e5515d4cd6505b6a, PKN: 6, STREAM(0), DATA"
"133","4.543465","2a00:1450:4028:801::200e","2a06:c701:46db:1a00:21d9:6346:9b9b:3579","QUIC","233","Protected Payload (KP0), PKN: 6, CRYPTO"
"134","4.543685","2a06:c701:46db:1a00:21d9:6346:9b9b:3579","2a00:1450:4028:801::200e","QUIC","94","Protected Payload (KP0), DCID=e5515d4cd6505b6a, PKN: 7, ACK"
"135","4.544009","2a00:1450:4028:801::200e","2a06:c701:46db:1a00:21d9:6346:9b9b:3579","QUIC","86","Protected Payload (KP0), PKN: 7, ACK"
"136","4.552390","2a00:1450:4028:801::200e","2a06:c701:46db:1a00:21d9:6346:9b9b:3579","QUIC","182","Protected Payload (KP0), PKN: 8, DONE, NT, NCI"
"137","4.554452","2a00:1450:4028:801::200e","2a06:c701:46db:1a00:21d9:6346:9b9b:3579","HTTP3","91","Protected Payload (KP0), PKN: 9, ACK, STREAM(7)"
"138","4.554720","2a06:c701:46db:1a00:21d9:6346:9b9b:3579","2a00:1450:4028:801::200e","QUIC","93","Protected Payload (KP0), DCID=e5515d4cd6505b6a, PKN: 8, ACK"
"139","4.556087","2a00:1450:4028:801::200e","2a06:c701:46db:1a00:21d9:6346:9b9b:3579","QUIC","87","Protected Payload (KP0), PKN: 10, ACK"
"140","4.557677","2a00:1450:4028:801::200e","2a06:c701:46db:1a00:21d9:6346:9b9b:3579","QUIC","87","Protected Payload (KP0), PKN: 11, ACK"
"141","4.770614","2a06:c701:46db:1a00:21d9:6346:9b9b:3579","2a00:1450:4028:801::200e","QUIC","91","Protected Payload (KP0), DCID=e5515d4cd6505b6a, PKN: 9, PADDING, PING"
"142","4.796009","2a00:1450:4028:801::200e","2a06:c701:46db:1a00:21d9:6346:9b9b:3579","HTTP3","855","Protected Payload (KP0), PKN: 12, ACK, STREAM(11), STREAM(0), HEADERS, DATA"
"143","4.796362","2a06:c701:46db:1a00:21d9:6346:9b9b:3579","2a00:1450:4028:801::200e","HTTP3","97","Protected Payload (KP0), DCID=e5515d4cd6505b6a, PKN: 10, ACK, STREAM(6)"
"144","4.797947","2a00:1450:4028:801::200e","2a06:c701:46db:1a00:21d9:6346:9b9b:3579","HTTP3","96","Protected Payload (KP0), PKN: 13, STREAM(0), DATA"
"145","4.798553","2a00:1450:4028:801::200e","2a06:c701:46db:1a00:21d9:6346:9b9b:3579","QUIC","285","Protected Payload (KP0), PKN: 14, PADDING, STREAM(0)"
"146","4.798676","2a06:c701:46db:1a00:21d9:6346:9b9b:3579","2a00:1450:4028:801::200e","QUIC","93","Protected Payload (KP0), DCID=e5515d4cd6505b6a, PKN: 11, ACK"
"147","4.829931","2a00:1450:4028:801::200e","2a06:c701:46db:1a00:21d9:6346:9b9b:3579","QUIC","86","Protected Payload (KP0), PKN: 15, ACK"
"148","6.806593","2a03:2880:f242:c8:face:b00c:0:167","2a06:c701:46db:1a00:21d9:6346:9b9b:3579","TLSv1.2","151","Application Data"
"149","6.854250","2a06:c701:46db:1a00:21d9:6346:9b9b:3579","2a03:2880:f242:c8:face:b00c:0:167","TCP","74","51770  >  443 [ACK] Seq=167 Ack=879 Win=511 Len=0"
"150","7.370758","2603:1026:c03:3030::2","2a06:c701:46db:1a00:21d9:6346:9b9b:3579","TCP","74","443  >  51878 [RST, ACK] Seq=1 Ack=1 Win=0 Len=0"
"151","7.631312","fe80::2b8:c2ff:fe99:7d3b","2a06:c701:46db:1a00:21d9:6346:9b9b:3579","ICMPv6","86","Neighbor Solicitation for 2a06:c701:46db:1a00:21d9:6346:9b9b:3579 from 00:b8:c2:99:7d:3b"
"152","7.631444","2a06:c701:46db:1a00:21d9:6346:9b9b:3579","fe80::2b8:c2ff:fe99:7d3b","ICMPv6","86","Neighbor Advertisement 2a06:c701:46db:1a00:21d9:6346:9b9b:3579 (sol, ovr) is at 68:54:5a:8e:ca:bf"
"153","8.072298","2603:1026:c03:3030::2","2a06:c701:46db:1a00:21d9:6346:9b9b:3579","TCP","74","443  >  51879 [RST, ACK] Seq=1 Ack=1 Win=0 Len=0"
"154","9.121400","10.0.0.3","224.0.0.251","MDNS","103","Standard query 0x002b PTR _233637DE._sub._googlecast._tcp.local, ""QM"" question PTR _googlecast._tcp.local, ""QM"" question"
"155","9.382070","10.0.0.7","239.255.255.250","SSDP","217","M-SEARCH * HTTP/1.1 "
"156","9.386600","10.0.0.138","239.255.255.250","SSDP","446","NOTIFY * HTTP/1.1 "
"157","9.387883","10.0.0.138","239.255.255.250","SSDP","518","NOTIFY * HTTP/1.1 "
"158","9.387883","10.0.0.138","239.255.255.250","SSDP","455","NOTIFY * HTTP/1.1 "
"159","9.387883","10.0.0.138","239.255.255.250","SSDP","514","NOTIFY * HTTP/1.1 "
"160","9.387883","10.0.0.138","239.255.255.250","SSDP","455","NOTIFY * HTTP/1.1 "
"161","9.387883","10.0.0.138","239.255.255.250","SSDP","494","NOTIFY * HTTP/1.1 "
"162","9.387883","10.0.0.138","239.255.255.250","SSDP","455","NOTIFY * HTTP/1.1 "
"163","9.387883","10.0.0.138","239.255.255.250","SSDP","508","NOTIFY * HTTP/1.1 "
"164","9.387883","10.0.0.138","239.255.255.250","SSDP","526","NOTIFY * HTTP/1.1 "
"165","9.387883","10.0.0.138","239.255.255.250","SSDP","510","NOTIFY * HTTP/1.1 "
"166","9.388421","10.0.0.138","239.255.255.250","SSDP","510","NOTIFY * HTTP/1.1 "
"167","9.419874","34.85.166.233","10.0.0.7","TLSv1.2","82","Application Data"
"168","9.420224","10.0.0.7","34.85.166.233","TLSv1.2","86","Application Data"
"169","9.428613","HeightsT_99:7d:3b","Broadcast","0x1ee4","206","Ethernet II"
"170","9.568052","34.85.166.233","10.0.0.7","TCP","56","443  >  51904 [ACK] Seq=29 Ack=33 Win=331 Len=0"
"171","9.637977","10.0.0.138","239.255.255.250","SSDP","510","NOTIFY * HTTP/1.1 "
"172","9.639717","10.0.0.138","239.255.255.250","SSDP","510","NOTIFY * HTTP/1.1 "
"173","9.639717","10.0.0.138","239.255.255.250","SSDP","526","NOTIFY * HTTP/1.1 "
"174","9.640048","10.0.0.138","239.255.255.250","SSDP","508","NOTIFY * HTTP/1.1 "
"175","9.640943","10.0.0.138","239.255.255.250","SSDP","455","NOTIFY * HTTP/1.1 "
"176","9.641956","10.0.0.138","239.255.255.250","SSDP","494","NOTIFY * HTTP/1.1 "
"177","9.641956","10.0.0.138","239.255.255.250","SSDP","455","NOTIFY * HTTP/1.1 "
"178","9.641956","10.0.0.138","239.255.255.250","SSDP","514","NOTIFY * HTTP/1.1 "
"179","9.642269","10.0.0.138","239.255.255.250","SSDP","455","NOTIFY * HTTP/1.1 "
"180","9.642269","10.0.0.138","239.255.255.250","SSDP","518","NOTIFY * HTTP/1.1 "
"181","9.643320","10.0.0.138","239.255.255.250","SSDP","446","NOTIFY * HTTP/1.1 "
"182","10.184098","2a06:c701:46db:1a00:21d9:6346:9b9b:3579","2a03:2880:f242:c8:face:b00c:0:167","TLSv1.2","2638","Application Data"
"183","10.199478","2a06:c701:46db:1a00:21d9:6346:9b9b:3579","2a06:c701:46db:1a00::1","DNS","96","Standard query 0xf29c A dit.whatsapp.net"
"184","10.199790","2a06:c701:46db:1a00:21d9:6346:9b9b:3579","2a06:c701:46db:1a00::1","DNS","96","Standard query 0x24c3 AAAA dit.whatsapp.net"
"185","10.211602","2a06:c701:46db:1a00::1","2a06:c701:46db:1a00:21d9:6346:9b9b:3579","DNS","160","Standard query response 0xf29c A dit.whatsapp.net CNAME scontent.whatsapp.net CNAME mmx-ds.cdn.whatsapp.net A 157.240.195.56"
"186","10.213059","2a06:c701:46db:1a00::1","2a06:c701:46db:1a00:21d9:6346:9b9b:3579","DNS","172","Standard query response 0x24c3 AAAA dit.whatsapp.net CNAME scontent.whatsapp.net CNAME mmx-ds.cdn.whatsapp.net AAAA 2a03:2880:f242:1c2:face:b00c:0:167"
"187","10.214390","2a06:c701:46db:1a00:21d9:6346:9b9b:3579","2a03:2880:f242:1c2:face:b00c:0:167","TCP","86","51909  >  443 [SYN] Seq=0 Win=64800 Len=0 MSS=1440 WS=256 SACK_PERM"
"188","10.232732","2a03:2880:f242:c8:face:b00c:0:167","2a06:c701:46db:1a00:21d9:6346:9b9b:3579","TCP","74","443  >  51770 [ACK] Seq=879 Ack=1559 Win=350 Len=0"
"189","10.234625","2a03:2880:f242:c8:face:b00c:0:167","2a06:c701:46db:1a00:21d9:6346:9b9b:3579","TCP","74","443  >  51770 [ACK] Seq=879 Ack=2731 Win=361 Len=0"
"190","10.262434","2a03:2880:f242:1c2:face:b00c:0:167","2a06:c701:46db:1a00:21d9:6346:9b9b:3579","TCP","86","443  >  51909 [SYN, ACK] Seq=0 Ack=1 Win=65535 Len=0 MSS=1392 SACK_PERM WS=256"
"191","10.262586","2a06:c701:46db:1a00:21d9:6346:9b9b:3579","2a03:2880:f242:1c2:face:b00c:0:167","TCP","74","51909  >  443 [ACK] Seq=1 Ack=1 Win=132096 Len=0"
"192","10.263061","2a06:c701:46db:1a00:21d9:6346:9b9b:3579","2a03:2880:f242:1c2:face:b00c:0:167","TLSv1.3","591","Client Hello"
"193","10.314895","2a03:2880:f242:1c2:face:b00c:0:167","2a06:c701:46db:1a00:21d9:6346:9b9b:3579","TCP","74","443  >  51909 [ACK] Seq=1 Ack=518 Win=66816 Len=0"
"194","10.315963","2a03:2880:f242:1c2:face:b00c:0:167","2a06:c701:46db:1a00:21d9:6346:9b9b:3579","TLSv1.3","286","Server Hello, Change Cipher Spec, Encrypted Extensions, Finished"
"195","10.316623","2a06:c701:46db:1a00:21d9:6346:9b9b:3579","2a03:2880:f242:1c2:face:b00c:0:167","TLSv1.3","138","Change Cipher Spec, Finished"
"196","10.316926","2a06:c701:46db:1a00:21d9:6346:9b9b:3579","2a03:2880:f242:1c2:face:b00c:0:167","HTTP2","172","Magic, SETTINGS[0], WINDOW_UPDATE[0]"
"197","10.317546","2a06:c701:46db:1a00:21d9:6346:9b9b:3579","2a03:2880:f242:1c2:face:b00c:0:167","HTTP2","542","HEADERS[1]: POST /deidentified_telemetry"
"198","10.317703","2a06:c701:46db:1a00:21d9:6346:9b9b:3579","2a03:2880:f242:1c2:face:b00c:0:167","HTTP2","1107","DATA[1]"
"199","10.317861","2a06:c701:46db:1a00:21d9:6346:9b9b:3579","2a03:2880:f242:1c2:face:b00c:0:167","HTTP2","198","HEADERS[3]: POST /deidentified_telemetry"
"200","10.317922","2a06:c701:46db:1a00:21d9:6346:9b9b:3579","2a03:2880:f242:1c2:face:b00c:0:167","HTTP2","1107","DATA[3]"
"201","10.321998","2a03:2880:f242:c8:face:b00c:0:167","2a06:c701:46db:1a00:21d9:6346:9b9b:3579","TLSv1.2","138","Application Data"
"202","10.363769","2a03:2880:f242:1c2:face:b00c:0:167","2a06:c701:46db:1a00:21d9:6346:9b9b:3579","TLSv1.3","245","New Session Ticket"
"203","10.364056","2a03:2880:f242:1c2:face:b00c:0:167","2a06:c701:46db:1a00:21d9:6346:9b9b:3579","HTTP2","148","SETTINGS[0], WINDOW_UPDATE[0]"
"204","10.364091","2a06:c701:46db:1a00:21d9:6346:9b9b:3579","2a03:2880:f242:1c2:face:b00c:0:167","TCP","74","51909  >  443 [ACK] Seq=3338 Ack=458 Win=131584 Len=0"
"205","10.364188","2a06:c701:46db:1a00:21d9:6346:9b9b:3579","2a03:2880:f242:1c2:face:b00c:0:167","HTTP2","105","SETTINGS[0]"
"206","10.364980","2a03:2880:f242:1c2:face:b00c:0:167","2a06:c701:46db:1a00:21d9:6346:9b9b:3579","HTTP2","105","SETTINGS[0]"
"207","10.368000","2a03:2880:f242:1c2:face:b00c:0:167","2a06:c701:46db:1a00:21d9:6346:9b9b:3579","HTTP2","109","WINDOW_UPDATE[1]"
"208","10.368145","2a06:c701:46db:1a00:21d9:6346:9b9b:3579","2a03:2880:f242:1c2:face:b00c:0:167","TCP","74","51909  >  443 [ACK] Seq=3369 Ack=524 Win=131584 Len=0"
"209","10.371709","2a06:c701:46db:1a00:21d9:6346:9b9b:3579","2a03:2880:f242:c8:face:b00c:0:167","TCP","74","51770  >  443 [ACK] Seq=2731 Ack=943 Win=511 Len=0"
"210","10.372998","2a03:2880:f242:1c2:face:b00c:0:167","2a06:c701:46db:1a00:21d9:6346:9b9b:3579","TCP","74","443  >  51909 [ACK] Seq=524 Ack=2305 Win=69888 Len=0"
"211","10.373224","2a03:2880:f242:1c2:face:b00c:0:167","2a06:c701:46db:1a00:21d9:6346:9b9b:3579","HTTP2","109","WINDOW_UPDATE[3]"
"212","10.387644","10.0.0.7","239.255.255.250","SSDP","217","M-SEARCH * HTTP/1.1 "
"213","10.416673","2a03:2880:f242:1c2:face:b00c:0:167","2a06:c701:46db:1a00:21d9:6346:9b9b:3579","TCP","74","443  >  51909 [ACK] Seq=559 Ack=3369 Win=71936 Len=0"
"214","10.416673","2a03:2880:f242:1c2:face:b00c:0:167","2a06:c701:46db:1a00:21d9:6346:9b9b:3579","TCP","74","[TCP Dup ACK 213#1] 443  >  51909 [ACK] Seq=559 Ack=3369 Win=71936 Len=0"
"215","10.417837","2a06:c701:46db:1a00:21d9:6346:9b9b:3579","2a03:2880:f242:1c2:face:b00c:0:167","TCP","74","51909  >  443 [ACK] Seq=3369 Ack=559 Win=131584 Len=0"
"216","10.470482","2a03:2880:f242:1c2:face:b00c:0:167","2a06:c701:46db:1a00:21d9:6346:9b9b:3579","HTTP2/JSON","560","HEADERS[1]: 200 OK, DATA[1], JavaScript Object Notation (application/json)"
"217","10.473179","2a03:2880:f242:1c2:face:b00c:0:167","2a06:c701:46db:1a00:21d9:6346:9b9b:3579","HTTP2/JSON","276","HEADERS[3]: 200 OK, DATA[3], JavaScript Object Notation (application/json)"
"218","10.473263","2a06:c701:46db:1a00:21d9:6346:9b9b:3579","2a03:2880:f242:1c2:face:b00c:0:167","TCP","74","51909  >  443 [ACK] Seq=3369 Ack=1247 Win=130816 Len=0"
"219","10.481078","2a06:c701:46db:1a00:21d9:6346:9b9b:3579","2a00:1450:4028:800::200a","UDP","91","51173  >  443 Len=29"
"220","10.492984","2a00:1450:4028:800::200a","2a06:c701:46db:1a00:21d9:6346:9b9b:3579","UDP","87","443  >  51173 Len=25"
"221","10.888698","10.0.0.7","20.199.120.182","TLSv1.2","98","Application Data"
"222","10.953229","20.199.120.182","10.0.0.7","TLSv1.2","229","Application Data"
"223","10.996500","10.0.0.7","20.199.120.182","TCP","54","61001  >  443 [ACK] Seq=45 Ack=176 Win=512 Len=0"
"224","11.387800","10.0.0.7","239.255.255.250","SSDP","217","M-SEARCH * HTTP/1.1 "
"225","11.578974","HeightsT_99:7d:3b","Broadcast","ARP","60","Who has 10.0.0.4? Tell 10.0.0.138"
"226","11.578974","HeightsT_99:7d:3b","Broadcast","ARP","60","Who has 10.0.0.11? Tell 10.0.0.138"
"227","11.580819","HeightsT_99:7d:3b","Broadcast","ARP","60","Who has 10.0.0.3? Tell 10.0.0.138"
"228","11.580819","HeightsT_99:7d:3b","Broadcast","ARP","60","Who has 10.0.0.7? Tell 10.0.0.138"
"229","11.580819","HeightsT_99:7d:3b","Broadcast","ARP","60","Who has 10.0.0.2? Tell 10.0.0.138"
"230","11.580888","IntelCor_8e:ca:bf","HeightsT_99:7d:3b","ARP","42","10.0.0.7 is at 68:54:5a:8e:ca:bf"
"231","11.583605","10.0.0.138","10.0.0.7","NBNS","92","Name query NBSTAT *<00><00><00><00><00><00><00><00><00><00><00><00><00><00><00>"
"232","11.583744","10.0.0.7","10.0.0.138","NBNS","199","Name query response NBSTAT"
"233","12.396847","10.0.0.7","239.255.255.250","SSDP","217","M-SEARCH * HTTP/1.1 "
"234","12.693643","10.0.0.7","34.218.162.254","TCP","55","51895  >  443 [ACK] Seq=1 Ack=1 Win=512 Len=1 [TCP segment of a reassembled PDU]"
"235","12.755468","10.0.0.7","34.85.166.233","TCP","55","51897  >  443 [ACK] Seq=1 Ack=1 Win=515 Len=1 [TCP segment of a reassembled PDU]"
"236","12.906305","34.85.166.233","10.0.0.7","TCP","66","443  >  51897 [ACK] Seq=1 Ack=2 Win=331 Len=0 SLE=1 SRE=2"
"237","12.917275","34.218.162.254","10.0.0.7","TCP","66","443  >  51895 [ACK] Seq=1 Ack=2 Win=110 Len=0 SLE=1 SRE=2"
"238","13.582740","10.0.0.7","34.197.99.54","TCP","55","51894  >  443 [ACK] Seq=1 Ack=1 Win=511 Len=1 [TCP segment of a reassembled PDU]"
"239","13.613629","10.0.0.7","54.162.7.18","TCP","55","51901  >  443 [ACK] Seq=1 Ack=1 Win=513 Len=1 [TCP segment of a reassembled PDU]"
"240","13.729203","34.197.99.54","10.0.0.7","TCP","66","443  >  51894 [ACK] Seq=1 Ack=2 Win=203 Len=0 SLE=1 SRE=2"
"241","13.759092","54.162.7.18","10.0.0.7","TCP","66","443  >  51901 [ACK] Seq=1 Ack=2 Win=180 Len=0 SLE=1 SRE=2"
"242","13.894092","10.0.0.7","34.228.253.160","TCP","55","51902  >  443 [ACK] Seq=1 Ack=1 Win=516 Len=1 [TCP segment of a reassembled PDU]"
"243","14.035334","2a06:c701:46db:1a00:21d9:6346:9b9b:3579","2606:4700::6812:896","TCP","75","51856  >  443 [ACK] Seq=1 Ack=1 Win=510 Len=1 [TCP segment of a reassembled PDU]"
"244","14.044969","34.228.253.160","10.0.0.7","TCP","66","443  >  51902 [ACK] Seq=1 Ack=2 Win=115 Len=0 SLE=1 SRE=2"
"245","14.044969","2606:4700::6812:896","2a06:c701:46db:1a00:21d9:6346:9b9b:3579","TCP","86","443  >  51856 [ACK] Seq=1 Ack=2 Win=8 Len=0 SLE=1 SRE=2"
"246","14.239082","2a06:c701:46db:1a00:21d9:6346:9b9b:3579","2a00:1450:4028:802::2013","TCP","75","51857  >  443 [ACK] Seq=1 Ack=1 Win=514 Len=1 [TCP segment of a reassembled PDU]"
"247","14.248242","2a00:1450:4028:802::2013","2a06:c701:46db:1a00:21d9:6346:9b9b:3579","TCP","86","443  >  51857 [ACK] Seq=1 Ack=2 Win=484 Len=0 SLE=1 SRE=2"
"248","14.440426","10.0.0.7","34.85.166.233","TCP","55","51896  >  443 [ACK] Seq=1 Ack=1 Win=515 Len=1 [TCP segment of a reassembled PDU]"
"249","14.586439","34.85.166.233","10.0.0.7","TCP","66","443  >  51896 [ACK] Seq=1 Ack=2 Win=331 Len=0 SLE=1 SRE=2"
"250","14.760683","204.79.197.222","10.0.0.7","TCP","60","443  >  51880 [RST, ACK] Seq=1 Ack=1 Win=0 Len=0"
"251","14.767892","10.0.0.7","3.221.176.206","TCP","55","51899  >  443 [ACK] Seq=1 Ack=1 Win=511 Len=1 [TCP segment of a reassembled PDU]"
"252","14.915130","3.221.176.206","10.0.0.7","TCP","66","443  >  51899 [ACK] Seq=1 Ack=2 Win=123 Len=0 SLE=1 SRE=2"
"253","14.999391","2a06:c701:46db:1a00:21d9:6346:9b9b:3579","2a06:c701:46db:1a00::1","ICMPv6","86","Neighbor Solicitation for 2a06:c701:46db:1a00::1 from 68:54:5a:8e:ca:bf"
"254","15.001326","2a06:c701:46db:1a00::1","2a06:c701:46db:1a00:21d9:6346:9b9b:3579","ICMPv6","78","Neighbor Advertisement 2a06:c701:46db:1a00::1 (rtr, sol)"
"255","16.182792","10.0.0.7","107.178.240.159","TCP","55","51787  >  443 [ACK] Seq=1 Ack=1 Win=512 Len=1 [TCP segment of a reassembled PDU]"
"256","16.193113","107.178.240.159","10.0.0.7","TCP","66","443  >  51787 [ACK] Seq=1 Ack=2 Win=553 Len=0 SLE=1 SRE=2"
"257","16.913278","2a03:2880:f242:c8:face:b00c:0:167","2a06:c701:46db:1a00:21d9:6346:9b9b:3579","TLSv1.2","151","Application Data"
"258","16.937849","2a06:c701:46db:1a00:21d9:6346:9b9b:3579","2a00:1450:4028:808::200e","UDP","880","52649  >  443 Len=818"
"259","16.947160","2a00:1450:4028:808::200e","2a06:c701:46db:1a00:21d9:6346:9b9b:3579","UDP","92","443  >  52649 Len=30"
"260","16.949349","2a06:c701:46db:1a00:21d9:6346:9b9b:3579","2a00:1450:4028:808::200e","UDP","95","52649  >  443 Len=33"
"261","16.963278","2a06:c701:46db:1a00:21d9:6346:9b9b:3579","2a03:2880:f242:c8:face:b00c:0:167","TCP","74","51770  >  443 [ACK] Seq=2731 Ack=1020 Win=511 Len=0"
"262","17.030000","2a00:1450:4028:808::200e","2a06:c701:46db:1a00:21d9:6346:9b9b:3579","UDP","134","443  >  52649 Len=72"
"263","17.030419","2a06:c701:46db:1a00:21d9:6346:9b9b:3579","2a00:1450:4028:808::200e","UDP","99","52649  >  443 Len=37"
"264","17.030544","2a00:1450:4028:808::200e","2a06:c701:46db:1a00:21d9:6346:9b9b:3579","UDP","85","443  >  52649 Len=23"
"265","17.033019","2a06:c701:46db:1a00:21d9:6346:9b9b:3579","2a00:1450:4028:808::200e","UDP","95","52649  >  443 Len=33"
"266","17.039810","2a00:1450:4028:808::200e","2a06:c701:46db:1a00:21d9:6346:9b9b:3579","UDP","88","443  >  52649 Len=26"
"267","17.415478","HeightsT_99:7d:3b","Broadcast","0x1ee4","206","Ethernet II"
"268","18.843334","34.85.166.233","10.0.0.7","TLSv1.2","81","Application Data"
"269","18.843999","10.0.0.7","34.85.166.233","TLSv1.2","85","Application Data"
"270","18.995808","2a06:c701:46db:1a00:21d9:6346:9b9b:3579","2a06:c701:46db:1a00::1","DNS","96","Standard query 0x6425 A web.whatsapp.com"
"271","18.996162","2a06:c701:46db:1a00:21d9:6346:9b9b:3579","2a06:c701:46db:1a00::1","DNS","96","Standard query 0x3a95 AAAA web.whatsapp.com"
"272","18.999190","34.85.166.233","10.0.0.7","TCP","56","443  >  51904 [ACK] Seq=56 Ack=64 Win=331 Len=0"
"273","19.008818","2a06:c701:46db:1a00::1","2a06:c701:46db:1a00:21d9:6346:9b9b:3579","DNS","149","Standard query response 0x6425 A web.whatsapp.com CNAME mmx-ds.cdn.whatsapp.net A 157.240.195.56"
"274","19.012421","2a06:c701:46db:1a00::1","2a06:c701:46db:1a00:21d9:6346:9b9b:3579","DNS","161","Standard query response 0x3a95 AAAA web.whatsapp.com CNAME mmx-ds.cdn.whatsapp.net AAAA 2a03:2880:f242:1c2:face:b00c:0:167"
"275","19.014083","2a06:c701:46db:1a00:21d9:6346:9b9b:3579","2a03:2880:f242:1c2:face:b00c:0:167","QUIC","1292","Initial, DCID=075757a4807791ae, PKN: 1, PADDING, PING, PING, CRYPTO, PADDING"
"276","19.015114","2a06:c701:46db:1a00:21d9:6346:9b9b:3579","2a03:2880:f242:1c2:face:b00c:0:167","HTTP3","141","0-RTT, DCID=075757a4807791ae, PKN: 2, STREAM(2), SETTINGS"
"277","19.015387","2a06:c701:46db:1a00:21d9:6346:9b9b:3579","2a03:2880:f242:1c2:face:b00c:0:167","HTTP3","494","0-RTT, DCID=075757a4807791ae, PKN: 3, STREAM(2), PRIORITY_UPDATE, STREAM(10), STREAM(0), HEADERS"
"278","19.071534","2a03:2880:f242:1c2:face:b00c:0:167","2a06:c701:46db:1a00:21d9:6346:9b9b:3579","QUIC","1294","Initial, SCID=861d01254c2fc9a4, PKN: 15643494, CRYPTO, ACK, PADDING"
"279","19.072064","2a03:2880:f242:1c2:face:b00c:0:167","2a06:c701:46db:1a00:21d9:6346:9b9b:3579","QUIC","271","Handshake, SCID=861d01254c2fc9a4, PKN: 15643494, CRYPTO"
"280","19.072064","2a03:2880:f242:1c2:face:b00c:0:167","2a06:c701:46db:1a00:21d9:6346:9b9b:3579","QUIC","110","Protected Payload (KP0), PKN: 15643494, ACK, PADDING"
