"No.","Time","Source","Destination","Protocol","Length","Info"
"1","0.000000","54.83.164.46","10.0.0.7","TLSv1.2","89","Application Data"
"2","0.000650","10.0.0.7","54.83.164.46","TLSv1.2","93","Application Data"
"3","0.058891","2a03:2880:f242:1c2:face:b00c:0:167","2a06:c701:46db:1a00:21d9:6346:9b9b:3579","TLSv1.2","323","Application Data"
"4","0.114531","2a06:c701:46db:1a00:21d9:6346:9b9b:3579","2a03:2880:f242:1c2:face:b00c:0:167","TCP","74","57484  >  443 [ACK] Seq=1 Ack=250 Win=513 Len=0"
"5","0.126925","20.199.120.182","10.0.0.7","TLSv1.2","433","Application Data"
"6","0.142981","10.0.0.7","20.199.120.182","TLSv1.2","189","Application Data"
"7","0.149114","54.83.164.46","10.0.0.7","TCP","54","443  >  58710 [ACK] Seq=36 Ack=40 Win=180 Len=0"
"8","0.176584","2a06:c701:46db:1a00:21d9:6346:9b9b:3579","2a00:1450:4028:802::200a","UDP","91","58775  >  443 Len=29"
"9","0.191131","2a00:1450:4028:802::200a","2a06:c701:46db:1a00:21d9:6346:9b9b:3579","UDP","87","443  >  58775 Len=25"
"10","0.194241","2a06:c701:46db:1a00:21d9:6346:9b9b:3579","2a03:2880:f242:1c2:face:b00c:0:167","TCP","74","58754  >  443 [FIN, ACK] Seq=1 Ack=1 Win=1019 Len=0"
"11","0.243570","2a03:2880:f242:1c2:face:b00c:0:167","2a06:c701:46db:1a00:21d9:6346:9b9b:3579","TCP","74","443  >  58754 [RST] Seq=1 Win=0 Len=0"
"12","0.261571","20.199.120.182","10.0.0.7","TCP","54","443  >  49600 [ACK] Seq=380 Ack=136 Win=8057 Len=0"
"13","0.396028","2a06:c701:46db:1a00:21d9:6346:9b9b:3579","2a03:2880:f242:c6:face:b00c:0:7260","TCP","86","58761  >  80 [SYN] Seq=0 Win=64800 Len=0 MSS=1440 WS=256 SACK_PERM"
"14","0.446848","2a03:2880:f242:c6:face:b00c:0:7260","2a06:c701:46db:1a00:21d9:6346:9b9b:3579","TCP","86","80  >  58761 [SYN, ACK] Seq=0 Ack=1 Win=65535 Len=0 MSS=1392 SACK_PERM WS=256"
"15","0.447104","2a06:c701:46db:1a00:21d9:6346:9b9b:3579","2a03:2880:f242:c6:face:b00c:0:7260","TCP","74","58761  >  80 [ACK] Seq=1 Ack=1 Win=66816 Len=0"
"16","0.449537","2a06:c701:46db:1a00:21d9:6346:9b9b:3579","2a03:2880:f242:c6:face:b00c:0:7260","TCP","495","58761  >  80 [PSH, ACK] Seq=1 Ack=1 Win=66816 Len=421 [TCP segment of a reassembled PDU]"
"17","0.510896","2a03:2880:f242:c6:face:b00c:0:7260","2a06:c701:46db:1a00:21d9:6346:9b9b:3579","TCP","74","80  >  58761 [ACK] Seq=1 Ack=422 Win=66816 Len=0"
"18","0.596252","2a03:2880:f242:c6:face:b00c:0:7260","2a06:c701:46db:1a00:21d9:6346:9b9b:3579","TCP","203","80  >  58761 [PSH, ACK] Seq=1 Ack=422 Win=66816 Len=129 [TCP segment of a reassembled PDU]"
"19","0.619038","2a03:2880:f242:c6:face:b00c:0:7260","2a06:c701:46db:1a00:21d9:6346:9b9b:3579","TCP","137","80  >  58761 [PSH, ACK] Seq=130 Ack=422 Win=66816 Len=63 [TCP segment of a reassembled PDU]"
"20","0.619295","2a06:c701:46db:1a00:21d9:6346:9b9b:3579","2a03:2880:f242:c6:face:b00c:0:7260","TCP","74","58761  >  80 [ACK] Seq=422 Ack=193 Win=66560 Len=0"
"21","0.619735","2a03:2880:f242:c6:face:b00c:0:7260","2a06:c701:46db:1a00:21d9:6346:9b9b:3579","TCP","130","80  >  58761 [PSH, ACK] Seq=193 Ack=422 Win=66816 Len=56 [TCP segment of a reassembled PDU]"
"22","0.630754","2a06:c701:46db:1a00:21d9:6346:9b9b:3579","2a03:2880:f242:c6:face:b00c:0:7260","TCP","134","58761  >  80 [PSH, ACK] Seq=422 Ack=249 Win=66560 Len=60 [TCP segment of a reassembled PDU]"
"23","0.643954","2a06:c701:46db:1a00:21d9:6346:9b9b:3579","2a03:2880:f242:1c2:face:b00c:0:167","TLSv1.2","170","Application Data"
"24","0.682858","2a03:2880:f242:c6:face:b00c:0:7260","2a06:c701:46db:1a00:21d9:6346:9b9b:3579","TCP","74","80  >  58761 [ACK] Seq=249 Ack=482 Win=66816 Len=0"
"25","0.692014","2a03:2880:f242:1c2:face:b00c:0:167","2a06:c701:46db:1a00:21d9:6346:9b9b:3579","TCP","74","443  >  57484 [ACK] Seq=250 Ack=97 Win=3841 Len=0"
"26","0.743879","2a03:2880:f242:c6:face:b00c:0:7260","2a06:c701:46db:1a00:21d9:6346:9b9b:3579","TCP","126","80  >  58761 [PSH, ACK] Seq=249 Ack=482 Win=66816 Len=52 [TCP segment of a reassembled PDU]"
"27","0.744184","2a03:2880:f242:c6:face:b00c:0:7260","2a06:c701:46db:1a00:21d9:6346:9b9b:3579","TCP","133","80  >  58761 [PSH, ACK] Seq=301 Ack=482 Win=66816 Len=59 [TCP segment of a reassembled PDU]"
"28","0.744343","2a06:c701:46db:1a00:21d9:6346:9b9b:3579","2a03:2880:f242:c6:face:b00c:0:7260","TCP","74","58761  >  80 [ACK] Seq=482 Ack=360 Win=66304 Len=0"
"29","0.745596","2a06:c701:46db:1a00:21d9:6346:9b9b:3579","2a03:2880:f242:c6:face:b00c:0:7260","TCP","171","58761  >  80 [PSH, ACK] Seq=482 Ack=360 Win=66304 Len=97 [TCP segment of a reassembled PDU]"
"30","0.745953","2a06:c701:46db:1a00:21d9:6346:9b9b:3579","2a03:2880:f242:c6:face:b00c:0:7260","TCP","121","58761  >  80 [PSH, ACK] Seq=579 Ack=360 Win=66304 Len=47 [TCP segment of a reassembled PDU]"
"31","0.746226","2a06:c701:46db:1a00:21d9:6346:9b9b:3579","2a03:2880:f242:c6:face:b00c:0:7260","TCP","116","58761  >  80 [PSH, ACK] Seq=626 Ack=360 Win=66304 Len=42 [TCP segment of a reassembled PDU]"
"32","0.747586","2a06:c701:46db:1a00:21d9:6346:9b9b:3579","2a03:2880:f242:c6:face:b00c:0:7260","TCP","212","58761  >  80 [PSH, ACK] Seq=668 Ack=360 Win=66304 Len=138 [TCP segment of a reassembled PDU]"
"33","0.747883","2a03:2880:f242:c6:face:b00c:0:7260","2a06:c701:46db:1a00:21d9:6346:9b9b:3579","TCP","125","80  >  58761 [PSH, ACK] Seq=360 Ack=482 Win=66816 Len=51 [TCP segment of a reassembled PDU]"
"34","0.748741","2a03:2880:f242:c6:face:b00c:0:7260","2a06:c701:46db:1a00:21d9:6346:9b9b:3579","TCP","381","80  >  58761 [PSH, ACK] Seq=411 Ack=482 Win=66816 Len=307 [TCP segment of a reassembled PDU]"
"35","0.748879","2a06:c701:46db:1a00:21d9:6346:9b9b:3579","2a03:2880:f242:c6:face:b00c:0:7260","TCP","74","58761  >  80 [ACK] Seq=806 Ack=718 Win=66048 Len=0"
"36","0.748969","2a03:2880:f242:c6:face:b00c:0:7260","2a06:c701:46db:1a00:21d9:6346:9b9b:3579","TCP","117","80  >  58761 [PSH, ACK] Seq=718 Ack=482 Win=66816 Len=43 [TCP segment of a reassembled PDU]"
"37","0.751673","2a06:c701:46db:1a00:21d9:6346:9b9b:3579","2a03:2880:f242:c6:face:b00c:0:7260","TCP","147","58761  >  80 [PSH, ACK] Seq=806 Ack=761 Win=66048 Len=73 [TCP segment of a reassembled PDU]"
"38","0.767210","2a03:2880:f242:c6:face:b00c:0:7260","2a06:c701:46db:1a00:21d9:6346:9b9b:3579","TCP","143","80  >  58761 [PSH, ACK] Seq=761 Ack=482 Win=66816 Len=69 [TCP segment of a reassembled PDU]"
"39","0.771320","2a06:c701:46db:1a00:21d9:6346:9b9b:3579","2a03:2880:f242:c6:face:b00c:0:7260","TCP","147","58761  >  80 [PSH, ACK] Seq=879 Ack=830 Win=65792 Len=73 [TCP segment of a reassembled PDU]"
"40","0.771784","2a06:c701:46db:1a00:21d9:6346:9b9b:3579","2a03:2880:f242:c6:face:b00c:0:7260","TCP","121","58761  >  80 [PSH, ACK] Seq=952 Ack=830 Win=65792 Len=47 [TCP segment of a reassembled PDU]"
"41","0.797439","2a03:2880:f242:c6:face:b00c:0:7260","2a06:c701:46db:1a00:21d9:6346:9b9b:3579","TCP","74","80  >  58761 [ACK] Seq=830 Ack=579 Win=66816 Len=0"
"42","0.797439","2a03:2880:f242:c6:face:b00c:0:7260","2a06:c701:46db:1a00:21d9:6346:9b9b:3579","TCP","74","80  >  58761 [ACK] Seq=830 Ack=626 Win=66816 Len=0"
"43","0.797439","2a03:2880:f242:c6:face:b00c:0:7260","2a06:c701:46db:1a00:21d9:6346:9b9b:3579","TCP","74","80  >  58761 [ACK] Seq=830 Ack=668 Win=66816 Len=0"
"44","0.797439","2a03:2880:f242:c6:face:b00c:0:7260","2a06:c701:46db:1a00:21d9:6346:9b9b:3579","TCP","74","80  >  58761 [ACK] Seq=830 Ack=806 Win=67840 Len=0"
"45","0.799667","2a03:2880:f242:c6:face:b00c:0:7260","2a06:c701:46db:1a00:21d9:6346:9b9b:3579","TCP","74","80  >  58761 [ACK] Seq=830 Ack=879 Win=67840 Len=0"
"46","0.820233","2a03:2880:f242:c6:face:b00c:0:7260","2a06:c701:46db:1a00:21d9:6346:9b9b:3579","TCP","74","80  >  58761 [ACK] Seq=830 Ack=952 Win=67840 Len=0"
"47","0.820233","2a03:2880:f242:c6:face:b00c:0:7260","2a06:c701:46db:1a00:21d9:6346:9b9b:3579","TCP","74","80  >  58761 [ACK] Seq=830 Ack=999 Win=67840 Len=0"
"48","0.896750","2a03:2880:f242:c6:face:b00c:0:7260","2a06:c701:46db:1a00:21d9:6346:9b9b:3579","TCP","185","80  >  58761 [PSH, ACK] Seq=830 Ack=999 Win=67840 Len=111 [TCP segment of a reassembled PDU]"
"49","0.904819","2a03:2880:f242:c6:face:b00c:0:7260","2a06:c701:46db:1a00:21d9:6346:9b9b:3579","TCP","123","80  >  58761 [PSH, ACK] Seq=941 Ack=999 Win=67840 Len=49 [TCP segment of a reassembled PDU]"
"50","0.905074","2a06:c701:46db:1a00:21d9:6346:9b9b:3579","2a03:2880:f242:c6:face:b00c:0:7260","TCP","74","58761  >  80 [ACK] Seq=999 Ack=990 Win=65792 Len=0"
"51","0.907278","2a03:2880:f242:c6:face:b00c:0:7260","2a06:c701:46db:1a00:21d9:6346:9b9b:3579","TCP","122","80  >  58761 [PSH, ACK] Seq=990 Ack=999 Win=67840 Len=48 [TCP segment of a reassembled PDU]"
"52","0.915190","2a03:2880:f242:c6:face:b00c:0:7260","2a06:c701:46db:1a00:21d9:6346:9b9b:3579","TCP","267","80  >  58761 [PSH, ACK] Seq=1038 Ack=999 Win=67840 Len=193 [TCP segment of a reassembled PDU]"
"53","0.915406","2a06:c701:46db:1a00:21d9:6346:9b9b:3579","2a03:2880:f242:c6:face:b00c:0:7260","TCP","74","58761  >  80 [ACK] Seq=999 Ack=1231 Win=65536 Len=0"
"54","0.921150","2a03:2880:f242:c6:face:b00c:0:7260","2a06:c701:46db:1a00:21d9:6346:9b9b:3579","TCP","600","80  >  58761 [PSH, ACK] Seq=1231 Ack=999 Win=67840 Len=526 [TCP segment of a reassembled PDU]"
"55","0.924662","2a03:2880:f242:c6:face:b00c:0:7260","2a06:c701:46db:1a00:21d9:6346:9b9b:3579","TCP","123","80  >  58761 [PSH, ACK] Seq=1757 Ack=999 Win=67840 Len=49 [TCP segment of a reassembled PDU]"
"56","0.924826","2a06:c701:46db:1a00:21d9:6346:9b9b:3579","2a03:2880:f242:c6:face:b00c:0:7260","TCP","74","58761  >  80 [ACK] Seq=999 Ack=1806 Win=66816 Len=0"
"57","0.925484","2a06:c701:46db:1a00:21d9:6346:9b9b:3579","2a03:2880:f242:c6:face:b00c:0:7260","TCP","121","58761  >  80 [PSH, ACK] Seq=999 Ack=1806 Win=66816 Len=47 [TCP segment of a reassembled PDU]"
"58","0.984235","2a03:2880:f242:c6:face:b00c:0:7260","2a06:c701:46db:1a00:21d9:6346:9b9b:3579","TCP","74","80  >  58761 [ACK] Seq=1806 Ack=1046 Win=67840 Len=0"
"59","1.129777","2a03:2880:f242:c6:face:b00c:0:7260","2a06:c701:46db:1a00:21d9:6346:9b9b:3579","TCP","1309","80  >  58761 [PSH, ACK] Seq=1806 Ack=1046 Win=67840 Len=1235 [TCP segment of a reassembled PDU]"
"60","1.134666","2a06:c701:46db:1a00:21d9:6346:9b9b:3579","2a06:c700:2003:2:face:b00c:3333:7020","TCP","86","58762  >  443 [SYN] Seq=0 Win=65535 Len=0 MSS=1440 WS=256 SACK_PERM"
"61","1.146688","2a06:c700:2003:2:face:b00c:3333:7020","2a06:c701:46db:1a00:21d9:6346:9b9b:3579","TCP","86","443  >  58762 [SYN, ACK] Seq=0 Ack=1 Win=32016 Len=0 MSS=1392 SACK_PERM WS=256"
"62","1.146905","2a06:c701:46db:1a00:21d9:6346:9b9b:3579","2a06:c700:2003:2:face:b00c:3333:7020","TCP","74","58762  >  443 [ACK] Seq=1 Ack=1 Win=262144 Len=0"
"63","1.148589","2a06:c701:46db:1a00:21d9:6346:9b9b:3579","2a06:c700:2003:2:face:b00c:3333:7020","TLSv1.3","562","Client Hello"
"64","1.165558","2a06:c700:2003:2:face:b00c:3333:7020","2a06:c701:46db:1a00:21d9:6346:9b9b:3579","TCP","74","443  >  58762 [ACK] Seq=1 Ack=489 Win=31744 Len=0"
"65","1.165558","2a06:c700:2003:2:face:b00c:3333:7020","2a06:c701:46db:1a00:21d9:6346:9b9b:3579","TLSv1.3","286","Server Hello, Change Cipher Spec, Application Data"
"66","1.165808","2a06:c701:46db:1a00:21d9:6346:9b9b:3579","2a06:c700:2003:2:face:b00c:3333:7020","TCP","74","58762  >  443 [ACK] Seq=489 Ack=213 Win=261888 Len=0"
"67","1.168501","2a06:c701:46db:1a00:21d9:6346:9b9b:3579","2a06:c700:2003:2:face:b00c:3333:7020","TLSv1.3","138","Change Cipher Spec, Application Data"
"68","1.173073","2a06:c701:46db:1a00:21d9:6346:9b9b:3579","2a06:c700:2003:2:face:b00c:3333:7020","TLSv1.3","154","Application Data"
"69","1.173188","2a06:c701:46db:1a00:21d9:6346:9b9b:3579","2a03:2880:f242:c6:face:b00c:0:7260","TCP","74","58761  >  80 [ACK] Seq=1046 Ack=3041 Win=65536 Len=0"
"70","1.173637","2a06:c701:46db:1a00:21d9:6346:9b9b:3579","2a06:c700:2003:2:face:b00c:3333:7020","TLSv1.3","232","Application Data"
"71","1.175747","2a06:c700:2003:2:face:b00c:3333:7020","2a06:c701:46db:1a00:21d9:6346:9b9b:3579","TLSv1.3","258","Application Data"
"72","1.175912","2a06:c701:46db:1a00:21d9:6346:9b9b:3579","2a06:c700:2003:2:face:b00c:3333:7020","TCP","74","58762  >  443 [ACK] Seq=791 Ack=397 Win=261632 Len=0"
"73","1.176949","2a06:c700:2003:2:face:b00c:3333:7020","2a06:c701:46db:1a00:21d9:6346:9b9b:3579","TLSv1.3","148","Application Data"
"74","1.177029","2a06:c701:46db:1a00:21d9:6346:9b9b:3579","2a06:c700:2003:2:face:b00c:3333:7020","TCP","74","58762  >  443 [ACK] Seq=791 Ack=471 Win=261632 Len=0"
"75","1.177151","2a06:c701:46db:1a00:21d9:6346:9b9b:3579","2a06:c700:2003:2:face:b00c:3333:7020","TLSv1.3","105","Application Data"
"76","1.180819","2a06:c700:2003:2:face:b00c:3333:7020","2a06:c701:46db:1a00:21d9:6346:9b9b:3579","TLSv1.3","105","Application Data"
"77","1.181000","2a06:c701:46db:1a00:21d9:6346:9b9b:3579","2a06:c700:2003:2:face:b00c:3333:7020","TCP","74","58762  >  443 [ACK] Seq=822 Ack=502 Win=261632 Len=0"
"78","1.183979","2a06:c700:2003:2:face:b00c:3333:7020","2a06:c701:46db:1a00:21d9:6346:9b9b:3579","TLSv1.3","177","Application Data"
"79","1.184146","2a06:c701:46db:1a00:21d9:6346:9b9b:3579","2a06:c700:2003:2:face:b00c:3333:7020","TCP","74","58762  >  443 [ACK] Seq=822 Ack=605 Win=261376 Len=0"
"80","1.186908","2a06:c701:46db:1a00:21d9:6346:9b9b:3579","2a06:c700:2003:10:face:b00c:3333:7020","TCP","86","58763  >  443 [SYN] Seq=0 Win=65535 Len=0 MSS=1440 WS=256 SACK_PERM"
"81","1.196543","2a06:c700:2003:10:face:b00c:3333:7020","2a06:c701:46db:1a00:21d9:6346:9b9b:3579","TCP","86","443  >  58763 [SYN, ACK] Seq=0 Ack=1 Win=32016 Len=0 MSS=1392 SACK_PERM WS=256"
"82","1.196767","2a06:c701:46db:1a00:21d9:6346:9b9b:3579","2a06:c700:2003:10:face:b00c:3333:7020","TCP","74","58763  >  443 [ACK] Seq=1 Ack=1 Win=262144 Len=0"
"83","1.198160","2a06:c701:46db:1a00:21d9:6346:9b9b:3579","2a06:c700:2003:10:face:b00c:3333:7020","TLSv1.3","562","Client Hello"
"84","1.210224","2a06:c700:2003:10:face:b00c:3333:7020","2a06:c701:46db:1a00:21d9:6346:9b9b:3579","TCP","74","443  >  58763 [ACK] Seq=1 Ack=489 Win=31744 Len=0"
"85","1.211710","2a06:c700:2003:10:face:b00c:3333:7020","2a06:c701:46db:1a00:21d9:6346:9b9b:3579","TLSv1.3","286","Server Hello, Change Cipher Spec, Application Data"
"86","1.211902","2a06:c701:46db:1a00:21d9:6346:9b9b:3579","2a06:c700:2003:10:face:b00c:3333:7020","TCP","74","58763  >  443 [ACK] Seq=489 Ack=213 Win=261888 Len=0"
"87","1.213215","2a06:c701:46db:1a00:21d9:6346:9b9b:3579","2a06:c700:2003:10:face:b00c:3333:7020","TLSv1.3","138","Change Cipher Spec, Application Data"
"88","1.215338","2a06:c701:46db:1a00:21d9:6346:9b9b:3579","2a06:c700:2003:10:face:b00c:3333:7020","TLSv1.3","154","Application Data"
"89","1.215799","2a06:c701:46db:1a00:21d9:6346:9b9b:3579","2a06:c700:2003:10:face:b00c:3333:7020","TLSv1.3","232","Application Data"
"90","1.220842","2a03:2880:f242:c6:face:b00c:0:7260","2a06:c701:46db:1a00:21d9:6346:9b9b:3579","TCP","1309","[TCP Spurious Retransmission] 80  >  58761 [PSH, ACK] Seq=1806 Ack=1046 Win=67840 Len=1235"
"91","1.220943","2a06:c701:46db:1a00:21d9:6346:9b9b:3579","2a03:2880:f242:c6:face:b00c:0:7260","TCP","86","[TCP Dup ACK 69#1] 58761  >  80 [ACK] Seq=1046 Ack=3041 Win=65536 Len=0 SLE=1806 SRE=3041"
"92","1.221317","2a06:c700:2003:10:face:b00c:3333:7020","2a06:c701:46db:1a00:21d9:6346:9b9b:3579","TLSv1.3","258","Application Data"
"93","1.221424","2a06:c701:46db:1a00:21d9:6346:9b9b:3579","2a06:c700:2003:10:face:b00c:3333:7020","TCP","74","58763  >  443 [ACK] Seq=791 Ack=397 Win=261632 Len=0"
"94","1.222079","2a06:c700:2003:10:face:b00c:3333:7020","2a06:c701:46db:1a00:21d9:6346:9b9b:3579","TLSv1.3","148","Application Data"
"95","1.222130","2a06:c701:46db:1a00:21d9:6346:9b9b:3579","2a06:c700:2003:10:face:b00c:3333:7020","TCP","74","58763  >  443 [ACK] Seq=791 Ack=471 Win=261632 Len=0"
"96","1.222573","2a06:c701:46db:1a00:21d9:6346:9b9b:3579","2a06:c700:2003:10:face:b00c:3333:7020","TLSv1.3","105","Application Data"
"97","1.223256","2a06:c700:2003:10:face:b00c:3333:7020","2a06:c701:46db:1a00:21d9:6346:9b9b:3579","TLSv1.3","105","Application Data"
"98","1.223300","2a06:c701:46db:1a00:21d9:6346:9b9b:3579","2a06:c700:2003:10:face:b00c:3333:7020","TCP","74","58763  >  443 [ACK] Seq=822 Ack=502 Win=261632 Len=0"
"99","1.224144","2a06:c700:2003:10:face:b00c:3333:7020","2a06:c701:46db:1a00:21d9:6346:9b9b:3579","TLSv1.3","177","Application Data"
"100","1.224183","2a06:c701:46db:1a00:21d9:6346:9b9b:3579","2a06:c700:2003:10:face:b00c:3333:7020","TCP","74","58763  >  443 [ACK] Seq=822 Ack=605 Win=261376 Len=0"
"101","1.227005","2a06:c701:46db:1a00:21d9:6346:9b9b:3579","2a06:c700:2003:10:face:b00c:3333:7020","TLSv1.3","117","Application Data"
"102","1.227434","2a06:c700:2003:2:face:b00c:3333:7020","2a06:c701:46db:1a00:21d9:6346:9b9b:3579","TCP","74","443  >  58762 [ACK] Seq=605 Ack=822 Win=31744 Len=0"
"103","1.234929","2a06:c700:2003:10:face:b00c:3333:7020","2a06:c701:46db:1a00:21d9:6346:9b9b:3579","TCP","74","443  >  58763 [ACK] Seq=605 Ack=865 Win=31744 Len=0"
"104","1.235141","2a06:c700:2003:10:face:b00c:3333:7020","2a06:c701:46db:1a00:21d9:6346:9b9b:3579","TLSv1.3","135","Application Data"
"105","1.235268","2a06:c701:46db:1a00:21d9:6346:9b9b:3579","2a06:c700:2003:10:face:b00c:3333:7020","TCP","74","58763  >  443 [ACK] Seq=865 Ack=666 Win=261376 Len=0"
"106","1.237894","2a06:c701:46db:1a00:21d9:6346:9b9b:3579","2a06:c700:2003:2:face:b00c:3333:7020","TLSv1.3","117","Application Data"
"107","1.246137","2a03:2880:f242:1c2:face:b00c:0:167","2a06:c701:46db:1a00:21d9:6346:9b9b:3579","TLSv1.2","307","Application Data"
"108","1.246614","2a06:c700:2003:2:face:b00c:3333:7020","2a06:c701:46db:1a00:21d9:6346:9b9b:3579","TCP","74","443  >  58762 [ACK] Seq=605 Ack=865 Win=31744 Len=0"
"109","1.247144","2a06:c700:2003:2:face:b00c:3333:7020","2a06:c701:46db:1a00:21d9:6346:9b9b:3579","TLSv1.3","135","Application Data"
"110","1.247318","2a06:c701:46db:1a00:21d9:6346:9b9b:3579","2a06:c700:2003:2:face:b00c:3333:7020","TCP","74","58762  >  443 [ACK] Seq=865 Ack=666 Win=261376 Len=0"
"111","1.248779","2a03:2880:f242:c6:face:b00c:0:7260","2a06:c701:46db:1a00:21d9:6346:9b9b:3579","TCP","287","HTTP/1.1 200 OK  [TCP segment of a reassembled PDU]"
"112","1.252488","2a06:c701:46db:1a00:21d9:6346:9b9b:3579","2a03:2880:f242:c8:face:b00c:0:167","TCP","86","58764  >  443 [SYN] Seq=0 Win=65535 Len=0 MSS=1440 WS=256 SACK_PERM"
"113","1.263644","2a06:c701:46db:1a00:21d9:6346:9b9b:3579","2a03:2880:f242:c6:face:b00c:0:7260","TCP","147","58761  >  80 [PSH, ACK] Seq=1046 Ack=3254 Win=66816 Len=73 [TCP segment of a reassembled PDU]"
"114","1.299000","2a06:c701:46db:1a00:21d9:6346:9b9b:3579","2a03:2880:f242:1c2:face:b00c:0:167","TCP","74","57484  >  443 [ACK] Seq=97 Ack=483 Win=512 Len=0"
"115","1.304628","2a03:2880:f242:c8:face:b00c:0:167","2a06:c701:46db:1a00:21d9:6346:9b9b:3579","TCP","86","443  >  58764 [SYN, ACK] Seq=0 Ack=1 Win=65535 Len=0 MSS=1392 SACK_PERM WS=256"
"116","1.304901","2a06:c701:46db:1a00:21d9:6346:9b9b:3579","2a03:2880:f242:c8:face:b00c:0:167","TCP","74","58764  >  443 [ACK] Seq=1 Ack=1 Win=262144 Len=0"
"117","1.308966","2a06:c701:46db:1a00:21d9:6346:9b9b:3579","2a03:2880:f242:c8:face:b00c:0:167","TLSv1.3","547","Client Hello"
"118","1.322754","2a03:2880:f242:c6:face:b00c:0:7260","2a06:c701:46db:1a00:21d9:6346:9b9b:3579","TCP","74","80  >  58761 [ACK] Seq=3254 Ack=1119 Win=67840 Len=0"
"119","1.362702","2a03:2880:f242:c8:face:b00c:0:167","2a06:c701:46db:1a00:21d9:6346:9b9b:3579","TCP","74","443  >  58764 [ACK] Seq=1 Ack=474 Win=66816 Len=0"
"120","1.368176","2a03:2880:f242:c8:face:b00c:0:167","2a06:c701:46db:1a00:21d9:6346:9b9b:3579","TLSv1.3","286","Server Hello, Change Cipher Spec, Application Data"
"121","1.368396","2a06:c701:46db:1a00:21d9:6346:9b9b:3579","2a03:2880:f242:c8:face:b00c:0:167","TCP","74","58764  >  443 [ACK] Seq=474 Ack=213 Win=261888 Len=0"
"122","1.369858","2a06:c701:46db:1a00:21d9:6346:9b9b:3579","2a03:2880:f242:c8:face:b00c:0:167","TLSv1.3","138","Change Cipher Spec, Application Data"
"123","1.371297","2a06:c701:46db:1a00:21d9:6346:9b9b:3579","2a03:2880:f242:c8:face:b00c:0:167","TLSv1.3","154","Application Data"
"124","1.371754","2a06:c701:46db:1a00:21d9:6346:9b9b:3579","2a03:2880:f242:c8:face:b00c:0:167","TLSv1.3","231","Application Data"
"125","1.419087","2a03:2880:f242:c8:face:b00c:0:167","2a06:c701:46db:1a00:21d9:6346:9b9b:3579","TLSv1.3","245","Application Data"
"126","1.419257","2a06:c701:46db:1a00:21d9:6346:9b9b:3579","2a03:2880:f242:c8:face:b00c:0:167","TCP","74","58764  >  443 [ACK] Seq=775 Ack=384 Win=261632 Len=0"
"127","1.423293","2a03:2880:f242:c8:face:b00c:0:167","2a06:c701:46db:1a00:21d9:6346:9b9b:3579","TLSv1.3","148","Application Data"
"128","1.423477","2a06:c701:46db:1a00:21d9:6346:9b9b:3579","2a03:2880:f242:c8:face:b00c:0:167","TCP","74","58764  >  443 [ACK] Seq=775 Ack=458 Win=261632 Len=0"
"129","1.423812","2a06:c701:46db:1a00:21d9:6346:9b9b:3579","2a03:2880:f242:c8:face:b00c:0:167","TLSv1.3","105","Application Data"
"130","1.439401","2a03:2880:f242:c8:face:b00c:0:167","2a06:c701:46db:1a00:21d9:6346:9b9b:3579","TLSv1.3","105","Application Data"
"131","1.439401","2a03:2880:f242:c8:face:b00c:0:167","2a06:c701:46db:1a00:21d9:6346:9b9b:3579","TLSv1.3","177","Application Data"
"132","1.439614","2a06:c701:46db:1a00:21d9:6346:9b9b:3579","2a03:2880:f242:c8:face:b00c:0:167","TCP","74","58764  >  443 [ACK] Seq=806 Ack=592 Win=261376 Len=0"
"133","1.443422","2a06:c701:46db:1a00:21d9:6346:9b9b:3579","2a03:2880:f242:1c2:face:b00c:0:167","TCP","86","58765  >  443 [SYN] Seq=0 Win=65535 Len=0 MSS=1440 WS=256 SACK_PERM"
"134","1.491439","2a03:2880:f242:1c2:face:b00c:0:167","2a06:c701:46db:1a00:21d9:6346:9b9b:3579","TCP","86","443  >  58765 [SYN, ACK] Seq=0 Ack=1 Win=65535 Len=0 MSS=1392 SACK_PERM WS=256"
"135","1.491757","2a06:c701:46db:1a00:21d9:6346:9b9b:3579","2a03:2880:f242:1c2:face:b00c:0:167","TCP","74","58765  >  443 [ACK] Seq=1 Ack=1 Win=262144 Len=0"
"136","1.493596","2a06:c701:46db:1a00:21d9:6346:9b9b:3579","2a03:2880:f242:1c2:face:b00c:0:167","TLSv1.3","534","Client Hello"
"137","1.518456","2a03:2880:f242:c8:face:b00c:0:167","2a06:c701:46db:1a00:21d9:6346:9b9b:3579","TCP","74","443  >  58764 [ACK] Seq=592 Ack=806 Win=67840 Len=0"
"138","1.537870","10.0.0.11","224.0.0.251","MDNS","79","Standard query 0x0001 PTR _meshcop._udp.local, ""QU"" question"
"139","1.543562","2a03:2880:f242:1c2:face:b00c:0:167","2a06:c701:46db:1a00:21d9:6346:9b9b:3579","TCP","74","443  >  58765 [ACK] Seq=1 Ack=461 Win=66816 Len=0"
"140","1.543814","2a03:2880:f242:1c2:face:b00c:0:167","2a06:c701:46db:1a00:21d9:6346:9b9b:3579","TLSv1.3","286","Server Hello, Change Cipher Spec, Application Data"
"141","1.543946","2a06:c701:46db:1a00:21d9:6346:9b9b:3579","2a03:2880:f242:1c2:face:b00c:0:167","TCP","74","58765  >  443 [ACK] Seq=461 Ack=213 Win=261888 Len=0"
"142","1.545370","2a06:c701:46db:1a00:21d9:6346:9b9b:3579","2a03:2880:f242:1c2:face:b00c:0:167","TLSv1.3","138","Change Cipher Spec, Application Data"
"143","1.545861","2a06:c701:46db:1a00:21d9:6346:9b9b:3579","2a03:2880:f242:1c2:face:b00c:0:167","TLSv1.3","154","Application Data"
"144","1.546237","2a06:c701:46db:1a00:21d9:6346:9b9b:3579","2a03:2880:f242:1c2:face:b00c:0:167","TLSv1.3","307","Application Data"
"145","1.594114","2a03:2880:f242:1c2:face:b00c:0:167","2a06:c701:46db:1a00:21d9:6346:9b9b:3579","TCP","74","443  >  58765 [ACK] Seq=213 Ack=605 Win=66816 Len=0"
"146","1.594649","2a03:2880:f242:1c2:face:b00c:0:167","2a06:c701:46db:1a00:21d9:6346:9b9b:3579","TLSv1.3","245","Application Data"
"147","1.594760","2a06:c701:46db:1a00:21d9:6346:9b9b:3579","2a03:2880:f242:1c2:face:b00c:0:167","TCP","74","58765  >  443 [ACK] Seq=838 Ack=384 Win=261632 Len=0"
"148","1.594893","2a03:2880:f242:1c2:face:b00c:0:167","2a06:c701:46db:1a00:21d9:6346:9b9b:3579","TLSv1.3","148","Application Data"
"149","1.594932","2a06:c701:46db:1a00:21d9:6346:9b9b:3579","2a03:2880:f242:1c2:face:b00c:0:167","TCP","74","58765  >  443 [ACK] Seq=838 Ack=458 Win=261632 Len=0"
"150","1.595304","2a03:2880:f242:1c2:face:b00c:0:167","2a06:c701:46db:1a00:21d9:6346:9b9b:3579","TLSv1.3","105","Application Data"
"151","1.595364","2a06:c701:46db:1a00:21d9:6346:9b9b:3579","2a03:2880:f242:1c2:face:b00c:0:167","TCP","74","58765  >  443 [ACK] Seq=838 Ack=489 Win=261632 Len=0"
"152","1.596676","2a06:c701:46db:1a00:21d9:6346:9b9b:3579","2a03:2880:f242:1c2:face:b00c:0:167","TLSv1.3","105","Application Data"
"153","1.597421","2a03:2880:f242:1c2:face:b00c:0:167","2a06:c701:46db:1a00:21d9:6346:9b9b:3579","TLSv1.3","109","Application Data"
"154","1.597553","2a06:c701:46db:1a00:21d9:6346:9b9b:3579","2a03:2880:f242:1c2:face:b00c:0:167","TCP","74","58765  >  443 [ACK] Seq=869 Ack=524 Win=261376 Len=0"
"155","1.600604","2a03:2880:f242:1c2:face:b00c:0:167","2a06:c701:46db:1a00:21d9:6346:9b9b:3579","TCP","1466","443  >  58765 [ACK] Seq=524 Ack=838 Win=67840 Len=1392 [TCP segment of a reassembled PDU]"
"156","1.600604","2a03:2880:f242:1c2:face:b00c:0:167","2a06:c701:46db:1a00:21d9:6346:9b9b:3579","TLSv1.3","1300","Application Data, Application Data"
"157","1.600813","2a06:c701:46db:1a00:21d9:6346:9b9b:3579","2a03:2880:f242:1c2:face:b00c:0:167","TCP","74","58765  >  443 [ACK] Seq=869 Ack=3142 Win=262144 Len=0"
"158","1.687510","2a03:2880:f242:1c2:face:b00c:0:167","2a06:c701:46db:1a00:21d9:6346:9b9b:3579","TCP","74","443  >  58765 [ACK] Seq=3142 Ack=869 Win=67840 Len=0"
"159","1.701941","2a06:c701:46db:1a00:21d9:6346:9b9b:3579","2a03:2880:f242:1c2:face:b00c:0:167","TLSv1.2","170","Application Data"
"160","1.752403","2a03:2880:f242:1c2:face:b00c:0:167","2a06:c701:46db:1a00:21d9:6346:9b9b:3579","TCP","74","443  >  57484 [ACK] Seq=483 Ack=193 Win=3841 Len=0"
"161","1.798234","2a06:c701:46db:1a00:21d9:6346:9b9b:3579","2a06:c701:46db:1a00::1","DNS","97","Standard query 0x263f A www.phtracker.com"
"162","1.798568","2a06:c701:46db:1a00:21d9:6346:9b9b:3579","2a06:c701:46db:1a00::1","DNS","97","Standard query 0x44a7 AAAA www.phtracker.com"
"163","1.810280","2a06:c701:46db:1a00::1","2a06:c701:46db:1a00:21d9:6346:9b9b:3579","DNS","337","Standard query response 0x263f A www.phtracker.com CNAME db3qgnbkfrw0z.cloudfront.net A 13.226.2.53 A 13.226.2.75 A 13.226.2.58 A 13.226.2.76 NS ns-1275.awsdns-31.org NS ns-1668.awsdns-16.co.uk NS ns-290.awsdns-36.com NS ns-658.awsdns-18.net"
"164","1.812682","2a06:c701:46db:1a00::1","2a06:c701:46db:1a00:21d9:6346:9b9b:3579","DNS","497","Standard query response 0x44a7 AAAA www.phtracker.com CNAME db3qgnbkfrw0z.cloudfront.net AAAA 2600:9000:21f8:e000:1b:1fa2:78c0:93a1 AAAA 2600:9000:21f8:1800:1b:1fa2:78c0:93a1 AAAA 2600:9000:21f8:9600:1b:1fa2:78c0:93a1 AAAA 2600:9000:21f8:dc00:1b:1fa2:78c0:93a1 AAAA 2600:9000:21f8:1400:1b:1fa2:78c0:93a1 AAAA 2600:9000:21f8:400:1b:1fa2:78c0:93a1 AAAA 2600:9000:21f8:8800:1b:1fa2:78c0:93a1 AAAA 2600:9000:21f8:800:1b:1fa2:78c0:93a1 NS ns-1275.awsdns-31.org NS ns-1668.awsdns-16.co.uk NS ns-290.awsdns-36.com NS ns-658.awsdns-18.net"
"165","1.814722","2a06:c701:46db:1a00:21d9:6346:9b9b:3579","2600:9000:21f8:e000:1b:1fa2:78c0:93a1","TCP","86","58766  >  443 [SYN] Seq=0 Win=64800 Len=0 MSS=1440 WS=256 SACK_PERM"
"166","1.827584","2600:9000:21f8:e000:1b:1fa2:78c0:93a1","2a06:c701:46db:1a00:21d9:6346:9b9b:3579","TCP","86","443  >  58766 [SYN, ACK] Seq=0 Ack=1 Win=65535 Len=0 MSS=1220 SACK_PERM WS=512"
"167","1.827803","2a06:c701:46db:1a00:21d9:6346:9b9b:3579","2600:9000:21f8:e000:1b:1fa2:78c0:93a1","TCP","74","58766  >  443 [ACK] Seq=1 Ack=1 Win=64768 Len=0"
"168","1.828577","2a06:c701:46db:1a00:21d9:6346:9b9b:3579","2600:9000:21f8:e000:1b:1fa2:78c0:93a1","TLSv1.3","591","Client Hello"
"169","1.849669","HeightsT_99:7d:3b","Broadcast","ARP","60","Who has 10.0.0.4? Tell 10.0.0.138"
"170","1.849669","HeightsT_99:7d:3b","Broadcast","ARP","60","Who has 10.0.0.11? Tell 10.0.0.138"
"171","1.849669","HeightsT_99:7d:3b","Broadcast","ARP","60","Who has 10.0.0.6? Tell 10.0.0.138"
"172","1.849669","HeightsT_99:7d:3b","Broadcast","ARP","60","Who has 10.0.0.3? Tell 10.0.0.138"
"173","1.849669","HeightsT_99:7d:3b","Broadcast","ARP","60","Who has 10.0.0.10? Tell 10.0.0.138"
"174","1.849669","HeightsT_99:7d:3b","Broadcast","ARP","60","Who has 10.0.0.7? Tell 10.0.0.138"
"175","1.849669","2600:9000:21f8:e000:1b:1fa2:78c0:93a1","2a06:c701:46db:1a00:21d9:6346:9b9b:3579","TCP","74","443  >  58766 [ACK] Seq=1 Ack=518 Win=67072 Len=0"
"176","1.849669","2600:9000:21f8:e000:1b:1fa2:78c0:93a1","2a06:c701:46db:1a00:21d9:6346:9b9b:3579","TLSv1.3","308","Server Hello, Change Cipher Spec, Encrypted Extensions, Finished"
"177","1.849816","IntelCor_8e:ca:bf","HeightsT_99:7d:3b","ARP","42","10.0.0.7 is at 68:54:5a:8e:ca:bf"
"178","1.850599","2a06:c701:46db:1a00:21d9:6346:9b9b:3579","2600:9000:21f8:e000:1b:1fa2:78c0:93a1","TLSv1.3","138","Change Cipher Spec, Finished"
"179","1.850901","2a06:c701:46db:1a00:21d9:6346:9b9b:3579","2600:9000:21f8:e000:1b:1fa2:78c0:93a1","HTTP2","172","Magic, SETTINGS[0], WINDOW_UPDATE[0]"
"180","1.851100","2a06:c701:46db:1a00:21d9:6346:9b9b:3579","2600:9000:21f8:e000:1b:1fa2:78c0:93a1","HTTP2","486","HEADERS[1]: GET /crx/info/a"
"181","1.851493","10.0.0.138","10.0.0.7","NBNS","92","Name query NBSTAT *<00><00><00><00><00><00><00><00><00><00><00><00><00><00><00>"
"182","1.851616","10.0.0.7","10.0.0.138","NBNS","199","Name query response NBSTAT"
"183","1.862736","2600:9000:21f8:e000:1b:1fa2:78c0:93a1","2a06:c701:46db:1a00:21d9:6346:9b9b:3579","TCP","74","443  >  58766 [ACK] Seq=235 Ack=582 Win=67072 Len=0"
"184","1.862966","2600:9000:21f8:e000:1b:1fa2:78c0:93a1","2a06:c701:46db:1a00:21d9:6346:9b9b:3579","TLSv1.3","220","New Session Ticket"
"185","1.863224","2600:9000:21f8:e000:1b:1fa2:78c0:93a1","2a06:c701:46db:1a00:21d9:6346:9b9b:3579","HTTP2","136","SETTINGS[0], WINDOW_UPDATE[0]"
"186","1.863296","2a06:c701:46db:1a00:21d9:6346:9b9b:3579","2600:9000:21f8:e000:1b:1fa2:78c0:93a1","TCP","74","58766  >  443 [ACK] Seq=1092 Ack=443 Win=65536 Len=0"
"187","1.863466","2a06:c701:46db:1a00:21d9:6346:9b9b:3579","2600:9000:21f8:e000:1b:1fa2:78c0:93a1","HTTP2","105","SETTINGS[0]"
"188","1.864960","2600:9000:21f8:e000:1b:1fa2:78c0:93a1","2a06:c701:46db:1a00:21d9:6346:9b9b:3579","TCP","74","443  >  58766 [ACK] Seq=443 Ack=680 Win=67072 Len=0"
"189","1.865920","2600:9000:21f8:e000:1b:1fa2:78c0:93a1","2a06:c701:46db:1a00:21d9:6346:9b9b:3579","HTTP2","105","SETTINGS[0]"
"190","1.867524","2600:9000:21f8:e000:1b:1fa2:78c0:93a1","2a06:c701:46db:1a00:21d9:6346:9b9b:3579","TCP","74","443  >  58766 [ACK] Seq=474 Ack=1092 Win=68096 Len=0"
"191","1.876234","2600:9000:21f8:e000:1b:1fa2:78c0:93a1","2a06:c701:46db:1a00:21d9:6346:9b9b:3579","TCP","74","443  >  58766 [ACK] Seq=474 Ack=1123 Win=68096 Len=0"
"192","1.907098","2a06:c701:46db:1a00:21d9:6346:9b9b:3579","2600:9000:21f8:e000:1b:1fa2:78c0:93a1","TCP","74","58766  >  443 [ACK] Seq=1123 Ack=474 Win=65536 Len=0"
"193","1.967514","2a06:c701:46db:1a00:21d9:6346:9b9b:3579","2a06:c701:46db:1a00::1","DNS","95","Standard query 0x6102 A chat.openai.com"
"194","1.968015","2a06:c701:46db:1a00:21d9:6346:9b9b:3579","2a06:c701:46db:1a00::1","DNS","95","Standard query 0xe5b8 AAAA chat.openai.com"
"195","2.000085","10.0.0.7","10.0.0.138","DNS","75","Standard query 0xe5b8 AAAA chat.openai.com"
"196","2.000250","10.0.0.7","10.0.0.138","DNS","75","Standard query 0x6102 A chat.openai.com"
"197","2.010238","2a06:c701:46db:1a00::1","2a06:c701:46db:1a00:21d9:6346:9b9b:3579","DNS","175","Standard query response 0x6102 A chat.openai.com CNAME chat.openai.com.cdn.cloudflare.net A 104.18.3.161 A 104.18.2.161"
"198","2.011078","2a06:c701:46db:1a00::1","2a06:c701:46db:1a00:21d9:6346:9b9b:3579","DNS","175","Standard query response 0x6102 A chat.openai.com CNAME chat.openai.com.cdn.cloudflare.net A 104.18.3.161 A 104.18.2.161"
"199","2.011347","2a06:c701:46db:1a00::1","2a06:c701:46db:1a00:21d9:6346:9b9b:3579","DNS","199","Standard query response 0xe5b8 AAAA chat.openai.com CNAME chat.openai.com.cdn.cloudflare.net AAAA 2606:4700::6812:3a1 AAAA 2606:4700::6812:2a1"
"200","2.012004","2a06:c701:46db:1a00::1","2a06:c701:46db:1a00:21d9:6346:9b9b:3579","DNS","199","Standard query response 0xe5b8 AAAA chat.openai.com CNAME chat.openai.com.cdn.cloudflare.net AAAA 2606:4700::6812:3a1 AAAA 2606:4700::6812:2a1"
"201","2.013734","2a06:c701:46db:1a00:21d9:6346:9b9b:3579","2606:4700::6812:3a1","QUIC","135","0-RTT, DCID=df43ceed0f3d6d45"
"202","2.013771","2a06:c701:46db:1a00:21d9:6346:9b9b:3579","2606:4700::6812:3a1","QUIC","1292","Initial, DCID=df43ceed0f3d6d45, PKN: 1, PING, PADDING, PING, PING, PADDING, CRYPTO, CRYPTO, PADDING, PING, PING, PING, CRYPTO, CRYPTO, CRYPTO, PING, CRYPTO, CRYPTO, PADDING, PING, CRYPTO"
"203","2.014249","2a06:c701:46db:1a00:21d9:6346:9b9b:3579","2606:4700::6812:3a1","HTTP3","1292","0-RTT, DCID=df43ceed0f3d6d45, PKN: 3, STREAM(2), PRIORITY_UPDATE, STREAM(0)"
"204","2.014322","2a06:c701:46db:1a00:21d9:6346:9b9b:3579","2606:4700::6812:3a1","QUIC","1292","0-RTT, DCID=df43ceed0f3d6d45, PKN: 4, STREAM(0)"
"205","2.014387","2a06:c701:46db:1a00:21d9:6346:9b9b:3579","2606:4700::6812:3a1","QUIC","1292","0-RTT, DCID=df43ceed0f3d6d45, PKN: 5, STREAM(0)"
"206","2.014428","2a06:c701:46db:1a00:21d9:6346:9b9b:3579","2606:4700::6812:3a1","QUIC","189","0-RTT, DCID=df43ceed0f3d6d45, PKN: 6, STREAM(0)"
"207","2.026923","2606:4700::6812:3a1","2a06:c701:46db:1a00:21d9:6346:9b9b:3579","QUIC","1262","Protected Payload (KP0)"
"208","2.028866","2606:4700::6812:3a1","2a06:c701:46db:1a00:21d9:6346:9b9b:3579","QUIC","1262","Protected Payload (KP0), PKN: 0, CRYPTO, PADDING"
"209","2.029144","2606:4700::6812:3a1","2a06:c701:46db:1a00:21d9:6346:9b9b:3579","HTTP3","114","Protected Payload (KP0), PKN: 1, ACK, STREAM(3), SETTINGS"
"210","2.029363","2606:4700::6812:3a1","2a06:c701:46db:1a00:21d9:6346:9b9b:3579","HTTP3","86","Protected Payload (KP0), PKN: 2, STREAM(7)"
"211","2.029978","2a06:c701:46db:1a00:21d9:6346:9b9b:3579","2606:4700::6812:3a1","QUIC","153","Handshake, DCID=01cc80afb2633ba6c7cc15afa4632202238accb4, PKN: 7, ACK, CRYPTO"
"212","2.030230","2a06:c701:46db:1a00:21d9:6346:9b9b:3579","2606:4700::6812:3a1","QUIC","105","Protected Payload (KP0), DCID=01cc80afb2633ba6c7cc15afa4632202238accb4, PKN: 8, ACK"
"213","2.030310","2606:4700::6812:3a1","2a06:c701:46db:1a00:21d9:6346:9b9b:3579","HTTP3","86","Protected Payload (KP0), PKN: 3, STREAM(11)"
"214","2.030441","2606:4700::6812:3a1","2a06:c701:46db:1a00:21d9:6346:9b9b:3579","HTTP3","111","Protected Payload (KP0), PKN: 4, STREAM(15)"
"215","2.030506","2a06:c701:46db:1a00:21d9:6346:9b9b:3579","2606:4700::6812:3a1","QUIC","105","Protected Payload (KP0), DCID=01cc80afb2633ba6c7cc15afa4632202238accb4, PKN: 9, ACK"
"216","2.030588","2a06:c701:46db:1a00:21d9:6346:9b9b:3579","2606:4700::6812:3a1","QUIC","109","Protected Payload (KP0), DCID=01cc80afb2633ba6c7cc15afa4632202238accb4, PKN: 10, ACK, SS(15)"
"217","2.031403","2606:4700::6812:3a1","2a06:c701:46db:1a00:21d9:6346:9b9b:3579","QUIC","85","Protected Payload (KP0), PKN: 5, ACK"
"218","2.032096","2606:4700::6812:3a1","2a06:c701:46db:1a00:21d9:6346:9b9b:3579","QUIC","86","Protected Payload (KP0), PKN: 6, ACK"
"219","2.032399","2a06:c701:46db:1a00:21d9:6346:9b9b:3579","2606:4700::6812:3a1","HTTP3","139","Protected Payload (KP0), DCID=01cc80afb2633ba6c7cc15afa4632202238accb4, PKN: 11, STREAM(2), SETTINGS"
"220","2.045867","2606:4700::6812:3a1","2a06:c701:46db:1a00:21d9:6346:9b9b:3579","QUIC","84","Protected Payload (KP0), PKN: 7, DONE, PADDING"
"221","2.045867","2606:4700::6812:3a1","2a06:c701:46db:1a00:21d9:6346:9b9b:3579","QUIC","92","Protected Payload (KP0), PKN: 8, ACK, RS(15)"
"222","2.045867","2606:4700::6812:3a1","2a06:c701:46db:1a00:21d9:6346:9b9b:3579","QUIC","87","Protected Payload (KP0), PKN: 9, ACK"
"223","2.046407","2a06:c701:46db:1a00:21d9:6346:9b9b:3579","2606:4700::6812:3a1","QUIC","105","Protected Payload (KP0), DCID=01cc80afb2633ba6c7cc15afa4632202238accb4, PKN: 12, ACK"
"224","2.108625","2600:9000:21f8:e000:1b:1fa2:78c0:93a1","2a06:c701:46db:1a00:21d9:6346:9b9b:3579","HTTP2","448","HEADERS[1]: 304 Not Modified"
"225","2.155623","2a06:c701:46db:1a00:21d9:6346:9b9b:3579","2600:9000:21f8:e000:1b:1fa2:78c0:93a1","TCP","74","58766  >  443 [ACK] Seq=1123 Ack=848 Win=65024 Len=0"
"226","2.246576","2606:4700::6812:3a1","2a06:c701:46db:1a00:21d9:6346:9b9b:3579","HTTP3","1262","Protected Payload (KP0), PKN: 10, STREAM(0)"
"227","2.247159","2a06:c701:46db:1a00:21d9:6346:9b9b:3579","2606:4700::6812:3a1","QUIC","106","Protected Payload (KP0), DCID=01cc80afb2633ba6c7cc15afa4632202238accb4, PKN: 13, ACK, PING"
"228","2.249235","2606:4700::6812:3a1","2a06:c701:46db:1a00:21d9:6346:9b9b:3579","QUIC","1262","Protected Payload (KP0), PKN: 11, STREAM(0)"
"229","2.252028","2606:4700::6812:3a1","2a06:c701:46db:1a00:21d9:6346:9b9b:3579","HTTP3","471","Protected Payload (KP0), PKN: 12, STREAM(0), HEADERS"
"230","2.252390","2a06:c701:46db:1a00:21d9:6346:9b9b:3579","2606:4700::6812:3a1","QUIC","105","Protected Payload (KP0), DCID=01cc80afb2633ba6c7cc15afa4632202238accb4, PKN: 14, ACK"
"231","2.253285","2606:4700::6812:3a1","2a06:c701:46db:1a00:21d9:6346:9b9b:3579","QUIC","1262","Protected Payload (KP0), PKN: 13, STREAM(0)"
"232","2.254404","2606:4700::6812:3a1","2a06:c701:46db:1a00:21d9:6346:9b9b:3579","HTTP3","110","Protected Payload (KP0), PKN: 14, STREAM(0), DATA, DATA, DATA"
"233","2.254942","2a06:c701:46db:1a00:21d9:6346:9b9b:3579","2606:4700::6812:3a1","QUIC","105","Protected Payload (KP0), DCID=01cc80afb2633ba6c7cc15afa4632202238accb4, PKN: 15, ACK"
"234","2.256151","2606:4700::6812:3a1","2a06:c701:46db:1a00:21d9:6346:9b9b:3579","QUIC","85","Protected Payload (KP0), PKN: 15, ACK"
"235","2.459908","10.0.0.11","224.0.0.251","MDNS","79","Standard query 0x0002 PTR _meshcop._udp.local, ""QM"" question"
"236","2.501869","10.0.0.7","162.254.196.67","TLSv1.2","108","Application Data"
"237","2.666278","162.254.196.67","10.0.0.7","TCP","54","27038  >  54036 [ACK] Seq=1 Ack=55 Win=1025 Len=0"
"238","3.276397","2a00:1450:4028:802::200a","2a06:c701:46db:1a00:21d9:6346:9b9b:3579","UDP","97","443  >  58775 Len=35"
"239","3.279368","2a06:c701:46db:1a00:21d9:6346:9b9b:3579","2a00:1450:4028:802::200a","UDP","95","58775  >  443 Len=33"
"240","3.481542","2a06:c701:46db:1a00:21d9:6346:9b9b:3579","2a00:1450:4028:802::200a","UDP","91","58775  >  443 Len=29"
"241","3.482321","10.0.0.11","224.0.0.251","MDNS","79","Standard query 0x0003 PTR _meshcop._udp.local, ""QM"" question"
"242","3.496869","2a00:1450:4028:802::200a","2a06:c701:46db:1a00:21d9:6346:9b9b:3579","UDP","87","443  >  58775 Len=25"
"243","3.713983","2a06:c701:46db:1a00:21d9:6346:9b9b:3579","2a00:1450:4028:802::200a","UDP","91","58775  >  443 Len=29"
"244","3.730101","2a00:1450:4028:802::200a","2a06:c701:46db:1a00:21d9:6346:9b9b:3579","UDP","87","443  >  58775 Len=25"
"245","3.789804","34.85.166.233","10.0.0.7","TLSv1.2","81","Application Data"
"246","3.791407","10.0.0.7","34.85.166.233","TLSv1.2","85","Application Data"
"247","3.868639","2a06:c701:46db:1a00:21d9:6346:9b9b:3579","2a00:1450:4028:809::200a","UDP","91","65305  >  443 Len=29"
"248","3.883340","2a00:1450:4028:809::200a","2a06:c701:46db:1a00:21d9:6346:9b9b:3579","UDP","87","443  >  65305 Len=25"
"249","3.931346","2a06:c701:46db:1a00:21d9:6346:9b9b:3579","2a00:1450:4028:802::200a","UDP","91","58775  >  443 Len=29"
"250","3.946579","34.85.166.233","10.0.0.7","TCP","54","443  >  54069 [ACK] Seq=28 Ack=32 Win=331 Len=0"
"251","3.946579","2a00:1450:4028:802::200a","2a06:c701:46db:1a00:21d9:6346:9b9b:3579","UDP","87","443  >  58775 Len=25"
"252","4.149619","2a06:c701:46db:1a00:21d9:6346:9b9b:3579","2a00:1450:4028:802::200a","UDP","91","58775  >  443 Len=29"
"253","4.165571","2a00:1450:4028:802::200a","2a06:c701:46db:1a00:21d9:6346:9b9b:3579","UDP","87","443  >  58775 Len=25"
"254","4.309890","2a06:c701:46db:1a00:21d9:6346:9b9b:3579","2a03:2880:f242:1c2:face:b00c:0:167","TLSv1.2","144","Application Data"
"255","4.360253","2a03:2880:f242:1c2:face:b00c:0:167","2a06:c701:46db:1a00:21d9:6346:9b9b:3579","TCP","74","443  >  57484 [ACK] Seq=483 Ack=263 Win=3841 Len=0"
"256","4.368707","2a06:c701:46db:1a00:21d9:6346:9b9b:3579","2a00:1450:4028:802::200a","UDP","91","58775  >  443 Len=29"
"257","4.383288","2a00:1450:4028:802::200a","2a06:c701:46db:1a00:21d9:6346:9b9b:3579","UDP","87","443  >  58775 Len=25"
