"No.","Time","Source","Destination","Protocol","Length","Info"
"1","0.000000","2a06:c701:46db:1a00:21d9:6346:9b9b:3579","2a00:1450:4025:401::bc","TCP","75","62695  >  5228 [ACK] Seq=1 Ack=1 Win=514 Len=1"
"2","0.066898","2a00:1450:4025:401::bc","2a06:c701:46db:1a00:21d9:6346:9b9b:3579","TCP","86","5228  >  62695 [ACK] Seq=1 Ack=2 Win=265 Len=0 SLE=1 SRE=2"
"3","1.615144","HeightsT_99:7d:3b","Broadcast","0x1ee4","206","Ethernet II"
"4","2.613556","34.85.166.233","10.0.0.7","TLSv1.2","81","Application Data"
"5","2.615025","10.0.0.7","34.85.166.233","TLSv1.2","85","Application Data"
"6","2.762972","34.85.166.233","10.0.0.7","TCP","56","443  >  52065 [ACK] Seq=28 Ack=32 Win=331 Len=0"
"7","3.730590","34.85.166.233","10.0.0.7","TLSv1.2","82","Application Data"
"8","3.731303","10.0.0.7","34.85.166.233","TLSv1.2","86","Application Data"
"9","3.765518","10.0.0.4","239.255.255.250","SSDP","217","M-SEARCH * HTTP/1.1 "
"10","3.879004","34.85.166.233","10.0.0.7","TCP","56","443  >  52065 [ACK] Seq=56 Ack=64 Win=331 Len=0"
"11","4.006742","2a06:c701:46db:1a00:21d9:6346:9b9b:3579","2a03:2880:f242:c8:face:b00c:0:167","TLSv1.2","144","Application Data"
"12","4.053372","2a03:2880:f242:c8:face:b00c:0:167","2a06:c701:46db:1a00:21d9:6346:9b9b:3579","TCP","74","443  >  51770 [ACK] Seq=1 Ack=71 Win=600 Len=0"
"13","4.072710","10.0.0.4","239.255.255.250","SSDP","217","M-SEARCH * HTTP/1.1 "
"14","4.140554","2a03:2880:f242:c8:face:b00c:0:167","2a06:c701:46db:1a00:21d9:6346:9b9b:3579","TLSv1.2","146","Application Data"
"15","4.194206","2a06:c701:46db:1a00:21d9:6346:9b9b:3579","2a03:2880:f242:c8:face:b00c:0:167","TCP","74","51770  >  443 [ACK] Seq=71 Ack=73 Win=515 Len=0"
"16","4.687138","10.0.0.4","239.255.255.250","SSDP","217","M-SEARCH * HTTP/1.1 "
"17","5.301472","10.0.0.4","239.255.255.250","SSDP","217","M-SEARCH * HTTP/1.1 "
"18","5.608678","10.0.0.4","239.255.255.250","SSDP","217","M-SEARCH * HTTP/1.1 "
"19","6.223057","10.0.0.4","239.255.255.250","SSDP","217","M-SEARCH * HTTP/1.1 "
"20","6.757139","10.0.0.7","76.223.31.44","TCP","55","51885  >  443 [ACK] Seq=1 Ack=1 Win=515 Len=1 [TCP segment of a reassembled PDU]"
"21","6.835049","76.223.31.44","10.0.0.7","TCP","66","443  >  51885 [ACK] Seq=1 Ack=2 Win=180 Len=0 SLE=1 SRE=2"
"22","6.839475","10.0.0.4","239.255.255.250","SSDP","217","M-SEARCH * HTTP/1.1 "
"23","6.882824","10.0.0.7","13.226.2.114","TCP","55","52066  >  443 [ACK] Seq=1 Ack=1 Win=514 Len=1 [TCP segment of a reassembled PDU]"
"24","6.893244","13.226.2.114","10.0.0.7","TCP","66","443  >  52066 [ACK] Seq=1 Ack=2 Win=134 Len=0 SLE=1 SRE=2"
"25","7.144573","10.0.0.4","239.255.255.250","SSDP","217","M-SEARCH * HTTP/1.1 "
"26","9.909408","HeightsT_99:7d:3b","Broadcast","0x1ee4","206","Ethernet II"
"27","10.220676","HeightsT_99:7d:3b","Broadcast","ARP","60","Who has 10.0.0.4? Tell 10.0.0.138"
"28","10.220676","HeightsT_99:7d:3b","Broadcast","ARP","60","Who has 10.0.0.11? Tell 10.0.0.138"
"29","10.220676","HeightsT_99:7d:3b","Broadcast","ARP","60","Who has 10.0.0.3? Tell 10.0.0.138"
"30","10.220676","HeightsT_99:7d:3b","Broadcast","ARP","60","Who has 10.0.0.7? Tell 10.0.0.138"
"31","10.220676","HeightsT_99:7d:3b","Broadcast","ARP","60","Who has 10.0.0.2? Tell 10.0.0.138"
"32","10.220800","IntelCor_8e:ca:bf","HeightsT_99:7d:3b","ARP","42","10.0.0.7 is at 68:54:5a:8e:ca:bf"
"33","10.222898","10.0.0.138","10.0.0.7","NBNS","92","Name query NBSTAT *<00><00><00><00><00><00><00><00><00><00><00><00><00><00><00>"
"34","10.222987","10.0.0.7","10.0.0.138","NBNS","199","Name query response NBSTAT"
"35","10.764967","2a00:1450:4028:800::200a","2a06:c701:46db:1a00:21d9:6346:9b9b:3579","UDP","123","443  >  51173 Len=61"
"36","10.764967","2a00:1450:4028:800::200a","2a06:c701:46db:1a00:21d9:6346:9b9b:3579","UDP","97","443  >  51173 Len=35"
"37","10.764967","2a00:1450:4028:800::200a","2a06:c701:46db:1a00:21d9:6346:9b9b:3579","UDP","189","443  >  51173 Len=127"
"38","10.770864","2a06:c701:46db:1a00:21d9:6346:9b9b:3579","2a00:1450:4028:800::200a","UDP","95","51173  >  443 Len=33"
"39","10.771377","2a06:c701:46db:1a00:21d9:6346:9b9b:3579","2a00:1450:4028:800::200a","UDP","322","51173  >  443 Len=260"
"40","10.782840","2a00:1450:4028:800::200a","2a06:c701:46db:1a00:21d9:6346:9b9b:3579","UDP","91","443  >  51173 Len=29"
"41","10.787621","2a06:c701:46db:1a00:21d9:6346:9b9b:3579","2a00:1450:4028:800::200a","UDP","95","51173  >  443 Len=33"
"42","10.950213","2a00:1450:4028:800::200a","2a06:c701:46db:1a00:21d9:6346:9b9b:3579","UDP","162","443  >  51173 Len=100"
"43","10.950963","2a06:c701:46db:1a00:21d9:6346:9b9b:3579","2a00:1450:4028:800::200a","UDP","99","51173  >  443 Len=37"
"44","10.962087","2a00:1450:4028:800::200a","2a06:c701:46db:1a00:21d9:6346:9b9b:3579","UDP","87","443  >  51173 Len=25"
"45","13.072330","2a03:2880:f242:c8:face:b00c:0:167","2a06:c701:46db:1a00:21d9:6346:9b9b:3579","TCP","1466","443  >  51770 [ACK] Seq=73 Ack=71 Win=600 Len=1392 [TCP segment of a reassembled PDU]"
"46","13.072330","2a03:2880:f242:c8:face:b00c:0:167","2a06:c701:46db:1a00:21d9:6346:9b9b:3579","TLSv1.2","619","Application Data, Application Data"
"47","13.072488","2a06:c701:46db:1a00:21d9:6346:9b9b:3579","2a03:2880:f242:c8:face:b00c:0:167","TCP","74","51770  >  443 [ACK] Seq=71 Ack=2010 Win=516 Len=0"
"48","13.139633","20.199.120.151","10.0.0.7","TLSv1.2","433","Application Data"
"49","13.149901","10.0.0.7","20.199.120.151","TLSv1.2","188","Application Data"
"50","13.193783","2a06:c701:46db:1a00:21d9:6346:9b9b:3579","2a06:c700:2003:10:face:b00c:3333:7020","TCP","74","52025  >  443 [FIN, ACK] Seq=1 Ack=1 Win=1021 Len=0"
"51","13.195708","2a06:c701:46db:1a00:21d9:6346:9b9b:3579","2a06:c700:2002:2:face:b00c:3333:7020","TCP","74","52023  >  443 [FIN, ACK] Seq=1 Ack=1 Win=1021 Len=0"
"52","13.195934","2a06:c701:46db:1a00:21d9:6346:9b9b:3579","2a06:c700:2003:2:face:b00c:3333:7020","TCP","74","52024  >  443 [FIN, ACK] Seq=1 Ack=1 Win=1021 Len=0"
"53","13.197508","2a06:c701:46db:1a00:21d9:6346:9b9b:3579","2a03:2880:f242:c8:face:b00c:0:167","TCP","74","52027  >  443 [FIN, ACK] Seq=1 Ack=1 Win=1018 Len=0"
"54","13.200499","2a06:c701:46db:1a00:21d9:6346:9b9b:3579","2a03:2880:f242:c8:face:b00c:0:167","TCP","74","52026  >  443 [FIN, ACK] Seq=1 Ack=1 Win=1021 Len=0"
"55","13.257493","2a06:c701:46db:1a00:21d9:6346:9b9b:3579","2a06:c701:46db:1a00::1","DNS","109","Standard query 0x5af0 A media-mrs2-2.cdn.whatsapp.net"
"56","13.257824","2a06:c701:46db:1a00:21d9:6346:9b9b:3579","2a06:c701:46db:1a00::1","DNS","109","Standard query 0x8cce AAAA media-mrs2-2.cdn.whatsapp.net"
"57","13.261477","20.199.120.151","10.0.0.7","TCP","60","443  >  49605 [ACK] Seq=380 Ack=135 Win=7722 Len=0"
"58","13.269588","2a06:c701:46db:1a00::1","2a06:c701:46db:1a00:21d9:6346:9b9b:3579","DNS","125","Standard query response 0x5af0 A media-mrs2-2.cdn.whatsapp.net A 157.240.196.60"
"59","13.270559","2a06:c701:46db:1a00::1","2a06:c701:46db:1a00:21d9:6346:9b9b:3579","DNS","137","Standard query response 0x8cce AAAA media-mrs2-2.cdn.whatsapp.net AAAA 2a03:2880:f242:1c2:face:b00c:0:167"
"60","13.271927","2a06:c701:46db:1a00:21d9:6346:9b9b:3579","2a03:2880:f242:1c2:face:b00c:0:167","QUIC","1292","Initial, DCID=0ef315ec414891df, PKN: 1, PADDING, PING, PADDING, PING, PADDING, CRYPTO, CRYPTO, CRYPTO, PADDING, PING, PADDING, CRYPTO, PING, PING, PING"
"61","13.272048","2a06:c701:46db:1a00:21d9:6346:9b9b:3579","2a03:2880:f242:1c2:face:b00c:0:167","HTTP3","141","0-RTT, DCID=0ef315ec414891df, PKN: 2, STREAM(2), SETTINGS"
"62","13.272309","2a06:c701:46db:1a00:21d9:6346:9b9b:3579","2a03:2880:f242:1c2:face:b00c:0:167","HTTP3","663","0-RTT, DCID=0ef315ec414891df, PKN: 3, STREAM(2), PRIORITY_UPDATE, STREAM(10), STREAM(0), HEADERS"
"63","13.273013","2a06:c701:46db:1a00:21d9:6346:9b9b:3579","2a03:2880:f242:c8:face:b00c:0:167","TLSv1.2","170","Application Data"
"64","13.288286","2a06:c701:46db:1a00:21d9:6346:9b9b:3579","2a03:2880:f242:c8:face:b00c:0:167","TLSv1.2","182","Application Data"
"65","13.324724","2a03:2880:f242:c8:face:b00c:0:167","2a06:c701:46db:1a00:21d9:6346:9b9b:3579","TCP","74","443  >  51770 [ACK] Seq=2010 Ack=167 Win=600 Len=0"
"66","13.324724","2a03:2880:f242:1c2:face:b00c:0:167","2a06:c701:46db:1a00:21d9:6346:9b9b:3579","QUIC","1294","Initial, SCID=8f1d003121628614, PKN: 8970896, CRYPTO, ACK, PADDING"
"67","13.324724","2a03:2880:f242:1c2:face:b00c:0:167","2a06:c701:46db:1a00:21d9:6346:9b9b:3579","QUIC","271","Handshake, SCID=8f1d003121628614, PKN: 8970896, CRYPTO"
"68","13.324724","2a03:2880:f242:1c2:face:b00c:0:167","2a06:c701:46db:1a00:21d9:6346:9b9b:3579","QUIC","110","Protected Payload (KP0), PKN: 8970896, ACK, PADDING"
"69","13.325585","2a06:c701:46db:1a00:21d9:6346:9b9b:3579","2a03:2880:f242:1c2:face:b00c:0:167","QUIC","143","Handshake, DCID=8f1d003121628614, PKN: 4, ACK, CRYPTO"
"70","13.340716","2a03:2880:f242:1c2:face:b00c:0:167","2a06:c701:46db:1a00:21d9:6346:9b9b:3579","HTTP3","142","Protected Payload (KP0), PKN: 8970897, STREAM(3), SETTINGS, STREAM(7), STREAM(11), PADDING"
"71","13.340716","2a03:2880:f242:1c2:face:b00c:0:167","2a06:c701:46db:1a00:21d9:6346:9b9b:3579","HTTP3","110","Protected Payload (KP0), PKN: 8970898, ACK, STREAM(11), PADDING"
"72","13.340716","2a03:2880:f242:c8:face:b00c:0:167","2a06:c701:46db:1a00:21d9:6346:9b9b:3579","TCP","74","443  >  51770 [ACK] Seq=2010 Ack=275 Win=600 Len=0"
"73","13.341029","2a06:c701:46db:1a00:21d9:6346:9b9b:3579","2a03:2880:f242:1c2:face:b00c:0:167","QUIC","96","Protected Payload (KP0), DCID=8f1d003121628614, PKN: 5, ACK"
"74","13.341092","2a06:c701:46db:1a00:21d9:6346:9b9b:3579","2a03:2880:f242:c6:face:b00c:0:7260","TCP","86","52071  >  5222 [SYN] Seq=0 Win=64800 Len=0 MSS=1440 WS=256 SACK_PERM"
"75","13.373815","2a03:2880:f242:1c2:face:b00c:0:167","2a06:c701:46db:1a00:21d9:6346:9b9b:3579","QUIC","101","Handshake, SCID=8f1d003121628614, PKN: 8970897, ACK"
"76","13.374290","2a03:2880:f242:1c2:face:b00c:0:167","2a06:c701:46db:1a00:21d9:6346:9b9b:3579","QUIC","174","Protected Payload (KP0), PKN: 8970899, DONE, NT, PADDING"
"77","13.375105","2a03:2880:f242:1c2:face:b00c:0:167","2a06:c701:46db:1a00:21d9:6346:9b9b:3579","QUIC","334","Protected Payload (KP0), PKN: 8970900, CRYPTO, PADDING"
"78","13.375274","2a06:c701:46db:1a00:21d9:6346:9b9b:3579","2a03:2880:f242:1c2:face:b00c:0:167","QUIC","96","Protected Payload (KP0), DCID=8f1d003121628614, PKN: 6, ACK"
"79","13.403966","2a03:2880:f242:c6:face:b00c:0:7260","2a06:c701:46db:1a00:21d9:6346:9b9b:3579","TCP","86","5222  >  52071 [SYN, ACK] Seq=0 Ack=1 Win=65535 Len=0 MSS=1392 SACK_PERM WS=256"
"80","13.403966","2a03:2880:f242:1c2:face:b00c:0:167","2a06:c701:46db:1a00:21d9:6346:9b9b:3579","HTTP3","590","Protected Payload (KP0), PKN: 8970901, ACK, STREAM(7), STREAM(0), HEADERS, PADDING"
"81","13.403966","2a03:2880:f242:1c2:face:b00c:0:167","2a06:c701:46db:1a00:21d9:6346:9b9b:3579","QUIC","1294","Protected Payload (KP0), PKN: 8970902, STREAM(0)"
"82","13.403966","2a03:2880:f242:1c2:face:b00c:0:167","2a06:c701:46db:1a00:21d9:6346:9b9b:3579","QUIC","1294","Protected Payload (KP0), PKN: 8970903, STREAM(0)"
"83","13.404253","2a06:c701:46db:1a00:21d9:6346:9b9b:3579","2a03:2880:f242:c6:face:b00c:0:7260","TCP","74","52071  >  5222 [ACK] Seq=1 Ack=1 Win=132096 Len=0"
"84","13.404808","2a06:c701:46db:1a00:21d9:6346:9b9b:3579","2a03:2880:f242:1c2:face:b00c:0:167","HTTP3","100","Protected Payload (KP0), DCID=8f1d003121628614, PKN: 7, ACK, STREAM(6)"
"85","13.404974","2a06:c701:46db:1a00:21d9:6346:9b9b:3579","2a03:2880:f242:1c2:face:b00c:0:167","QUIC","96","Protected Payload (KP0), DCID=8f1d003121628614, PKN: 8, ACK"
"86","13.405005","2a06:c701:46db:1a00:21d9:6346:9b9b:3579","2a03:2880:f242:c6:face:b00c:0:7260","TCP","312","52071  >  5222 [PSH, ACK] Seq=1 Ack=1 Win=132096 Len=238 [TCP segment of a reassembled PDU]"
"87","13.429362","2a03:2880:f242:1c2:face:b00c:0:167","2a06:c701:46db:1a00:21d9:6346:9b9b:3579","QUIC","1294","Protected Payload (KP0), PKN: 8970904, STREAM(0)"
"88","13.429362","2a03:2880:f242:1c2:face:b00c:0:167","2a06:c701:46db:1a00:21d9:6346:9b9b:3579","QUIC","1294","Protected Payload (KP0), PKN: 8970905, STREAM(0)"
"89","13.429362","2a03:2880:f242:1c2:face:b00c:0:167","2a06:c701:46db:1a00:21d9:6346:9b9b:3579","QUIC","1294","Protected Payload (KP0), PKN: 8970910, STREAM(0)"
"90","13.429362","2a03:2880:f242:1c2:face:b00c:0:167","2a06:c701:46db:1a00:21d9:6346:9b9b:3579","QUIC","1294","Protected Payload (KP0), PKN: 8970911, STREAM(0)"
"91","13.429362","2a03:2880:f242:1c2:face:b00c:0:167","2a06:c701:46db:1a00:21d9:6346:9b9b:3579","QUIC","1294","Protected Payload (KP0), PKN: 8970912, STREAM(0)"
"92","13.429362","2a03:2880:f242:1c2:face:b00c:0:167","2a06:c701:46db:1a00:21d9:6346:9b9b:3579","QUIC","1294","Protected Payload (KP0), PKN: 8970906, STREAM(0)"
"93","13.429362","2a03:2880:f242:1c2:face:b00c:0:167","2a06:c701:46db:1a00:21d9:6346:9b9b:3579","QUIC","1294","Protected Payload (KP0), PKN: 8970907, STREAM(0)"
"94","13.429362","2a03:2880:f242:1c2:face:b00c:0:167","2a06:c701:46db:1a00:21d9:6346:9b9b:3579","QUIC","1294","Protected Payload (KP0), PKN: 8970908, STREAM(0)"
"95","13.429362","2a03:2880:f242:1c2:face:b00c:0:167","2a06:c701:46db:1a00:21d9:6346:9b9b:3579","QUIC","1294","Protected Payload (KP0), PKN: 8970909, STREAM(0)"
"96","13.429362","2a03:2880:f242:c8:face:b00c:0:167","2a06:c701:46db:1a00:21d9:6346:9b9b:3579","TLSv1.2","169","Application Data"
"97","13.429362","2a03:2880:f242:1c2:face:b00c:0:167","2a06:c701:46db:1a00:21d9:6346:9b9b:3579","QUIC","1294","Protected Payload (KP0), PKN: 8970913, ACK, STREAM(0)"
"98","13.430371","2a06:c701:46db:1a00:21d9:6346:9b9b:3579","2a03:2880:f242:1c2:face:b00c:0:167","QUIC","96","Protected Payload (KP0), DCID=8f1d003121628614, PKN: 9, ACK"
"99","13.430624","2a06:c701:46db:1a00:21d9:6346:9b9b:3579","2a03:2880:f242:1c2:face:b00c:0:167","QUIC","98","Protected Payload (KP0), DCID=8f1d003121628614, PKN: 10, ACK"
"100","13.430705","2a06:c701:46db:1a00:21d9:6346:9b9b:3579","2a03:2880:f242:1c2:face:b00c:0:167","QUIC","98","Protected Payload (KP0), DCID=8f1d003121628614, PKN: 11, ACK"
"101","13.430826","2a06:c701:46db:1a00:21d9:6346:9b9b:3579","2a03:2880:f242:1c2:face:b00c:0:167","QUIC","98","Protected Payload (KP0), DCID=8f1d003121628614, PKN: 12, ACK"
"102","13.430949","2a06:c701:46db:1a00:21d9:6346:9b9b:3579","2a03:2880:f242:1c2:face:b00c:0:167","QUIC","98","Protected Payload (KP0), DCID=8f1d003121628614, PKN: 13, ACK"
"103","13.431032","2a06:c701:46db:1a00:21d9:6346:9b9b:3579","2a03:2880:f242:1c2:face:b00c:0:167","QUIC","98","Protected Payload (KP0), DCID=8f1d003121628614, PKN: 14, ACK"
"104","13.431105","2a06:c701:46db:1a00:21d9:6346:9b9b:3579","2a03:2880:f242:1c2:face:b00c:0:167","QUIC","98","Protected Payload (KP0), DCID=8f1d003121628614, PKN: 15, ACK"
"105","13.431211","2a06:c701:46db:1a00:21d9:6346:9b9b:3579","2a03:2880:f242:1c2:face:b00c:0:167","QUIC","96","Protected Payload (KP0), DCID=8f1d003121628614, PKN: 16, ACK"
"106","13.452537","2a03:2880:f242:1c2:face:b00c:0:167","2a06:c701:46db:1a00:21d9:6346:9b9b:3579","QUIC","1294","Protected Payload (KP0), PKN: 8970914, ACK, STREAM(0)"
"107","13.452973","2a06:c701:46db:1a00:21d9:6346:9b9b:3579","2a03:2880:f242:1c2:face:b00c:0:167","QUIC","96","Protected Payload (KP0), DCID=8f1d003121628614, PKN: 17, ACK"
"108","13.453267","2a03:2880:f242:1c2:face:b00c:0:167","2a06:c701:46db:1a00:21d9:6346:9b9b:3579","QUIC","1294","Protected Payload (KP0), PKN: 8970915, ACK, STREAM(0)"
"109","13.453522","2a03:2880:f242:1c2:face:b00c:0:167","2a06:c701:46db:1a00:21d9:6346:9b9b:3579","QUIC","1294","Protected Payload (KP0), PKN: 8970916, STREAM(0)"
"110","13.453684","2a06:c701:46db:1a00:21d9:6346:9b9b:3579","2a03:2880:f242:1c2:face:b00c:0:167","QUIC","96","Protected Payload (KP0), DCID=8f1d003121628614, PKN: 18, ACK"
"111","13.453730","2a03:2880:f242:c6:face:b00c:0:7260","2a06:c701:46db:1a00:21d9:6346:9b9b:3579","TCP","74","5222  >  52071 [ACK] Seq=1 Ack=239 Win=66816 Len=0"
"112","13.454219","2a03:2880:f242:1c2:face:b00c:0:167","2a06:c701:46db:1a00:21d9:6346:9b9b:3579","QUIC","1294","Protected Payload (KP0), PKN: 8970917, STREAM(0)"
"113","13.454219","2a03:2880:f242:1c2:face:b00c:0:167","2a06:c701:46db:1a00:21d9:6346:9b9b:3579","HTTP3","334","Protected Payload (KP0), PKN: 8970918, STREAM(0), DATA, PADDING"
"114","13.454350","2a06:c701:46db:1a00:21d9:6346:9b9b:3579","2a03:2880:f242:1c2:face:b00c:0:167","QUIC","96","Protected Payload (KP0), DCID=8f1d003121628614, PKN: 19, ACK"
"115","13.478236","2a03:2880:f242:1c2:face:b00c:0:167","2a06:c701:46db:1a00:21d9:6346:9b9b:3579","QUIC","1294","Protected Payload (KP0), PKN: 8970919, ACK, STREAM(0)[Reassembly error, protocol QUIC: New fragment overlaps old data (retransmission?)]"
"116","13.478683","2a03:2880:f242:1c2:face:b00c:0:167","2a06:c701:46db:1a00:21d9:6346:9b9b:3579","QUIC","1294","Protected Payload (KP0), PKN: 8970920, ACK, STREAM(0)[Reassembly error, protocol QUIC: New fragment overlaps old data (retransmission?)]"
"117","13.478683","2a03:2880:f242:1c2:face:b00c:0:167","2a06:c701:46db:1a00:21d9:6346:9b9b:3579","QUIC","1294","Protected Payload (KP0), PKN: 8970921, ACK, STREAM(0)[Reassembly error, protocol QUIC: New fragment overlaps old data (retransmission?)]"
"118","13.478975","2a06:c701:46db:1a00:21d9:6346:9b9b:3579","2a03:2880:f242:1c2:face:b00c:0:167","QUIC","96","Protected Payload (KP0), DCID=8f1d003121628614, PKN: 20, ACK"
"119","13.482815","2a06:c701:46db:1a00:21d9:6346:9b9b:3579","2a03:2880:f242:c8:face:b00c:0:167","TCP","74","51770  >  443 [ACK] Seq=275 Ack=2105 Win=516 Len=0"
"120","13.498448","2a06:c701:46db:1a00:21d9:6346:9b9b:3579","2a06:c700:2003:2:face:b00c:3333:7020","TCP","74","[TCP Retransmission] 52024  >  443 [FIN, ACK] Seq=1 Ack=1 Win=1021 Len=0"
"121","13.498449","2a06:c701:46db:1a00:21d9:6346:9b9b:3579","2a06:c700:2003:10:face:b00c:3333:7020","TCP","74","[TCP Retransmission] 52025  >  443 [FIN, ACK] Seq=1 Ack=1 Win=1021 Len=0"
"122","13.498453","2a06:c701:46db:1a00:21d9:6346:9b9b:3579","2a03:2880:f242:c8:face:b00c:0:167","TCP","74","[TCP Retransmission] 52026  >  443 [FIN, ACK] Seq=1 Ack=1 Win=1021 Len=0"
"123","13.498488","2a06:c701:46db:1a00:21d9:6346:9b9b:3579","2a06:c700:2002:2:face:b00c:3333:7020","TCP","74","[TCP Retransmission] 52023  >  443 [FIN, ACK] Seq=1 Ack=1 Win=1021 Len=0"
"124","13.498500","2a06:c701:46db:1a00:21d9:6346:9b9b:3579","2a03:2880:f242:c8:face:b00c:0:167","TCP","74","[TCP Retransmission] 52027  >  443 [FIN, ACK] Seq=1 Ack=1 Win=1018 Len=0"
"125","13.516048","2a06:c701:46db:1a00:21d9:6346:9b9b:3579","2a03:2880:f242:1c2:face:b00c:0:167","QUIC","97","Protected Payload (KP0), DCID=8f1d003121628614, PKN: 21, ACK"
"126","13.516174","2a03:2880:f242:1c2:face:b00c:0:167","2a06:c701:46db:1a00:21d9:6346:9b9b:3579","QUIC","1294","Protected Payload (KP0), PKN: 8970922, ACK, STREAM(0)[Reassembly error, protocol QUIC: New fragment overlaps old data (retransmission?)]"
"127","13.516174","2a03:2880:f242:1c2:face:b00c:0:167","2a06:c701:46db:1a00:21d9:6346:9b9b:3579","QUIC","110","Protected Payload (KP0), PKN: 8970923, STREAM(0)[Reassembly error, protocol QUIC: New fragment overlaps old data (retransmission?)]"
"128","13.516587","2a06:c701:46db:1a00:21d9:6346:9b9b:3579","2a03:2880:f242:1c2:face:b00c:0:167","QUIC","96","Protected Payload (KP0), DCID=8f1d003121628614, PKN: 22, ACK"
"129","13.557922","2a03:2880:f242:c6:face:b00c:0:7260","2a06:c701:46db:1a00:21d9:6346:9b9b:3579","TCP","131","5222  >  52071 [PSH, ACK] Seq=1 Ack=239 Win=66816 Len=57 [TCP segment of a reassembled PDU]"
"130","13.558321","2a03:2880:f242:c6:face:b00c:0:7260","2a06:c701:46db:1a00:21d9:6346:9b9b:3579","TCP","124","5222  >  52071 [PSH, ACK] Seq=58 Ack=239 Win=66816 Len=50 [TCP segment of a reassembled PDU]"
"131","13.558423","2a06:c701:46db:1a00:21d9:6346:9b9b:3579","2a03:2880:f242:c6:face:b00c:0:7260","TCP","74","52071  >  5222 [ACK] Seq=239 Ack=108 Win=132096 Len=0"
"132","13.683752","2a03:2880:f242:c6:face:b00c:0:7260","2a06:c701:46db:1a00:21d9:6346:9b9b:3579","TCP","120","5222  >  52071 [PSH, ACK] Seq=108 Ack=239 Win=66816 Len=46 [TCP segment of a reassembled PDU]"
"133","13.683752","2a03:2880:f242:c6:face:b00c:0:7260","2a06:c701:46db:1a00:21d9:6346:9b9b:3579","TCP","127","5222  >  52071 [PSH, ACK] Seq=154 Ack=239 Win=66816 Len=53 [TCP segment of a reassembled PDU]"
"134","13.683910","2a06:c701:46db:1a00:21d9:6346:9b9b:3579","2a03:2880:f242:c6:face:b00c:0:7260","TCP","74","52071  >  5222 [ACK] Seq=239 Ack=207 Win=131840 Len=0"
"135","13.684593","2a06:c701:46db:1a00:21d9:6346:9b9b:3579","2a03:2880:f242:c6:face:b00c:0:7260","TCP","109","52071  >  5222 [PSH, ACK] Seq=239 Ack=207 Win=131840 Len=35 [TCP segment of a reassembled PDU]"
"136","13.684796","2a06:c701:46db:1a00:21d9:6346:9b9b:3579","2a03:2880:f242:c6:face:b00c:0:7260","TCP","120","52071  >  5222 [PSH, ACK] Seq=274 Ack=207 Win=131840 Len=46 [TCP segment of a reassembled PDU]"
"137","13.684946","2a06:c701:46db:1a00:21d9:6346:9b9b:3579","2a03:2880:f242:c6:face:b00c:0:7260","TCP","113","52071  >  5222 [PSH, ACK] Seq=320 Ack=207 Win=131840 Len=39 [TCP segment of a reassembled PDU]"
"138","13.685090","2a06:c701:46db:1a00:21d9:6346:9b9b:3579","2a03:2880:f242:c6:face:b00c:0:7260","XMPP/XML","108","UNKNOWN PACKET "
"139","13.686279","2a06:c701:46db:1a00:21d9:6346:9b9b:3579","2a03:2880:f242:c6:face:b00c:0:7260","TCP","204","52071  >  5222 [PSH, ACK] Seq=393 Ack=207 Win=131840 Len=130 [TCP segment of a reassembled PDU]"
"140","13.689496","2a03:2880:f242:c6:face:b00c:0:7260","2a06:c701:46db:1a00:21d9:6346:9b9b:3579","TCP","122","5222  >  52071 [PSH, ACK] Seq=207 Ack=239 Win=66816 Len=48 [TCP segment of a reassembled PDU]"
"141","13.693470","2a03:2880:f242:c6:face:b00c:0:7260","2a06:c701:46db:1a00:21d9:6346:9b9b:3579","TCP","1466","5222  >  52071 [ACK] Seq=255 Ack=239 Win=66816 Len=1392 [TCP segment of a reassembled PDU]"
"142","13.693470","2a03:2880:f242:c6:face:b00c:0:7260","2a06:c701:46db:1a00:21d9:6346:9b9b:3579","TCP","173","5222  >  52071 [PSH, ACK] Seq=1647 Ack=239 Win=66816 Len=99 [TCP segment of a reassembled PDU]"
"143","13.693581","2a06:c701:46db:1a00:21d9:6346:9b9b:3579","2a03:2880:f242:c6:face:b00c:0:7260","TCP","74","52071  >  5222 [ACK] Seq=523 Ack=1746 Win=132096 Len=0"
"144","13.694726","2a06:c701:46db:1a00:21d9:6346:9b9b:3579","2a03:2880:f242:c6:face:b00c:0:7260","TCP","120","52071  >  5222 [PSH, ACK] Seq=523 Ack=1746 Win=132096 Len=46 [TCP segment of a reassembled PDU]"
"145","13.694731","2a03:2880:f242:c6:face:b00c:0:7260","2a06:c701:46db:1a00:21d9:6346:9b9b:3579","TCP","1466","5222  >  52071 [ACK] Seq=1746 Ack=239 Win=66816 Len=1392 [TCP segment of a reassembled PDU]"
"146","13.694731","2a03:2880:f242:c6:face:b00c:0:7260","2a06:c701:46db:1a00:21d9:6346:9b9b:3579","TCP","182","5222  >  52071 [PSH, ACK] Seq=3138 Ack=239 Win=66816 Len=108 [TCP segment of a reassembled PDU]"
"147","13.694731","2a03:2880:f242:c6:face:b00c:0:7260","2a06:c701:46db:1a00:21d9:6346:9b9b:3579","TCP","481","5222  >  52071 [PSH, ACK] Seq=3246 Ack=239 Win=66816 Len=407 [TCP segment of a reassembled PDU]"
"148","13.694890","2a06:c701:46db:1a00:21d9:6346:9b9b:3579","2a03:2880:f242:c6:face:b00c:0:7260","TCP","74","52071  >  5222 [ACK] Seq=569 Ack=3653 Win=132096 Len=0"
"149","13.695373","2a03:2880:f242:c6:face:b00c:0:7260","2a06:c701:46db:1a00:21d9:6346:9b9b:3579","TCP","112","5222  >  52071 [PSH, ACK] Seq=3653 Ack=239 Win=66816 Len=38 [TCP segment of a reassembled PDU]"
"150","13.695455","2a06:c701:46db:1a00:21d9:6346:9b9b:3579","2a03:2880:f242:c6:face:b00c:0:7260","TCP","74","52071  >  5222 [ACK] Seq=569 Ack=3691 Win=132096 Len=0"
"151","13.732236","2a03:2880:f242:c6:face:b00c:0:7260","2a06:c701:46db:1a00:21d9:6346:9b9b:3579","TCP","74","5222  >  52071 [ACK] Seq=3691 Ack=274 Win=66816 Len=0"
"152","13.732438","2a03:2880:f242:c6:face:b00c:0:7260","2a06:c701:46db:1a00:21d9:6346:9b9b:3579","TCP","74","5222  >  52071 [ACK] Seq=3691 Ack=320 Win=66816 Len=0"
"153","13.732675","2a03:2880:f242:c6:face:b00c:0:7260","2a06:c701:46db:1a00:21d9:6346:9b9b:3579","TCP","74","5222  >  52071 [ACK] Seq=3691 Ack=359 Win=66816 Len=0"
"154","13.732675","2a03:2880:f242:c6:face:b00c:0:7260","2a06:c701:46db:1a00:21d9:6346:9b9b:3579","TCP","74","5222  >  52071 [ACK] Seq=3691 Ack=393 Win=66816 Len=0"
"155","13.733421","2a03:2880:f242:c6:face:b00c:0:7260","2a06:c701:46db:1a00:21d9:6346:9b9b:3579","TCP","74","5222  >  52071 [ACK] Seq=3691 Ack=523 Win=67840 Len=0"
"156","13.741710","2a03:2880:f242:c6:face:b00c:0:7260","2a06:c701:46db:1a00:21d9:6346:9b9b:3579","TCP","74","5222  >  52071 [ACK] Seq=3691 Ack=569 Win=67840 Len=0"
"157","13.760382","2a06:c701:46db:1a00:21d9:6346:9b9b:3579","2a03:2880:f242:c6:face:b00c:0:7260","TCP","138","52071  >  5222 [PSH, ACK] Seq=569 Ack=3691 Win=132096 Len=64 [TCP segment of a reassembled PDU]"
"158","13.767630","2a06:c701:46db:1a00:21d9:6346:9b9b:3579","2a03:2880:f242:c6:face:b00c:0:7260","TCP","135","52071  >  5222 [PSH, ACK] Seq=633 Ack=3691 Win=132096 Len=61 [TCP segment of a reassembled PDU]"
"159","13.771783","2a06:c701:46db:1a00:21d9:6346:9b9b:3579","2a03:2880:f242:c6:face:b00c:0:7260","TCP","135","52071  >  5222 [PSH, ACK] Seq=694 Ack=3691 Win=132096 Len=61 [TCP segment of a reassembled PDU]"
"160","13.772140","2a06:c701:46db:1a00:21d9:6346:9b9b:3579","2a03:2880:f242:c6:face:b00c:0:7260","TCP","120","52071  >  5222 [PSH, ACK] Seq=755 Ack=3691 Win=132096 Len=46 [TCP segment of a reassembled PDU]"
"161","13.773446","2a06:c701:46db:1a00:21d9:6346:9b9b:3579","2a03:2880:f242:c6:face:b00c:0:7260","TCP","145","52071  >  5222 [PSH, ACK] Seq=801 Ack=3691 Win=132096 Len=71 [TCP segment of a reassembled PDU]"
"162","13.777738","2a06:c701:46db:1a00:21d9:6346:9b9b:3579","2a03:2880:f242:c6:face:b00c:0:7260","TCP","135","52071  >  5222 [PSH, ACK] Seq=872 Ack=3691 Win=132096 Len=61 [TCP segment of a reassembled PDU]"
"163","13.778788","2a06:c701:46db:1a00:21d9:6346:9b9b:3579","2a03:2880:f242:c6:face:b00c:0:7260","TCP","141","52071  >  5222 [PSH, ACK] Seq=933 Ack=3691 Win=132096 Len=67 [TCP segment of a reassembled PDU]"
"164","13.779875","2a06:c701:46db:1a00:21d9:6346:9b9b:3579","2a03:2880:f242:c6:face:b00c:0:7260","XMPP/XML","120","UNKNOWN PACKET "
"165","13.807730","2a03:2880:f242:c6:face:b00c:0:7260","2a06:c701:46db:1a00:21d9:6346:9b9b:3579","TCP","74","5222  >  52071 [ACK] Seq=3691 Ack=633 Win=67840 Len=0"
"166","13.814742","2a03:2880:f242:c6:face:b00c:0:7260","2a06:c701:46db:1a00:21d9:6346:9b9b:3579","TCP","74","5222  >  52071 [ACK] Seq=3691 Ack=694 Win=67840 Len=0"
"167","13.818405","2a03:2880:f242:c6:face:b00c:0:7260","2a06:c701:46db:1a00:21d9:6346:9b9b:3579","TCP","74","5222  >  52071 [ACK] Seq=3691 Ack=755 Win=67840 Len=0"
"168","13.818405","2a03:2880:f242:c6:face:b00c:0:7260","2a06:c701:46db:1a00:21d9:6346:9b9b:3579","TCP","74","5222  >  52071 [ACK] Seq=3691 Ack=801 Win=67840 Len=0"
"169","13.820484","2a03:2880:f242:c6:face:b00c:0:7260","2a06:c701:46db:1a00:21d9:6346:9b9b:3579","TCP","74","5222  >  52071 [ACK] Seq=3691 Ack=872 Win=67840 Len=0"
"170","13.825005","2a03:2880:f242:c6:face:b00c:0:7260","2a06:c701:46db:1a00:21d9:6346:9b9b:3579","TCP","74","5222  >  52071 [ACK] Seq=3691 Ack=933 Win=67840 Len=0"
"171","13.826770","2a03:2880:f242:c6:face:b00c:0:7260","2a06:c701:46db:1a00:21d9:6346:9b9b:3579","TCP","74","5222  >  52071 [ACK] Seq=3691 Ack=1000 Win=67840 Len=0"
"172","13.826770","2a03:2880:f242:c6:face:b00c:0:7260","2a06:c701:46db:1a00:21d9:6346:9b9b:3579","TCP","74","5222  >  52071 [ACK] Seq=3691 Ack=1046 Win=67840 Len=0"
"173","13.837594","2a06:c701:46db:1a00:21d9:6346:9b9b:3579","2a03:2880:f242:c6:face:b00c:0:7260","TCP","142","52071  >  5222 [PSH, ACK] Seq=1046 Ack=3691 Win=132096 Len=68 [TCP segment of a reassembled PDU]"
"174","13.841557","2a06:c701:46db:1a00:21d9:6346:9b9b:3579","2a03:2880:f242:c6:face:b00c:0:7260","TCP","139","52071  >  5222 [PSH, ACK] Seq=1114 Ack=3691 Win=132096 Len=65 [TCP segment of a reassembled PDU]"
"175","13.843977","2a06:c701:46db:1a00:21d9:6346:9b9b:3579","2a03:2880:f242:c6:face:b00c:0:7260","TCP","141","52071  >  5222 [PSH, ACK] Seq=1179 Ack=3691 Win=132096 Len=67 [TCP segment of a reassembled PDU]"
"176","13.855519","2a06:c701:46db:1a00:21d9:6346:9b9b:3579","2a03:2880:f242:c6:face:b00c:0:7260","TCP","141","52071  >  5222 [PSH, ACK] Seq=1246 Ack=3691 Win=132096 Len=67 [TCP segment of a reassembled PDU]"
"177","13.855675","2a06:c701:46db:1a00:21d9:6346:9b9b:3579","2a03:2880:f242:c6:face:b00c:0:7260","TCP","113","52071  >  5222 [PSH, ACK] Seq=1313 Ack=3691 Win=132096 Len=39 [TCP segment of a reassembled PDU]"
"178","13.868115","2a03:2880:f242:c6:face:b00c:0:7260","2a06:c701:46db:1a00:21d9:6346:9b9b:3579","TCP","260","5222  >  52071 [PSH, ACK] Seq=3691 Ack=1046 Win=67840 Len=186 [TCP segment of a reassembled PDU]"
"179","13.868115","2a03:2880:f242:c6:face:b00c:0:7260","2a06:c701:46db:1a00:21d9:6346:9b9b:3579","TCP","595","5222  >  52071 [PSH, ACK] Seq=3877 Ack=1046 Win=67840 Len=521 [TCP segment of a reassembled PDU]"
"180","13.868115","2a03:2880:f242:c6:face:b00c:0:7260","2a06:c701:46db:1a00:21d9:6346:9b9b:3579","TCP","178","5222  >  52071 [PSH, ACK] Seq=4398 Ack=1046 Win=67840 Len=104 [TCP segment of a reassembled PDU]"
"181","13.868244","2a06:c701:46db:1a00:21d9:6346:9b9b:3579","2a03:2880:f242:c6:face:b00c:0:7260","TCP","74","52071  >  5222 [ACK] Seq=1352 Ack=4502 Win=131328 Len=0"
"182","13.870814","2a06:c701:46db:1a00:21d9:6346:9b9b:3579","2a03:2880:f242:c6:face:b00c:0:7260","TCP","157","52071  >  5222 [PSH, ACK] Seq=1352 Ack=4502 Win=131328 Len=83 [TCP segment of a reassembled PDU]"
"183","13.874517","2a06:c701:46db:1a00:21d9:6346:9b9b:3579","2a03:2880:f242:c6:face:b00c:0:7260","TCP","113","52071  >  5222 [PSH, ACK] Seq=1435 Ack=4502 Win=131328 Len=39 [TCP segment of a reassembled PDU]"
"184","13.883889","2a03:2880:f242:c6:face:b00c:0:7260","2a06:c701:46db:1a00:21d9:6346:9b9b:3579","TCP","116","5222  >  52071 [PSH, ACK] Seq=4502 Ack=1046 Win=67840 Len=42 [TCP segment of a reassembled PDU]"
"185","13.899467","2a03:2880:f242:c6:face:b00c:0:7260","2a06:c701:46db:1a00:21d9:6346:9b9b:3579","TCP","74","5222  >  52071 [ACK] Seq=4544 Ack=1179 Win=67840 Len=0"
"186","13.915529","2a03:2880:f242:c6:face:b00c:0:7260","2a06:c701:46db:1a00:21d9:6346:9b9b:3579","TCP","74","5222  >  52071 [ACK] Seq=4544 Ack=1352 Win=67840 Len=0"
"187","13.931511","2a03:2880:f242:c6:face:b00c:0:7260","2a06:c701:46db:1a00:21d9:6346:9b9b:3579","TCP","74","5222  >  52071 [ACK] Seq=4544 Ack=1474 Win=67840 Len=0"
"188","13.931515","2a06:c701:46db:1a00:21d9:6346:9b9b:3579","2a03:2880:f242:c6:face:b00c:0:7260","TCP","74","52071  >  5222 [ACK] Seq=1474 Ack=4544 Win=131328 Len=0"
"189","13.947373","2a03:2880:f242:c6:face:b00c:0:7260","2a06:c701:46db:1a00:21d9:6346:9b9b:3579","TCP","116","5222  >  52071 [PSH, ACK] Seq=4544 Ack=1474 Win=67840 Len=42 [TCP segment of a reassembled PDU]"
"190","13.994552","2a06:c701:46db:1a00:21d9:6346:9b9b:3579","2a03:2880:f242:c6:face:b00c:0:7260","TCP","74","52071  >  5222 [ACK] Seq=1474 Ack=4586 Win=131072 Len=0"
"191","13.994566","2a03:2880:f242:c6:face:b00c:0:7260","2a06:c701:46db:1a00:21d9:6346:9b9b:3579","TCP","115","5222  >  52071 [PSH, ACK] Seq=4586 Ack=1474 Win=67840 Len=41 [TCP segment of a reassembled PDU]"
"192","14.038313","2a03:2880:f242:c6:face:b00c:0:7260","2a06:c701:46db:1a00:21d9:6346:9b9b:3579","TCP","1301","5222  >  52071 [PSH, ACK] Seq=4627 Ack=1474 Win=67840 Len=1227 [TCP segment of a reassembled PDU]"
"193","14.038437","2a06:c701:46db:1a00:21d9:6346:9b9b:3579","2a03:2880:f242:c6:face:b00c:0:7260","TCP","74","52071  >  5222 [ACK] Seq=1474 Ack=5854 Win=132096 Len=0"
"194","14.040508","2a06:c701:46db:1a00:21d9:6346:9b9b:3579","2a06:c700:2002:2:face:b00c:3333:7020","TCP","86","52072  >  443 [SYN] Seq=0 Win=65535 Len=0 MSS=1440 WS=256 SACK_PERM"
"195","14.050272","2a06:c700:2002:2:face:b00c:3333:7020","2a06:c701:46db:1a00:21d9:6346:9b9b:3579","TCP","86","443  >  52072 [SYN, ACK] Seq=0 Ack=1 Win=32016 Len=0 MSS=1392 SACK_PERM WS=256"
"196","14.050470","2a06:c701:46db:1a00:21d9:6346:9b9b:3579","2a06:c700:2002:2:face:b00c:3333:7020","TCP","74","52072  >  443 [ACK] Seq=1 Ack=1 Win=262144 Len=0"
"197","14.051774","2a06:c701:46db:1a00:21d9:6346:9b9b:3579","2a06:c700:2002:2:face:b00c:3333:7020","TLSv1.3","562","Client Hello"
"198","14.065077","2a06:c700:2002:2:face:b00c:3333:7020","2a06:c701:46db:1a00:21d9:6346:9b9b:3579","TCP","74","443  >  52072 [ACK] Seq=1 Ack=489 Win=31744 Len=0"
"199","14.065342","2a06:c700:2002:2:face:b00c:3333:7020","2a06:c701:46db:1a00:21d9:6346:9b9b:3579","TLSv1.3","286","Server Hello, Change Cipher Spec, Application Data"
"200","14.065428","2a06:c701:46db:1a00:21d9:6346:9b9b:3579","2a06:c700:2002:2:face:b00c:3333:7020","TCP","74","52072  >  443 [ACK] Seq=489 Ack=213 Win=261888 Len=0"
"201","14.066916","2a06:c701:46db:1a00:21d9:6346:9b9b:3579","2a06:c700:2002:2:face:b00c:3333:7020","TLSv1.3","138","Change Cipher Spec, Application Data"
"202","14.067140","2a06:c701:46db:1a00:21d9:6346:9b9b:3579","2a06:c700:2002:2:face:b00c:3333:7020","TLSv1.3","154","Application Data"
"203","14.067380","2a06:c701:46db:1a00:21d9:6346:9b9b:3579","2a06:c700:2002:2:face:b00c:3333:7020","TLSv1.3","232","Application Data"
"204","14.075784","2a06:c700:2002:2:face:b00c:3333:7020","2a06:c701:46db:1a00:21d9:6346:9b9b:3579","TCP","74","443  >  52072 [ACK] Seq=213 Ack=633 Win=31744 Len=0"
"205","14.076076","2a06:c700:2002:2:face:b00c:3333:7020","2a06:c701:46db:1a00:21d9:6346:9b9b:3579","TLSv1.3","258","Application Data"
"206","14.076076","2a06:c700:2002:2:face:b00c:3333:7020","2a06:c701:46db:1a00:21d9:6346:9b9b:3579","TLSv1.3","148","Application Data"
"207","14.076076","2a06:c700:2002:2:face:b00c:3333:7020","2a06:c701:46db:1a00:21d9:6346:9b9b:3579","TLSv1.3","105","Application Data"
"208","14.076164","2a06:c701:46db:1a00:21d9:6346:9b9b:3579","2a06:c700:2002:2:face:b00c:3333:7020","TCP","74","52072  >  443 [ACK] Seq=791 Ack=502 Win=261632 Len=0"
"209","14.076825","2a06:c700:2002:2:face:b00c:3333:7020","2a06:c701:46db:1a00:21d9:6346:9b9b:3579","TLSv1.3","177","Application Data"
"210","14.076863","2a06:c701:46db:1a00:21d9:6346:9b9b:3579","2a06:c700:2002:2:face:b00c:3333:7020","TCP","74","52072  >  443 [ACK] Seq=791 Ack=605 Win=261376 Len=0"
"211","14.077019","2a06:c701:46db:1a00:21d9:6346:9b9b:3579","2a06:c700:2002:2:face:b00c:3333:7020","TLSv1.3","105","Application Data"
"212","14.078574","2a06:c701:46db:1a00:21d9:6346:9b9b:3579","2a06:c700:2003:2:face:b00c:3333:7020","TCP","86","52073  >  443 [SYN] Seq=0 Win=65535 Len=0 MSS=1440 WS=256 SACK_PERM"
"213","14.087133","2a06:c700:2003:2:face:b00c:3333:7020","2a06:c701:46db:1a00:21d9:6346:9b9b:3579","TCP","86","443  >  52073 [SYN, ACK] Seq=0 Ack=1 Win=32016 Len=0 MSS=1392 SACK_PERM WS=256"
"214","14.087296","2a06:c701:46db:1a00:21d9:6346:9b9b:3579","2a06:c700:2003:2:face:b00c:3333:7020","TCP","74","52073  >  443 [ACK] Seq=1 Ack=1 Win=262144 Len=0"
"215","14.088459","2a06:c701:46db:1a00:21d9:6346:9b9b:3579","2a06:c700:2003:2:face:b00c:3333:7020","TLSv1.3","562","Client Hello"
"216","14.100210","2a06:c700:2003:2:face:b00c:3333:7020","2a06:c701:46db:1a00:21d9:6346:9b9b:3579","TCP","74","443  >  52073 [ACK] Seq=1 Ack=489 Win=31744 Len=0"
"217","14.100347","2a06:c700:2003:2:face:b00c:3333:7020","2a06:c701:46db:1a00:21d9:6346:9b9b:3579","TLSv1.3","286","Server Hello, Change Cipher Spec, Application Data"
"218","14.100491","2a06:c701:46db:1a00:21d9:6346:9b9b:3579","2a06:c700:2003:2:face:b00c:3333:7020","TCP","74","52073  >  443 [ACK] Seq=489 Ack=213 Win=261888 Len=0"
"219","14.101927","2a06:c701:46db:1a00:21d9:6346:9b9b:3579","2a06:c700:2003:2:face:b00c:3333:7020","TLSv1.3","138","Change Cipher Spec, Application Data"
"220","14.102129","2a06:c701:46db:1a00:21d9:6346:9b9b:3579","2a06:c700:2003:2:face:b00c:3333:7020","TLSv1.3","154","Application Data"
"221","14.102332","2a06:c701:46db:1a00:21d9:6346:9b9b:3579","2a06:c700:2003:2:face:b00c:3333:7020","TLSv1.3","232","Application Data"
"222","14.105438","2a06:c701:46db:1a00:21d9:6346:9b9b:3579","2a03:2880:f242:c8:face:b00c:0:167","TCP","74","[TCP Retransmission] 52026  >  443 [FIN, ACK] Seq=1 Ack=1 Win=1021 Len=0"
"223","14.105438","2a06:c701:46db:1a00:21d9:6346:9b9b:3579","2a06:c700:2003:10:face:b00c:3333:7020","TCP","74","[TCP Retransmission] 52025  >  443 [FIN, ACK] Seq=1 Ack=1 Win=1021 Len=0"
"224","14.105440","2a06:c701:46db:1a00:21d9:6346:9b9b:3579","2a06:c700:2003:2:face:b00c:3333:7020","TCP","74","[TCP Retransmission] 52024  >  443 [FIN, ACK] Seq=1 Ack=1 Win=1021 Len=0"
"225","14.105483","2a06:c701:46db:1a00:21d9:6346:9b9b:3579","2a06:c700:2002:2:face:b00c:3333:7020","TCP","74","[TCP Retransmission] 52023  >  443 [FIN, ACK] Seq=1 Ack=1 Win=1021 Len=0"
"226","14.105511","2a06:c701:46db:1a00:21d9:6346:9b9b:3579","2a03:2880:f242:c8:face:b00c:0:167","TCP","74","[TCP Retransmission] 52027  >  443 [FIN, ACK] Seq=1 Ack=1 Win=1018 Len=0"
"227","14.111776","2a06:c700:2003:2:face:b00c:3333:7020","2a06:c701:46db:1a00:21d9:6346:9b9b:3579","TCP","74","443  >  52073 [ACK] Seq=213 Ack=633 Win=31744 Len=0"
"228","14.112063","2a06:c700:2003:2:face:b00c:3333:7020","2a06:c701:46db:1a00:21d9:6346:9b9b:3579","TLSv1.3","258","Application Data"
"229","14.112063","2a06:c700:2003:2:face:b00c:3333:7020","2a06:c701:46db:1a00:21d9:6346:9b9b:3579","TLSv1.3","148","Application Data"
"230","14.112063","2a06:c700:2003:2:face:b00c:3333:7020","2a06:c701:46db:1a00:21d9:6346:9b9b:3579","TLSv1.3","105","Application Data"
"231","14.112236","2a06:c701:46db:1a00:21d9:6346:9b9b:3579","2a06:c700:2003:2:face:b00c:3333:7020","TCP","74","52073  >  443 [ACK] Seq=791 Ack=502 Win=261632 Len=0"
"232","14.112592","2a06:c700:2003:2:face:b00c:3333:7020","2a06:c701:46db:1a00:21d9:6346:9b9b:3579","TLSv1.3","177","Application Data"
"233","14.112649","2a06:c701:46db:1a00:21d9:6346:9b9b:3579","2a06:c700:2003:2:face:b00c:3333:7020","TCP","74","52073  >  443 [ACK] Seq=791 Ack=605 Win=261376 Len=0"
"234","14.113162","2a06:c701:46db:1a00:21d9:6346:9b9b:3579","2a06:c700:2003:2:face:b00c:3333:7020","TLSv1.3","105","Application Data"
"235","14.114471","2a06:c701:46db:1a00:21d9:6346:9b9b:3579","2a06:c700:2002:2:face:b00c:3333:7020","TLSv1.3","117","Application Data"
"236","14.123316","2a06:c700:2002:2:face:b00c:3333:7020","2a06:c701:46db:1a00:21d9:6346:9b9b:3579","TCP","74","443  >  52072 [ACK] Seq=605 Ack=865 Win=31744 Len=0"
"237","14.123550","2a06:c700:2002:2:face:b00c:3333:7020","2a06:c701:46db:1a00:21d9:6346:9b9b:3579","TLSv1.3","135","Application Data"
"238","14.123653","2a06:c701:46db:1a00:21d9:6346:9b9b:3579","2a06:c700:2002:2:face:b00c:3333:7020","TCP","74","52072  >  443 [ACK] Seq=865 Ack=666 Win=261376 Len=0"
"239","14.125297","2a06:c701:46db:1a00:21d9:6346:9b9b:3579","2a06:c700:2003:10:face:b00c:3333:7020","TCP","86","52074  >  443 [SYN] Seq=0 Win=65535 Len=0 MSS=1440 WS=256 SACK_PERM"
"240","14.134137","2a06:c700:2003:10:face:b00c:3333:7020","2a06:c701:46db:1a00:21d9:6346:9b9b:3579","TCP","86","443  >  52074 [SYN, ACK] Seq=0 Ack=1 Win=32016 Len=0 MSS=1392 SACK_PERM WS=256"
"241","14.134311","2a06:c701:46db:1a00:21d9:6346:9b9b:3579","2a06:c700:2003:10:face:b00c:3333:7020","TCP","74","52074  >  443 [ACK] Seq=1 Ack=1 Win=262144 Len=0"
"242","14.135337","2a06:c701:46db:1a00:21d9:6346:9b9b:3579","2a06:c700:2003:10:face:b00c:3333:7020","TLSv1.3","562","Client Hello"
"243","14.147495","2a06:c700:2003:10:face:b00c:3333:7020","2a06:c701:46db:1a00:21d9:6346:9b9b:3579","TCP","74","443  >  52074 [ACK] Seq=1 Ack=489 Win=31744 Len=0"
"244","14.148271","2a06:c700:2003:10:face:b00c:3333:7020","2a06:c701:46db:1a00:21d9:6346:9b9b:3579","TLSv1.3","286","Server Hello, Change Cipher Spec, Application Data"
"245","14.148390","2a06:c701:46db:1a00:21d9:6346:9b9b:3579","2a06:c700:2003:10:face:b00c:3333:7020","TCP","74","52074  >  443 [ACK] Seq=489 Ack=213 Win=261888 Len=0"
"246","14.149609","2a06:c701:46db:1a00:21d9:6346:9b9b:3579","2a06:c700:2003:10:face:b00c:3333:7020","TLSv1.3","138","Change Cipher Spec, Application Data"
"247","14.149976","2a06:c701:46db:1a00:21d9:6346:9b9b:3579","2a06:c700:2003:10:face:b00c:3333:7020","TLSv1.3","154","Application Data"
"248","14.150137","2a06:c701:46db:1a00:21d9:6346:9b9b:3579","2a06:c700:2003:10:face:b00c:3333:7020","TLSv1.3","232","Application Data"
