"No.","Time","Source","Destination","Protocol","Length","Info"
"13","0.438251","10.0.0.7","20.93.28.56","TCP","55","63905  >  443 [ACK] Seq=1 Ack=1 Win=516 Len=1 [TCP segment of a reassembled PDU]"
"16","0.526986","20.93.28.56","10.0.0.7","TCP","66","443  >  63905 [ACK] Seq=1 Ack=2 Win=501 Len=0 SLE=1 SRE=2"
"28","2.270339","34.85.166.233","10.0.0.7","TLSv1.2","81","Application Data"
"29","2.271784","10.0.0.7","34.85.166.233","TLSv1.2","85","Application Data"
"30","2.345117","10.0.0.7","13.248.151.210","TCP","55","63770  >  443 [ACK] Seq=1 Ack=1 Win=514 Len=1 [TCP segment of a reassembled PDU]"
"31","2.420233","34.85.166.233","10.0.0.7","TCP","56","443  >  51721 [ACK] Seq=28 Ack=32 Win=331 Len=0"
"32","2.423706","13.248.151.210","10.0.0.7","TCP","66","443  >  63770 [ACK] Seq=1 Ack=2 Win=129 Len=0 SLE=1 SRE=2"
"36","2.954063","15.197.213.252","10.0.0.7","TLSv1.2","94","Application Data"
"37","2.970449","10.0.0.7","15.197.213.252","TLSv1.2","96","Application Data"
"38","2.970605","10.0.0.7","15.197.213.252","TLSv1.2","96","Application Data"
"39","3.046938","15.197.213.252","10.0.0.7","TCP","56","443  >  63394 [ACK] Seq=41 Ack=85 Win=129 Len=0"
"40","3.079521","10.0.0.7","15.197.213.252","TCP","55","63903  >  443 [ACK] Seq=1 Ack=1 Win=515 Len=1 [TCP segment of a reassembled PDU]"
"41","3.156036","15.197.213.252","10.0.0.7","TCP","66","443  >  63903 [ACK] Seq=1 Ack=2 Win=114 Len=0 SLE=1 SRE=2"
"42","3.313835","10.0.0.7","54.159.251.179","TCP","55","51812  >  443 [ACK] Seq=1 Ack=1 Win=510 Len=1 [TCP segment of a reassembled PDU]"
"43","3.423303","10.0.0.7","140.82.121.6","TCP","55","51813  >  443 [ACK] Seq=1 Ack=1 Win=511 Len=1 [TCP segment of a reassembled PDU]"
"44","3.469939","54.159.251.179","10.0.0.7","TCP","66","443  >  51812 [ACK] Seq=1 Ack=2 Win=184 Len=0 SLE=1 SRE=2"
"45","3.484446","140.82.121.6","10.0.0.7","TCP","66","443  >  51813 [ACK] Seq=1 Ack=2 Win=75 Len=0 SLE=1 SRE=2"
"46","3.626411","2a06:c701:46db:1a00:21d9:6346:9b9b:3579","2a00:1450:4028:801::2005","TCP","75","63768  >  443 [ACK] Seq=1 Ack=1 Win=1024 Len=1 [TCP segment of a reassembled PDU]"
"47","3.636035","2a00:1450:4028:801::2005","2a06:c701:46db:1a00:21d9:6346:9b9b:3579","TCP","86","443  >  63768 [ACK] Seq=1 Ack=2 Win=3977 Len=0 SLE=1 SRE=2"
"51","4.360787","10.0.0.7","13.248.151.210","TCP","55","63736  >  443 [ACK] Seq=1 Ack=1 Win=514 Len=1 [TCP segment of a reassembled PDU]"
"52","4.438665","13.248.151.210","10.0.0.7","TCP","66","443  >  63736 [ACK] Seq=1 Ack=2 Win=162 Len=0 SLE=1 SRE=2"
"81","8.201239","10.0.0.7","76.223.31.44","TCP","55","63564  >  443 [ACK] Seq=1 Ack=1 Win=513 Len=1 [TCP segment of a reassembled PDU]"
"82","8.277156","76.223.31.44","10.0.0.7","TCP","66","443  >  63564 [ACK] Seq=1 Ack=2 Win=168 Len=0 SLE=1 SRE=2"
"83","8.823057","34.85.166.233","10.0.0.7","TLSv1.2","82","Application Data"
"84","8.823697","10.0.0.7","34.85.166.233","TLSv1.2","86","Application Data"
"85","8.971954","34.85.166.233","10.0.0.7","TCP","56","443  >  51721 [ACK] Seq=56 Ack=64 Win=331 Len=0"
"89","11.046053","2a03:2880:f242:c8:face:b00c:0:167","2a06:c701:46db:1a00:21d9:6346:9b9b:3579","TLSv1.2","353","Application Data"
"90","11.092688","2a06:c701:46db:1a00:21d9:6346:9b9b:3579","2a03:2880:f242:c8:face:b00c:0:167","TCP","74","51770  >  443 [ACK] Seq=1 Ack=280 Win=512 Len=0"
"91","11.128204","2a06:c701:46db:1a00:21d9:6346:9b9b:3579","2a03:2880:f242:c8:face:b00c:0:167","TLSv1.2","146","Application Data"
"92","11.175274","2a03:2880:f242:c8:face:b00c:0:167","2a06:c701:46db:1a00:21d9:6346:9b9b:3579","TCP","74","443  >  51770 [ACK] Seq=280 Ack=73 Win=296 Len=0"
"93","12.694428","2a06:c701:46db:1a00:21d9:6346:9b9b:3579","2600:9000:21f8:6400:1b:1fa2:78c0:93a1","TCP","75","51778  >  443 [ACK] Seq=1 Ack=1 Win=511 Len=1 [TCP segment of a reassembled PDU]"
"94","12.726610","2600:9000:21f8:6400:1b:1fa2:78c0:93a1","2a06:c701:46db:1a00:21d9:6346:9b9b:3579","TCP","86","443  >  51778 [ACK] Seq=1 Ack=2 Win=133 Len=0 SLE=1 SRE=2"
"137","15.212009","10.0.0.7","34.96.118.58","TCP","55","63560  >  443 [ACK] Seq=1 Ack=1 Win=1025 Len=1 [TCP segment of a reassembled PDU]"
"138","15.224765","34.96.118.58","10.0.0.7","TCP","66","443  >  63560 [ACK] Seq=1 Ack=2 Win=7308 Len=0 SLE=1 SRE=2"
"149","16.451474","2606:4700::6812:896","2a06:c701:46db:1a00:21d9:6346:9b9b:3579","TLSv1.2","113","Application Data"
"150","16.451755","2606:4700::6812:896","2a06:c701:46db:1a00:21d9:6346:9b9b:3579","TCP","74","443  >  63646 [FIN, ACK] Seq=40 Ack=1 Win=106 Len=0"
"151","16.451900","2a06:c701:46db:1a00:21d9:6346:9b9b:3579","2606:4700::6812:896","TCP","74","63646  >  443 [ACK] Seq=1 Ack=41 Win=513 Len=0"
"152","16.451972","2a06:c701:46db:1a00:21d9:6346:9b9b:3579","2606:4700::6812:896","TCP","74","63646  >  443 [FIN, ACK] Seq=1 Ack=41 Win=513 Len=0"
"153","16.462515","2606:4700::6812:896","2a06:c701:46db:1a00:21d9:6346:9b9b:3579","TCP","74","443  >  63646 [ACK] Seq=41 Ack=2 Win=106 Len=0"
"165","18.027526","2a06:c701:46db:1a00:21d9:6346:9b9b:3579","2a03:2880:f242:c8:face:b00c:0:167","TLSv1.2","144","Application Data"
"166","18.075291","2a03:2880:f242:c8:face:b00c:0:167","2a06:c701:46db:1a00:21d9:6346:9b9b:3579","TCP","74","443  >  51770 [ACK] Seq=280 Ack=143 Win=296 Len=0"
"167","18.158074","54.159.251.179","10.0.0.7","TLSv1.2","93","Application Data"
"168","18.158074","54.159.251.179","10.0.0.7","TLSv1.2","78","Application Data"
"169","18.158236","10.0.0.7","54.159.251.179","TCP","54","51812  >  443 [ACK] Seq=2 Ack=64 Win=510 Len=0"
"170","18.158512","10.0.0.7","54.159.251.179","TCP","54","51812  >  443 [FIN, ACK] Seq=2 Ack=64 Win=510 Len=0"
"171","18.158597","54.159.251.179","10.0.0.7","TCP","60","443  >  51812 [FIN, ACK] Seq=64 Ack=2 Win=184 Len=0"
"172","18.158660","10.0.0.7","54.159.251.179","TCP","54","51812  >  443 [ACK] Seq=3 Ack=65 Win=510 Len=0"
"173","18.161911","2a03:2880:f242:c8:face:b00c:0:167","2a06:c701:46db:1a00:21d9:6346:9b9b:3579","TLSv1.2","146","Application Data"
"174","18.214465","2a06:c701:46db:1a00:21d9:6346:9b9b:3579","2a03:2880:f242:c8:face:b00c:0:167","TCP","74","51770  >  443 [ACK] Seq=143 Ack=352 Win=512 Len=0"
"175","18.315156","54.159.251.179","10.0.0.7","TCP","60","443  >  51812 [ACK] Seq=65 Ack=3 Win=184 Len=0"
"178","18.744602","54.159.251.179","10.0.0.7","TCP","60","[TCP Retransmission] 443  >  51812 [FIN, ACK] Seq=64 Ack=3 Win=184 Len=0"
"179","18.744720","10.0.0.7","54.159.251.179","TCP","54","[TCP ZeroWindow] 51812  >  443 [ACK] Seq=3 Ack=65 Win=0 Len=0"
"184","20.258525","2a03:2880:f242:c8:face:b00c:0:167","2a06:c701:46db:1a00:21d9:6346:9b9b:3579","TLSv1.2","193","Application Data"
"185","20.262465","2a06:c701:46db:1a00:21d9:6346:9b9b:3579","2a03:2880:f242:c8:face:b00c:0:167","TLSv1.2","170","Application Data"
"186","20.277819","2a03:2880:f242:c8:face:b00c:0:167","2a06:c701:46db:1a00:21d9:6346:9b9b:3579","TLSv1.2","204","Application Data"
"187","20.277941","2a06:c701:46db:1a00:21d9:6346:9b9b:3579","2a03:2880:f242:c8:face:b00c:0:167","TCP","74","51770  >  443 [ACK] Seq=239 Ack=601 Win=516 Len=0"
"188","20.281270","2a06:c701:46db:1a00:21d9:6346:9b9b:3579","2a03:2880:f242:c8:face:b00c:0:167","TLSv1.2","174","Application Data"
"189","20.311436","2a03:2880:f242:c8:face:b00c:0:167","2a06:c701:46db:1a00:21d9:6346:9b9b:3579","TCP","74","443  >  51770 [ACK] Seq=601 Ack=239 Win=296 Len=0"
"190","20.328683","2a03:2880:f242:c8:face:b00c:0:167","2a06:c701:46db:1a00:21d9:6346:9b9b:3579","TCP","74","443  >  51770 [ACK] Seq=601 Ack=339 Win=296 Len=0"
"196","23.292729","2a03:2880:f242:c8:face:b00c:0:167","2a06:c701:46db:1a00:21d9:6346:9b9b:3579","TLSv1.2","561","Application Data"
"197","23.302515","20.199.120.151","10.0.0.7","TLSv1.2","421","Application Data"
"198","23.312925","10.0.0.7","20.199.120.151","TLSv1.2","188","Application Data"
"199","23.346828","2a06:c701:46db:1a00:21d9:6346:9b9b:3579","2a03:2880:f242:c8:face:b00c:0:167","TCP","74","51770  >  443 [ACK] Seq=339 Ack=1088 Win=514 Len=0"
"200","23.391421","2a06:c701:46db:1a00:21d9:6346:9b9b:3579","2a03:2880:f242:c8:face:b00c:0:167","TLSv1.2","167","Application Data"
"201","23.423214","20.199.120.151","10.0.0.7","TCP","60","443  >  49605 [ACK] Seq=368 Ack=135 Win=7957 Len=0"
"202","23.439239","2a03:2880:f242:c8:face:b00c:0:167","2a06:c701:46db:1a00:21d9:6346:9b9b:3579","TCP","74","443  >  51770 [ACK] Seq=1088 Ack=432 Win=296 Len=0"
"207","24.235658","2a03:2880:f242:c8:face:b00c:0:167","2a06:c701:46db:1a00:21d9:6346:9b9b:3579","TLSv1.2","722","Application Data"
"208","24.290498","2a06:c701:46db:1a00:21d9:6346:9b9b:3579","2a03:2880:f242:c8:face:b00c:0:167","TCP","74","51770  >  443 [ACK] Seq=432 Ack=1736 Win=512 Len=0"
"209","24.292784","2a06:c701:46db:1a00:21d9:6346:9b9b:3579","2a03:2880:f242:c8:face:b00c:0:167","TLSv1.2","170","Application Data"
"211","24.344252","2a03:2880:f242:c8:face:b00c:0:167","2a06:c701:46db:1a00:21d9:6346:9b9b:3579","TCP","74","443  >  51770 [ACK] Seq=1736 Ack=528 Win=296 Len=0"
"216","24.454015","2a06:c701:46db:1a00:21d9:6346:9b9b:3579","2600:9000:21f8:6400:1b:1fa2:78c0:93a1","TLSv1.2","133","Ignored Unknown Record"
"217","24.454104","2a06:c701:46db:1a00:21d9:6346:9b9b:3579","2600:9000:21f8:6400:1b:1fa2:78c0:93a1","TLSv1.2","113","Application Data"
"218","24.463330","2600:9000:21f8:6400:1b:1fa2:78c0:93a1","2a06:c701:46db:1a00:21d9:6346:9b9b:3579","TCP","74","443  >  51778 [ACK] Seq=1 Ack=61 Win=133 Len=0"
"219","24.463330","2600:9000:21f8:6400:1b:1fa2:78c0:93a1","2a06:c701:46db:1a00:21d9:6346:9b9b:3579","TCP","74","443  >  51778 [ACK] Seq=1 Ack=100 Win=133 Len=0"
"220","24.464246","2600:9000:21f8:6400:1b:1fa2:78c0:93a1","2a06:c701:46db:1a00:21d9:6346:9b9b:3579","TLSv1.2","113","Application Data"
"221","24.512744","2a06:c701:46db:1a00:21d9:6346:9b9b:3579","2600:9000:21f8:6400:1b:1fa2:78c0:93a1","TCP","74","51778  >  443 [ACK] Seq=100 Ack=40 Win=511 Len=0"
"223","24.551718","2a06:c701:46db:1a00:21d9:6346:9b9b:3579","2a03:2880:f242:c8:face:b00c:0:167","TLSv1.2","167","Application Data"
"224","24.551863","2a06:c701:46db:1a00:21d9:6346:9b9b:3579","2a03:2880:f242:c8:face:b00c:0:167","TLSv1.2","167","Application Data"
"228","24.599351","2a03:2880:f242:c8:face:b00c:0:167","2a06:c701:46db:1a00:21d9:6346:9b9b:3579","TCP","74","443  >  51770 [ACK] Seq=1736 Ack=621 Win=296 Len=0"
"229","24.600526","2a03:2880:f242:c8:face:b00c:0:167","2a06:c701:46db:1a00:21d9:6346:9b9b:3579","TCP","74","443  >  51770 [ACK] Seq=1736 Ack=714 Win=296 Len=0"
"250","24.722925","2600:9000:21f8:6400:1b:1fa2:78c0:93a1","2a06:c701:46db:1a00:21d9:6346:9b9b:3579","TLSv1.2","447","Application Data"
"260","24.732969","2a03:2880:f242:c8:face:b00c:0:167","2a06:c701:46db:1a00:21d9:6346:9b9b:3579","TLSv1.2","148","Application Data"
"261","24.736076","2a03:2880:f242:c8:face:b00c:0:167","2a06:c701:46db:1a00:21d9:6346:9b9b:3579","TLSv1.2","148","Application Data"
"262","24.736189","2a06:c701:46db:1a00:21d9:6346:9b9b:3579","2a03:2880:f242:c8:face:b00c:0:167","TCP","74","51770  >  443 [ACK] Seq=714 Ack=1884 Win=511 Len=0"
"272","24.765857","2a06:c701:46db:1a00:21d9:6346:9b9b:3579","2600:9000:21f8:6400:1b:1fa2:78c0:93a1","TCP","74","51778  >  443 [ACK] Seq=100 Ack=413 Win=514 Len=0"
"322","25.078639","2a06:c701:46db:1a00:21d9:6346:9b9b:3579","2a06:c700:2002:2:face:b00c:3333:7020","TCP","86","51817  >  443 [SYN] Seq=0 Win=65535 Len=0 MSS=1440 WS=256 SACK_PERM"
"324","25.088307","2a06:c700:2002:2:face:b00c:3333:7020","2a06:c701:46db:1a00:21d9:6346:9b9b:3579","TCP","86","443  >  51817 [SYN, ACK] Seq=0 Ack=1 Win=32016 Len=0 MSS=1392 SACK_PERM WS=256"
"325","25.088435","2a06:c701:46db:1a00:21d9:6346:9b9b:3579","2a06:c700:2002:2:face:b00c:3333:7020","TCP","74","51817  >  443 [ACK] Seq=1 Ack=1 Win=262144 Len=0"
"326","25.091736","2a06:c701:46db:1a00:21d9:6346:9b9b:3579","2a06:c700:2002:2:face:b00c:3333:7020","TLSv1.3","370","Client Hello"
"327","25.104627","2a06:c700:2002:2:face:b00c:3333:7020","2a06:c701:46db:1a00:21d9:6346:9b9b:3579","TCP","74","443  >  51817 [ACK] Seq=1 Ack=297 Win=31744 Len=0"
"328","25.105327","2a06:c700:2002:2:face:b00c:3333:7020","2a06:c701:46db:1a00:21d9:6346:9b9b:3579","TLSv1.3","1466","Server Hello, Change Cipher Spec, Application Data"
"329","25.105507","2a06:c701:46db:1a00:21d9:6346:9b9b:3579","2a06:c700:2002:2:face:b00c:3333:7020","TCP","74","51817  >  443 [ACK] Seq=297 Ack=1393 Win=262144 Len=0"
"330","25.105613","2a06:c700:2002:2:face:b00c:3333:7020","2a06:c701:46db:1a00:21d9:6346:9b9b:3579","TLSv1.3","1466","Application Data"
"331","25.105696","2a06:c701:46db:1a00:21d9:6346:9b9b:3579","2a06:c700:2002:2:face:b00c:3333:7020","TCP","74","51817  >  443 [ACK] Seq=297 Ack=2785 Win=262144 Len=0"
"332","25.105800","2a06:c700:2002:2:face:b00c:3333:7020","2a06:c701:46db:1a00:21d9:6346:9b9b:3579","TLSv1.3","426","Application Data"
"333","25.105866","2a06:c701:46db:1a00:21d9:6346:9b9b:3579","2a06:c700:2002:2:face:b00c:3333:7020","TCP","74","51817  >  443 [ACK] Seq=297 Ack=3137 Win=261632 Len=0"
"334","25.110659","2a06:c701:46db:1a00:21d9:6346:9b9b:3579","2a06:c700:2002:2:face:b00c:3333:7020","TLSv1.3","138","Change Cipher Spec, Application Data"
"335","25.117528","2a06:c701:46db:1a00:21d9:6346:9b9b:3579","2a06:c700:2002:2:face:b00c:3333:7020","TLSv1.3","154","Application Data"
"336","25.119008","2a06:c700:2002:2:face:b00c:3333:7020","2a06:c701:46db:1a00:21d9:6346:9b9b:3579","TLSv1.3","258","Application Data"
"337","25.119130","2a06:c701:46db:1a00:21d9:6346:9b9b:3579","2a06:c700:2002:2:face:b00c:3333:7020","TCP","74","51817  >  443 [ACK] Seq=441 Ack=3321 Win=261376 Len=0"
"338","25.119227","2a06:c700:2002:2:face:b00c:3333:7020","2a06:c701:46db:1a00:21d9:6346:9b9b:3579","TLSv1.3","148","Application Data"
"339","25.119269","2a06:c701:46db:1a00:21d9:6346:9b9b:3579","2a06:c700:2002:2:face:b00c:3333:7020","TCP","74","51817  >  443 [ACK] Seq=441 Ack=3395 Win=261376 Len=0"
"340","25.119781","2a06:c701:46db:1a00:21d9:6346:9b9b:3579","2a06:c700:2002:2:face:b00c:3333:7020","TLSv1.3","232","Application Data"
"341","25.119856","2a06:c701:46db:1a00:21d9:6346:9b9b:3579","2a06:c700:2002:2:face:b00c:3333:7020","TLSv1.3","105","Application Data"
"342","25.126241","2a06:c700:2002:2:face:b00c:3333:7020","2a06:c701:46db:1a00:21d9:6346:9b9b:3579","TLSv1.3","105","Application Data"
"343","25.126379","2a06:c701:46db:1a00:21d9:6346:9b9b:3579","2a06:c700:2002:2:face:b00c:3333:7020","TCP","74","51817  >  443 [ACK] Seq=630 Ack=3426 Win=261376 Len=0"
"344","25.128976","2a06:c700:2002:2:face:b00c:3333:7020","2a06:c701:46db:1a00:21d9:6346:9b9b:3579","TLSv1.3","177","Application Data"
"345","25.129053","2a06:c701:46db:1a00:21d9:6346:9b9b:3579","2a06:c700:2002:2:face:b00c:3333:7020","TCP","74","51817  >  443 [ACK] Seq=630 Ack=3529 Win=261376 Len=0"
"351","25.160904","2a06:c701:46db:1a00:21d9:6346:9b9b:3579","2a06:c700:2003:2:face:b00c:3333:7020","TCP","86","51818  >  443 [SYN] Seq=0 Win=65535 Len=0 MSS=1440 WS=256 SACK_PERM"
"352","25.175486","2a06:c700:2003:2:face:b00c:3333:7020","2a06:c701:46db:1a00:21d9:6346:9b9b:3579","TCP","86","443  >  51818 [SYN, ACK] Seq=0 Ack=1 Win=32016 Len=0 MSS=1392 SACK_PERM WS=256"
"354","25.175486","2a06:c700:2002:2:face:b00c:3333:7020","2a06:c701:46db:1a00:21d9:6346:9b9b:3579","TCP","74","443  >  51817 [ACK] Seq=3529 Ack=630 Win=31744 Len=0"
"355","25.175713","2a06:c701:46db:1a00:21d9:6346:9b9b:3579","2a06:c700:2003:2:face:b00c:3333:7020","TCP","74","51818  >  443 [ACK] Seq=1 Ack=1 Win=262144 Len=0"
"356","25.176778","2a06:c701:46db:1a00:21d9:6346:9b9b:3579","2a06:c700:2003:2:face:b00c:3333:7020","TLSv1.3","370","Client Hello"
"357","25.191412","2a06:c700:2003:2:face:b00c:3333:7020","2a06:c701:46db:1a00:21d9:6346:9b9b:3579","TCP","74","443  >  51818 [ACK] Seq=1 Ack=297 Win=31744 Len=0"
"358","25.191412","2a06:c700:2003:2:face:b00c:3333:7020","2a06:c701:46db:1a00:21d9:6346:9b9b:3579","TLSv1.3","1466","Server Hello, Change Cipher Spec, Application Data"
"359","25.191412","2a06:c700:2003:2:face:b00c:3333:7020","2a06:c701:46db:1a00:21d9:6346:9b9b:3579","TLSv1.3","1466","Application Data"
"360","25.191412","2a06:c700:2003:2:face:b00c:3333:7020","2a06:c701:46db:1a00:21d9:6346:9b9b:3579","TLSv1.3","427","Application Data"
"361","25.191688","2a06:c701:46db:1a00:21d9:6346:9b9b:3579","2a06:c700:2003:2:face:b00c:3333:7020","TCP","74","51818  >  443 [ACK] Seq=297 Ack=3138 Win=262144 Len=0"
"362","25.193531","2a06:c701:46db:1a00:21d9:6346:9b9b:3579","2a06:c700:2003:2:face:b00c:3333:7020","TLSv1.3","138","Change Cipher Spec, Application Data"
"363","25.194233","2a06:c701:46db:1a00:21d9:6346:9b9b:3579","2a06:c700:2003:2:face:b00c:3333:7020","TLSv1.3","154","Application Data"
"364","25.194411","2a06:c701:46db:1a00:21d9:6346:9b9b:3579","2a06:c700:2003:2:face:b00c:3333:7020","TLSv1.3","232","Application Data"
"365","25.207424","2a06:c700:2003:2:face:b00c:3333:7020","2a06:c701:46db:1a00:21d9:6346:9b9b:3579","TLSv1.3","258","Application Data"
"366","25.207424","2a06:c700:2003:2:face:b00c:3333:7020","2a06:c701:46db:1a00:21d9:6346:9b9b:3579","TLSv1.3","148","Application Data"
"367","25.207424","2a06:c700:2003:2:face:b00c:3333:7020","2a06:c701:46db:1a00:21d9:6346:9b9b:3579","TLSv1.3","186","Application Data"
"368","25.207424","2a06:c700:2003:2:face:b00c:3333:7020","2a06:c701:46db:1a00:21d9:6346:9b9b:3579","TCP","74","443  >  51818 [ACK] Seq=3396 Ack=599 Win=31744 Len=0"
"369","25.207629","2a06:c701:46db:1a00:21d9:6346:9b9b:3579","2a06:c700:2003:2:face:b00c:3333:7020","TCP","74","51818  >  443 [ACK] Seq=599 Ack=3508 Win=261632 Len=0"
"370","25.208341","2a06:c701:46db:1a00:21d9:6346:9b9b:3579","2a06:c700:2003:2:face:b00c:3333:7020","TLSv1.3","105","Application Data"
"371","25.209499","2a06:c701:46db:1a00:21d9:6346:9b9b:3579","2a06:c700:2002:2:face:b00c:3333:7020","TLSv1.3","117","Application Data"
"372","25.217921","2a06:c700:2002:2:face:b00c:3333:7020","2a06:c701:46db:1a00:21d9:6346:9b9b:3579","TCP","74","443  >  51817 [ACK] Seq=3529 Ack=673 Win=31744 Len=0"
"373","25.217921","2a06:c700:2002:2:face:b00c:3333:7020","2a06:c701:46db:1a00:21d9:6346:9b9b:3579","TLSv1.3","158","Application Data"
"374","25.218045","2a06:c701:46db:1a00:21d9:6346:9b9b:3579","2a06:c700:2002:2:face:b00c:3333:7020","TCP","74","51817  >  443 [ACK] Seq=673 Ack=3613 Win=261120 Len=0"
"379","25.233502","2a06:c701:46db:1a00:21d9:6346:9b9b:3579","2a06:c700:2003:10:face:b00c:3333:7020","TCP","86","51819  >  443 [SYN] Seq=0 Win=65535 Len=0 MSS=1440 WS=256 SACK_PERM"
"380","25.241796","2a06:c700:2003:10:face:b00c:3333:7020","2a06:c701:46db:1a00:21d9:6346:9b9b:3579","TCP","86","443  >  51819 [SYN, ACK] Seq=0 Ack=1 Win=32016 Len=0 MSS=1392 SACK_PERM WS=256"
"381","25.241971","2a06:c701:46db:1a00:21d9:6346:9b9b:3579","2a06:c700:2003:10:face:b00c:3333:7020","TCP","74","51819  >  443 [ACK] Seq=1 Ack=1 Win=262144 Len=0"
"382","25.242859","2a06:c701:46db:1a00:21d9:6346:9b9b:3579","2a06:c700:2003:10:face:b00c:3333:7020","TLSv1.3","370","Client Hello"
"383","25.255619","2a06:c700:2003:10:face:b00c:3333:7020","2a06:c701:46db:1a00:21d9:6346:9b9b:3579","TCP","74","443  >  51819 [ACK] Seq=1 Ack=297 Win=31744 Len=0"
"384","25.255829","2a06:c700:2003:10:face:b00c:3333:7020","2a06:c701:46db:1a00:21d9:6346:9b9b:3579","TLSv1.3","1466","Server Hello, Change Cipher Spec, Application Data"
"385","25.255973","2a06:c701:46db:1a00:21d9:6346:9b9b:3579","2a06:c700:2003:10:face:b00c:3333:7020","TCP","74","51819  >  443 [ACK] Seq=297 Ack=1393 Win=262144 Len=0"
"386","25.256312","2a06:c700:2003:10:face:b00c:3333:7020","2a06:c701:46db:1a00:21d9:6346:9b9b:3579","TLSv1.3","1466","Application Data"
"387","25.256312","2a06:c700:2003:10:face:b00c:3333:7020","2a06:c701:46db:1a00:21d9:6346:9b9b:3579","TLSv1.3","425","Application Data"
"388","25.256377","2a06:c701:46db:1a00:21d9:6346:9b9b:3579","2a06:c700:2003:10:face:b00c:3333:7020","TCP","74","51819  >  443 [ACK] Seq=297 Ack=3136 Win=262144 Len=0"
"389","25.256815","2a06:c700:2003:2:face:b00c:3333:7020","2a06:c701:46db:1a00:21d9:6346:9b9b:3579","TCP","74","443  >  51818 [ACK] Seq=3508 Ack=630 Win=31744 Len=0"
"390","25.258112","2a06:c701:46db:1a00:21d9:6346:9b9b:3579","2a06:c700:2003:10:face:b00c:3333:7020","TLSv1.3","138","Change Cipher Spec, Application Data"
"391","25.258795","2a06:c701:46db:1a00:21d9:6346:9b9b:3579","2a06:c700:2003:10:face:b00c:3333:7020","TLSv1.3","154","Application Data"
"392","25.258969","2a06:c701:46db:1a00:21d9:6346:9b9b:3579","2a06:c700:2003:10:face:b00c:3333:7020","TLSv1.3","232","Application Data"
"393","25.269307","2a06:c700:2003:10:face:b00c:3333:7020","2a06:c701:46db:1a00:21d9:6346:9b9b:3579","TLSv1.3","258","Application Data"
"394","25.269307","2a06:c700:2003:10:face:b00c:3333:7020","2a06:c701:46db:1a00:21d9:6346:9b9b:3579","TLSv1.3","148","Application Data"
"395","25.269464","2a06:c701:46db:1a00:21d9:6346:9b9b:3579","2a06:c700:2003:10:face:b00c:3333:7020","TCP","74","51819  >  443 [ACK] Seq=599 Ack=3394 Win=261632 Len=0"
"396","25.269585","2a06:c700:2003:10:face:b00c:3333:7020","2a06:c701:46db:1a00:21d9:6346:9b9b:3579","TLSv1.3","105","Application Data"
"397","25.269646","2a06:c701:46db:1a00:21d9:6346:9b9b:3579","2a06:c700:2003:10:face:b00c:3333:7020","TCP","74","51819  >  443 [ACK] Seq=599 Ack=3425 Win=261632 Len=0"
"398","25.269731","2a06:c700:2003:10:face:b00c:3333:7020","2a06:c701:46db:1a00:21d9:6346:9b9b:3579","TCP","74","443  >  51819 [ACK] Seq=3136 Ack=441 Win=31744 Len=0"
"399","25.269757","2a06:c701:46db:1a00:21d9:6346:9b9b:3579","2a06:c700:2003:10:face:b00c:3333:7020","TCP","74","[TCP Dup ACK 397#1] 51819  >  443 [ACK] Seq=599 Ack=3425 Win=261632 Len=0"
"400","25.270045","2a06:c700:2003:10:face:b00c:3333:7020","2a06:c701:46db:1a00:21d9:6346:9b9b:3579","TLSv1.3","177","Application Data"
"401","25.270050","2a06:c701:46db:1a00:21d9:6346:9b9b:3579","2a06:c700:2003:10:face:b00c:3333:7020","TLSv1.3","105","Application Data"
"402","25.270121","2a06:c701:46db:1a00:21d9:6346:9b9b:3579","2a06:c700:2003:10:face:b00c:3333:7020","TCP","74","51819  >  443 [ACK] Seq=630 Ack=3528 Win=261632 Len=0"
"407","25.285026","2a06:c701:46db:1a00:21d9:6346:9b9b:3579","2a03:2880:f242:c8:face:b00c:0:167","TCP","86","51820  >  443 [SYN] Seq=0 Win=65535 Len=0 MSS=1440 WS=256 SACK_PERM"
"408","25.319327","2a06:c700:2003:10:face:b00c:3333:7020","2a06:c701:46db:1a00:21d9:6346:9b9b:3579","TCP","74","443  >  51819 [ACK] Seq=3528 Ack=630 Win=31744 Len=0"
"409","25.332555","2a03:2880:f242:c8:face:b00c:0:167","2a06:c701:46db:1a00:21d9:6346:9b9b:3579","TCP","86","443  >  51820 [SYN, ACK] Seq=0 Ack=1 Win=65535 Len=0 MSS=1392 SACK_PERM WS=256"
"410","25.332705","2a06:c701:46db:1a00:21d9:6346:9b9b:3579","2a03:2880:f242:c8:face:b00c:0:167","TCP","74","51820  >  443 [ACK] Seq=1 Ack=1 Win=262144 Len=0"
"411","25.333700","2a06:c701:46db:1a00:21d9:6346:9b9b:3579","2a03:2880:f242:c8:face:b00c:0:167","TLSv1.3","368","Client Hello"
"412","25.383740","2a03:2880:f242:c8:face:b00c:0:167","2a06:c701:46db:1a00:21d9:6346:9b9b:3579","TCP","74","443  >  51820 [ACK] Seq=1 Ack=295 Win=66816 Len=0"
"413","25.399978","2a03:2880:f242:c8:face:b00c:0:167","2a06:c701:46db:1a00:21d9:6346:9b9b:3579","TLSv1.3","1466","Server Hello, Change Cipher Spec, Application Data"
"414","25.399978","2a03:2880:f242:c8:face:b00c:0:167","2a06:c701:46db:1a00:21d9:6346:9b9b:3579","TLSv1.3","1466","Application Data"
"415","25.399978","2a03:2880:f242:c8:face:b00c:0:167","2a06:c701:46db:1a00:21d9:6346:9b9b:3579","TLSv1.3","461","Application Data"
"416","25.400203","2a06:c701:46db:1a00:21d9:6346:9b9b:3579","2a03:2880:f242:c8:face:b00c:0:167","TCP","74","51820  >  443 [ACK] Seq=295 Ack=3172 Win=262144 Len=0"
"417","25.402977","2a06:c701:46db:1a00:21d9:6346:9b9b:3579","2a03:2880:f242:c8:face:b00c:0:167","TLSv1.3","138","Change Cipher Spec, Application Data"
"418","25.403940","2a06:c701:46db:1a00:21d9:6346:9b9b:3579","2a03:2880:f242:c8:face:b00c:0:167","TLSv1.3","154","Application Data"
"419","25.404114","2a06:c701:46db:1a00:21d9:6346:9b9b:3579","2a03:2880:f242:c8:face:b00c:0:167","TLSv1.3","231","Application Data"
"420","25.463771","2a03:2880:f242:c8:face:b00c:0:167","2a06:c701:46db:1a00:21d9:6346:9b9b:3579","TLSv1.3","245","Application Data"
"421","25.463771","2a03:2880:f242:c8:face:b00c:0:167","2a06:c701:46db:1a00:21d9:6346:9b9b:3579","TLSv1.3","148","Application Data"
"422","25.463771","2a03:2880:f242:c8:face:b00c:0:167","2a06:c701:46db:1a00:21d9:6346:9b9b:3579","TLSv1.3","186","Application Data"
"423","25.463985","2a06:c701:46db:1a00:21d9:6346:9b9b:3579","2a03:2880:f242:c8:face:b00c:0:167","TCP","74","51820  >  443 [ACK] Seq=596 Ack=3529 Win=261632 Len=0"
"424","25.464778","2a06:c701:46db:1a00:21d9:6346:9b9b:3579","2a03:2880:f242:c8:face:b00c:0:167","TLSv1.3","105","Application Data"
"429","25.480135","2a06:c701:46db:1a00:21d9:6346:9b9b:3579","2a03:2880:f242:c8:face:b00c:0:167","TCP","86","51821  >  443 [SYN] Seq=0 Win=65535 Len=0 MSS=1440 WS=256 SACK_PERM"
"431","25.530990","2a03:2880:f242:c8:face:b00c:0:167","2a06:c701:46db:1a00:21d9:6346:9b9b:3579","TCP","86","443  >  51821 [SYN, ACK] Seq=0 Ack=1 Win=65535 Len=0 MSS=1392 SACK_PERM WS=256"
"432","25.531144","2a06:c701:46db:1a00:21d9:6346:9b9b:3579","2a03:2880:f242:c8:face:b00c:0:167","TCP","74","51821  >  443 [ACK] Seq=1 Ack=1 Win=262144 Len=0"
"433","25.532081","2a06:c701:46db:1a00:21d9:6346:9b9b:3579","2a03:2880:f242:c8:face:b00c:0:167","TLSv1.3","355","Client Hello"
"434","25.552975","2a03:2880:f242:c8:face:b00c:0:167","2a06:c701:46db:1a00:21d9:6346:9b9b:3579","TCP","74","443  >  51820 [ACK] Seq=3529 Ack=627 Win=67840 Len=0"
"435","25.584287","2a03:2880:f242:c8:face:b00c:0:167","2a06:c701:46db:1a00:21d9:6346:9b9b:3579","TCP","74","443  >  51821 [ACK] Seq=1 Ack=282 Win=66816 Len=0"
"436","25.584287","2a03:2880:f242:c8:face:b00c:0:167","2a06:c701:46db:1a00:21d9:6346:9b9b:3579","TLSv1.3","1466","Server Hello, Change Cipher Spec, Application Data"
"437","25.584287","2a03:2880:f242:c8:face:b00c:0:167","2a06:c701:46db:1a00:21d9:6346:9b9b:3579","TLSv1.3","1466","Application Data"
"438","25.584287","2a03:2880:f242:c8:face:b00c:0:167","2a06:c701:46db:1a00:21d9:6346:9b9b:3579","TLSv1.3","462","Application Data"
"439","25.584546","2a06:c701:46db:1a00:21d9:6346:9b9b:3579","2a03:2880:f242:c8:face:b00c:0:167","TCP","74","51821  >  443 [ACK] Seq=282 Ack=3173 Win=262144 Len=0"
"440","25.586230","2a06:c701:46db:1a00:21d9:6346:9b9b:3579","2a03:2880:f242:c8:face:b00c:0:167","TLSv1.3","138","Change Cipher Spec, Application Data"
"441","25.586993","2a06:c701:46db:1a00:21d9:6346:9b9b:3579","2a03:2880:f242:c8:face:b00c:0:167","TLSv1.3","154","Application Data"
"442","25.587196","2a06:c701:46db:1a00:21d9:6346:9b9b:3579","2a03:2880:f242:c8:face:b00c:0:167","TLSv1.3","308","Application Data"
"443","25.637508","2a03:2880:f242:c8:face:b00c:0:167","2a06:c701:46db:1a00:21d9:6346:9b9b:3579","TCP","74","443  >  51821 [ACK] Seq=3173 Ack=426 Win=66816 Len=0"
"444","25.637764","2a03:2880:f242:c8:face:b00c:0:167","2a06:c701:46db:1a00:21d9:6346:9b9b:3579","TLSv1.3","245","Application Data"
"445","25.637892","2a06:c701:46db:1a00:21d9:6346:9b9b:3579","2a03:2880:f242:c8:face:b00c:0:167","TCP","74","51821  >  443 [ACK] Seq=660 Ack=3344 Win=261888 Len=0"
"446","25.638537","2a03:2880:f242:c8:face:b00c:0:167","2a06:c701:46db:1a00:21d9:6346:9b9b:3579","TLSv1.3","148","Application Data"
"447","25.638618","2a06:c701:46db:1a00:21d9:6346:9b9b:3579","2a03:2880:f242:c8:face:b00c:0:167","TCP","74","51821  >  443 [ACK] Seq=660 Ack=3418 Win=261888 Len=0"
"448","25.638831","2a03:2880:f242:c8:face:b00c:0:167","2a06:c701:46db:1a00:21d9:6346:9b9b:3579","TLSv1.3","118","Application Data"
"449","25.638871","2a06:c701:46db:1a00:21d9:6346:9b9b:3579","2a03:2880:f242:c8:face:b00c:0:167","TCP","74","51821  >  443 [ACK] Seq=660 Ack=3462 Win=261632 Len=0"
"450","25.639009","2a06:c701:46db:1a00:21d9:6346:9b9b:3579","2a03:2880:f242:c8:face:b00c:0:167","TLSv1.3","105","Application Data"
"451","25.643689","2a03:2880:f242:c8:face:b00c:0:167","2a06:c701:46db:1a00:21d9:6346:9b9b:3579","TCP","1466","443  >  51821 [ACK] Seq=3462 Ack=660 Win=67840 Len=1392 [TCP segment of a reassembled PDU]"
"452","25.643689","2a03:2880:f242:c8:face:b00c:0:167","2a06:c701:46db:1a00:21d9:6346:9b9b:3579","TLSv1.3","1322","Application Data, Application Data"
"453","25.643880","2a06:c701:46db:1a00:21d9:6346:9b9b:3579","2a03:2880:f242:c8:face:b00c:0:167","TCP","74","51821  >  443 [ACK] Seq=691 Ack=6102 Win=262144 Len=0"
"454","25.726542","2a03:2880:f242:c8:face:b00c:0:167","2a06:c701:46db:1a00:21d9:6346:9b9b:3579","TCP","74","443  >  51821 [ACK] Seq=6102 Ack=691 Win=67840 Len=0"
"455","26.120685","2a03:2880:f242:c8:face:b00c:0:167","2a06:c701:46db:1a00:21d9:6346:9b9b:3579","TLSv1.2","204","Application Data"
"458","26.122742","2a06:c701:46db:1a00:21d9:6346:9b9b:3579","2a03:2880:f242:c8:face:b00c:0:167","TLSv1.2","174","Application Data"
"459","26.175529","2a03:2880:f242:c8:face:b00c:0:167","2a06:c701:46db:1a00:21d9:6346:9b9b:3579","TCP","74","443  >  51770 [ACK] Seq=2014 Ack=814 Win=296 Len=0"
"461","26.187274","2a03:2880:f242:c8:face:b00c:0:167","2a06:c701:46db:1a00:21d9:6346:9b9b:3579","TLSv1.2","193","Application Data"
"463","26.189490","2a06:c701:46db:1a00:21d9:6346:9b9b:3579","2a03:2880:f242:c8:face:b00c:0:167","TLSv1.2","170","Application Data"
"465","26.264260","2a03:2880:f242:c8:face:b00c:0:167","2a06:c701:46db:1a00:21d9:6346:9b9b:3579","TLSv1.2","194","Application Data"
"467","26.267283","2a06:c701:46db:1a00:21d9:6346:9b9b:3579","2a03:2880:f242:c8:face:b00c:0:167","TLSv1.2","169","Application Data"
"468","26.355218","2a03:2880:f242:c8:face:b00c:0:167","2a06:c701:46db:1a00:21d9:6346:9b9b:3579","TCP","74","443  >  51770 [ACK] Seq=2253 Ack=1005 Win=296 Len=0"
"495","28.593839","10.0.0.7","199.232.82.132","TCP","55","51785  >  443 [ACK] Seq=1 Ack=1 Win=511 Len=1 [TCP segment of a reassembled PDU]"
"496","28.640799","199.232.82.132","10.0.0.7","TCP","66","443  >  51785 [ACK] Seq=1 Ack=2 Win=290 Len=0 SLE=1 SRE=2"
"497","28.786493","10.0.0.7","146.75.58.217","TCP","55","51784  >  443 [ACK] Seq=1 Ack=1 Win=510 Len=1 [TCP segment of a reassembled PDU]"
"498","28.861335","146.75.58.217","10.0.0.7","TCP","66","443  >  51784 [ACK] Seq=1 Ack=2 Win=298 Len=0 SLE=1 SRE=2"
"502","29.202920","10.0.0.7","20.199.120.182","TLSv1.2","98","Application Data"
"503","29.268199","20.199.120.182","10.0.0.7","TLSv1.2","229","Application Data"
"504","29.314434","10.0.0.7","20.199.120.182","TCP","54","61001  >  443 [ACK] Seq=45 Ack=176 Win=514 Len=0"
"519","36.261148","2a03:2880:f242:c8:face:b00c:0:167","2a06:c701:46db:1a00:21d9:6346:9b9b:3579","TLSv1.2","194","Application Data"
"521","36.263070","2a06:c701:46db:1a00:21d9:6346:9b9b:3579","2a03:2880:f242:c8:face:b00c:0:167","TLSv1.2","169","Application Data"
"523","36.309863","2a03:2880:f242:c8:face:b00c:0:167","2a06:c701:46db:1a00:21d9:6346:9b9b:3579","TCP","74","443  >  51770 [ACK] Seq=2373 Ack=1100 Win=296 Len=0"
"526","36.827781","34.85.166.233","10.0.0.7","TLSv1.2","82","Application Data"
"527","36.828475","10.0.0.7","34.85.166.233","TLSv1.2","86","Application Data"
"528","36.976175","34.85.166.233","10.0.0.7","TCP","56","443  >  51721 [ACK] Seq=84 Ack=96 Win=331 Len=0"
"530","37.923468","34.85.166.233","10.0.0.7","TLSv1.2","81","Application Data"
"531","37.924866","10.0.0.7","34.85.166.233","TLSv1.2","85","Application Data"
"532","38.073409","34.85.166.233","10.0.0.7","TCP","56","443  >  51721 [ACK] Seq=111 Ack=127 Win=331 Len=0"
"533","38.553958","10.0.0.7","20.93.28.56","TCP","55","63908  >  443 [ACK] Seq=1 Ack=1 Win=516 Len=1 [TCP segment of a reassembled PDU]"
"534","38.631437","20.93.28.56","10.0.0.7","TCP","66","443  >  63908 [ACK] Seq=1 Ack=2 Win=501 Len=0 SLE=1 SRE=2"
"557","41.129515","10.0.0.7","13.226.2.52","TCP","55","51773  >  443 [ACK] Seq=1 Ack=1 Win=517 Len=1 [TCP segment of a reassembled PDU]"
"558","41.141420","13.226.2.52","10.0.0.7","TCP","66","443  >  51773 [ACK] Seq=1 Ack=2 Win=136 Len=0 SLE=1 SRE=2"
"563","42.631696","2a06:c701:46db:1a00:21d9:6346:9b9b:3579","2a03:2880:f242:c8:face:b00c:0:167","TLSv1.2","144","Application Data"
"564","42.678892","2a03:2880:f242:c8:face:b00c:0:167","2a06:c701:46db:1a00:21d9:6346:9b9b:3579","TCP","74","443  >  51770 [ACK] Seq=2373 Ack=1170 Win=296 Len=0"
"565","42.766051","2a03:2880:f242:c8:face:b00c:0:167","2a06:c701:46db:1a00:21d9:6346:9b9b:3579","TLSv1.2","146","Application Data"
"578","42.810244","2a06:c701:46db:1a00:21d9:6346:9b9b:3579","2a03:2880:f242:c8:face:b00c:0:167","TCP","74","51770  >  443 [ACK] Seq=1170 Ack=2445 Win=514 Len=0"
"590","43.290338","10.0.0.7","107.178.240.159","TCP","55","51787  >  443 [ACK] Seq=1 Ack=1 Win=512 Len=1 [TCP segment of a reassembled PDU]"
"591","43.300442","107.178.240.159","10.0.0.7","TCP","66","443  >  51787 [ACK] Seq=1 Ack=2 Win=332 Len=0 SLE=1 SRE=2"
"618","45.534541","10.0.0.7","20.93.28.56","TCP","55","[TCP Keep-Alive] 63905  >  443 [ACK] Seq=1 Ack=1 Win=516 Len=1"
"619","45.621889","20.93.28.56","10.0.0.7","TCP","66","[TCP Keep-Alive ACK] 443  >  63905 [ACK] Seq=1 Ack=2 Win=501 Len=0 SLE=1 SRE=2"
"631","47.428865","10.0.0.7","13.248.151.210","TCP","55","[TCP Keep-Alive] 63770  >  443 [ACK] Seq=1 Ack=1 Win=514 Len=1"
"632","47.509566","13.248.151.210","10.0.0.7","TCP","66","[TCP Keep-Alive ACK] 443  >  63770 [ACK] Seq=1 Ack=2 Win=129 Len=0 SLE=1 SRE=2"
"635","48.004232","2a03:2880:f242:c8:face:b00c:0:167","2a06:c701:46db:1a00:21d9:6346:9b9b:3579","TLSv1.2","194","Application Data"
"636","48.007093","2a06:c701:46db:1a00:21d9:6346:9b9b:3579","2a03:2880:f242:c8:face:b00c:0:167","TLSv1.2","169","Application Data"
"637","48.054519","2a03:2880:f242:c8:face:b00c:0:167","2a06:c701:46db:1a00:21d9:6346:9b9b:3579","TCP","74","443  >  51770 [ACK] Seq=2565 Ack=1265 Win=296 Len=0"
"638","48.057378","10.0.0.7","15.197.213.252","TCP","55","[TCP Keep-Alive] 63394  >  443 [ACK] Seq=84 Ack=41 Win=513 Len=1"
"639","48.133158","15.197.213.252","10.0.0.7","TCP","66","[TCP Keep-Alive ACK] 443  >  63394 [ACK] Seq=41 Ack=85 Win=129 Len=0 SLE=84 SRE=85"
"640","48.159895","10.0.0.7","15.197.213.252","TCP","55","[TCP Keep-Alive] 63903  >  443 [ACK] Seq=1 Ack=1 Win=515 Len=1"
"641","48.237014","15.197.213.252","10.0.0.7","TCP","66","[TCP Keep-Alive ACK] 443  >  63903 [ACK] Seq=1 Ack=2 Win=114 Len=0 SLE=1 SRE=2"
"642","48.486522","10.0.0.7","140.82.121.6","TCP","55","[TCP Keep-Alive] 51813  >  443 [ACK] Seq=1 Ack=1 Win=511 Len=1"
"643","48.548025","140.82.121.6","10.0.0.7","TCP","66","[TCP Keep-Alive ACK] 443  >  51813 [ACK] Seq=1 Ack=2 Win=75 Len=0 SLE=1 SRE=2"
"644","48.636154","2a06:c701:46db:1a00:21d9:6346:9b9b:3579","2a00:1450:4028:801::2005","TCP","75","[TCP Keep-Alive] 63768  >  443 [ACK] Seq=1 Ack=1 Win=1024 Len=1"
"645","48.645315","2a00:1450:4028:801::2005","2a06:c701:46db:1a00:21d9:6346:9b9b:3579","TCP","86","[TCP Keep-Alive ACK] 443  >  63768 [ACK] Seq=1 Ack=2 Win=3977 Len=0 SLE=1 SRE=2"
"648","49.443891","10.0.0.7","13.248.151.210","TCP","55","[TCP Keep-Alive] 63736  >  443 [ACK] Seq=1 Ack=1 Win=514 Len=1"
"649","49.522490","13.248.151.210","10.0.0.7","TCP","66","[TCP Keep-Alive ACK] 443  >  63736 [ACK] Seq=1 Ack=2 Win=162 Len=0 SLE=1 SRE=2"
"658","53.286128","10.0.0.7","76.223.31.44","TCP","55","[TCP Keep-Alive] 63564  >  443 [ACK] Seq=1 Ack=1 Win=513 Len=1"
"659","53.363022","76.223.31.44","10.0.0.7","TCP","66","[TCP Keep-Alive ACK] 443  >  63564 [ACK] Seq=1 Ack=2 Win=168 Len=0 SLE=1 SRE=2"
"664","53.850281","10.0.0.7","20.74.47.205","TCP","66","51823  >  443 [SYN] Seq=0 Win=65535 Len=0 MSS=1460 WS=256 SACK_PERM"
"665","53.921383","20.74.47.205","10.0.0.7","TCP","66","443  >  51823 [SYN, ACK] Seq=0 Ack=1 Win=65535 Len=0 MSS=1440 WS=256 SACK_PERM"
"666","53.921579","10.0.0.7","20.74.47.205","TCP","54","51823  >  443 [ACK] Seq=1 Ack=1 Win=262144 Len=0"
"667","53.925657","10.0.0.7","20.74.47.205","TLSv1.2","344","Client Hello"
"668","53.998266","20.74.47.205","10.0.0.7","TCP","1465","443  >  51823 [ACK] Seq=1 Ack=291 Win=262144 Len=1411 [TCP segment of a reassembled PDU]"
"669","53.998463","10.0.0.7","20.74.47.205","TCP","54","51823  >  443 [ACK] Seq=291 Ack=1412 Win=260608 Len=0"
"670","53.998808","20.74.47.205","10.0.0.7","TCP","1465","443  >  51823 [ACK] Seq=1412 Ack=291 Win=262144 Len=1411 [TCP segment of a reassembled PDU]"
"671","53.998950","10.0.0.7","20.74.47.205","TCP","54","51823  >  443 [ACK] Seq=291 Ack=2823 Win=262144 Len=0"
"672","53.999418","20.74.47.205","10.0.0.7","TCP","1465","443  >  51823 [ACK] Seq=2823 Ack=291 Win=262144 Len=1411 [TCP segment of a reassembled PDU]"
"673","53.999418","20.74.47.205","10.0.0.7","TLSv1.2","238","Server Hello, Certificate, Server Key Exchange, Server Hello Done"
"674","53.999505","10.0.0.7","20.74.47.205","TCP","54","51823  >  443 [ACK] Seq=291 Ack=4418 Win=262144 Len=0"
"675","54.005203","10.0.0.7","20.74.47.205","TLSv1.2","212","Client Key Exchange, Change Cipher Spec, Encrypted Handshake Message"
"676","54.010581","10.0.0.7","20.74.47.205","TLSv1.2","141","Application Data"
"677","54.070735","20.74.47.205","10.0.0.7","TLSv1.2","105","Change Cipher Spec, Encrypted Handshake Message"
"678","54.070832","10.0.0.7","20.74.47.205","TCP","54","51823  >  443 [ACK] Seq=536 Ack=4469 Win=261888 Len=0"
"679","54.070999","20.74.47.205","10.0.0.7","TLSv1.2","123","Application Data"
"680","54.071039","10.0.0.7","20.74.47.205","TCP","54","51823  >  443 [ACK] Seq=536 Ack=4538 Win=261888 Len=0"
"681","54.071457","10.0.0.7","20.74.47.205","TLSv1.2","2700","Application Data"
"682","54.071513","10.0.0.7","20.74.47.205","TLSv1.2","92","Application Data"
"683","54.125473","20.74.47.205","10.0.0.7","TCP","60","443  >  51823 [ACK] Seq=4538 Ack=536 Win=261888 Len=0"
"684","54.134411","20.74.47.205","10.0.0.7","TLSv1.2","92","Application Data"
"685","54.134506","10.0.0.7","20.74.47.205","TCP","54","51823  >  443 [ACK] Seq=3220 Ack=4576 Win=261888 Len=0"
"686","54.137558","20.74.47.205","10.0.0.7","TCP","60","443  >  51823 [ACK] Seq=4576 Ack=1976 Win=262400 Len=0"
"687","54.138847","20.74.47.205","10.0.0.7","TCP","56","443  >  51823 [ACK] Seq=4576 Ack=3182 Win=261120 Len=0"
"688","54.170486","20.74.47.205","10.0.0.7","TCP","1465","443  >  51823 [ACK] Seq=4576 Ack=3220 Win=261120 Len=1411 [TCP segment of a reassembled PDU]"
"689","54.170636","10.0.0.7","20.74.47.205","TCP","54","51823  >  443 [ACK] Seq=3220 Ack=5987 Win=262144 Len=0"
"690","54.170770","20.74.47.205","10.0.0.7","TCP","1465","443  >  51823 [ACK] Seq=5987 Ack=3220 Win=261120 Len=1411 [TCP segment of a reassembled PDU]"
"691","54.170770","20.74.47.205","10.0.0.7","TLSv1.2","446","Application Data"
"692","54.170770","20.74.47.205","10.0.0.7","TLSv1.2","92","Application Data"
"693","54.170982","10.0.0.7","20.74.47.205","TCP","54","51823  >  443 [ACK] Seq=3220 Ack=7828 Win=262144 Len=0"
"694","54.722446","10.0.0.7","20.50.73.9","TCP","54","51810  >  443 [FIN, ACK] Seq=1 Ack=1 Win=1021 Len=0"
"695","54.803002","20.50.73.9","10.0.0.7","TCP","60","443  >  51810 [FIN, ACK] Seq=1 Ack=2 Win=2048 Len=0"
"696","54.803106","10.0.0.7","20.50.73.9","TCP","54","51810  >  443 [ACK] Seq=2 Ack=2 Win=1021 Len=0"
"701","54.985599","2a06:c701:46db:1a00:21d9:6346:9b9b:3579","2001:4cd0:dc00:1::d419:458f","TCP","86","51824  >  443 [SYN] Seq=0 Win=65535 Len=0 MSS=1440 WS=256 SACK_PERM"
"702","54.995493","2001:4cd0:dc00:1::d419:458f","2a06:c701:46db:1a00:21d9:6346:9b9b:3579","TCP","86","443  >  51824 [SYN, ACK] Seq=0 Ack=1 Win=64800 Len=0 MSS=1432 SACK_PERM WS=128"
"703","54.995641","2a06:c701:46db:1a00:21d9:6346:9b9b:3579","2001:4cd0:dc00:1::d419:458f","TCP","74","51824  >  443 [ACK] Seq=1 Ack=1 Win=262144 Len=0"
"704","54.998701","2a06:c701:46db:1a00:21d9:6346:9b9b:3579","2001:4cd0:dc00:1::d419:458f","TLSv1.3","351","Client Hello"
"705","55.009260","2001:4cd0:dc00:1::d419:458f","2a06:c701:46db:1a00:21d9:6346:9b9b:3579","TCP","74","443  >  51824 [ACK] Seq=1 Ack=278 Win=64640 Len=0"
"706","55.080167","2001:4cd0:dc00:1::d419:458f","2a06:c701:46db:1a00:21d9:6346:9b9b:3579","TLSv1.3","1506","Server Hello, Change Cipher Spec, Application Data"
"707","55.080441","2a06:c701:46db:1a00:21d9:6346:9b9b:3579","2001:4cd0:dc00:1::d419:458f","TCP","74","51824  >  443 [ACK] Seq=278 Ack=1433 Win=262144 Len=0"
"708","55.080685","2001:4cd0:dc00:1::d419:458f","2a06:c701:46db:1a00:21d9:6346:9b9b:3579","TCP","1306","[TCP Previous segment not captured] 443  >  51824 [PSH, ACK] Seq=2865 Ack=278 Win=64640 Len=1232 [TCP segment of a reassembled PDU]"
"709","55.080685","2001:4cd0:dc00:1::d419:458f","2a06:c701:46db:1a00:21d9:6346:9b9b:3579","TLSv1.3","269","Application Data, Application Data"
"710","55.080838","2a06:c701:46db:1a00:21d9:6346:9b9b:3579","2001:4cd0:dc00:1::d419:458f","TCP","86","[TCP Dup ACK 707#1] 51824  >  443 [ACK] Seq=278 Ack=1433 Win=262144 Len=0 SLE=2865 SRE=4097"
"711","55.080970","2a06:c701:46db:1a00:21d9:6346:9b9b:3579","2001:4cd0:dc00:1::d419:458f","TCP","86","[TCP Dup ACK 707#2] 51824  >  443 [ACK] Seq=278 Ack=1433 Win=262144 Len=0 SLE=2865 SRE=4292"
"712","55.081103","2001:4cd0:dc00:1::d419:458f","2a06:c701:46db:1a00:21d9:6346:9b9b:3579","TLSv1.3","1506","[TCP Fast Retransmission] , Application Data"
"713","55.081288","2a06:c701:46db:1a00:21d9:6346:9b9b:3579","2001:4cd0:dc00:1::d419:458f","TCP","74","51824  >  443 [ACK] Seq=278 Ack=4292 Win=262144 Len=0"
"714","55.083569","2a06:c701:46db:1a00:21d9:6346:9b9b:3579","2001:4cd0:dc00:1::d419:458f","TLSv1.3","154","Change Cipher Spec, Application Data"
"715","55.089314","2a06:c701:46db:1a00:21d9:6346:9b9b:3579","2001:4cd0:dc00:1::d419:458f","TLSv1.3","154","Application Data"
"716","55.091584","2a06:c701:46db:1a00:21d9:6346:9b9b:3579","2001:4cd0:dc00:1::d419:458f","TLSv1.3","408","Application Data"
"717","55.091742","2001:4cd0:dc00:1::d419:458f","2a06:c701:46db:1a00:21d9:6346:9b9b:3579","TCP","74","443  >  51824 [ACK] Seq=4292 Ack=358 Win=64640 Len=0"
"718","55.097076","2001:4cd0:dc00:1::d419:458f","2a06:c701:46db:1a00:21d9:6346:9b9b:3579","TCP","74","443  >  51824 [ACK] Seq=4292 Ack=438 Win=64640 Len=0"
"719","55.098967","2001:4cd0:dc00:1::d419:458f","2a06:c701:46db:1a00:21d9:6346:9b9b:3579","TCP","74","443  >  51824 [ACK] Seq=4292 Ack=772 Win=64384 Len=0"
"720","55.172033","2001:4cd0:dc00:1::d419:458f","2a06:c701:46db:1a00:21d9:6346:9b9b:3579","TLSv1.3","345","Application Data"
"721","55.172033","2001:4cd0:dc00:1::d419:458f","2a06:c701:46db:1a00:21d9:6346:9b9b:3579","TLSv1.3","345","Application Data"
"722","55.172225","2a06:c701:46db:1a00:21d9:6346:9b9b:3579","2001:4cd0:dc00:1::d419:458f","TCP","74","51824  >  443 [ACK] Seq=772 Ack=4834 Win=261376 Len=0"
"723","55.303899","2001:4cd0:dc00:1::d419:458f","2a06:c701:46db:1a00:21d9:6346:9b9b:3579","TLSv1.3","135","Application Data"
"724","55.303899","2001:4cd0:dc00:1::d419:458f","2a06:c701:46db:1a00:21d9:6346:9b9b:3579","TLSv1.3","105","Application Data"
"725","55.304122","2a06:c701:46db:1a00:21d9:6346:9b9b:3579","2001:4cd0:dc00:1::d419:458f","TCP","74","51824  >  443 [ACK] Seq=772 Ack=4926 Win=261376 Len=0"
"726","55.304316","2a06:c701:46db:1a00:21d9:6346:9b9b:3579","2001:4cd0:dc00:1::d419:458f","TLSv1.3","105","Application Data"
"727","55.311803","2001:4cd0:dc00:1::d419:458f","2a06:c701:46db:1a00:21d9:6346:9b9b:3579","TCP","74","443  >  51824 [ACK] Seq=4926 Ack=803 Win=64384 Len=0"
"728","55.450534","2001:4cd0:dc00:1::d419:458f","2a06:c701:46db:1a00:21d9:6346:9b9b:3579","TLSv1.3","558","Application Data"
"729","55.450765","2a06:c701:46db:1a00:21d9:6346:9b9b:3579","2001:4cd0:dc00:1::d419:458f","TCP","74","51824  >  443 [ACK] Seq=803 Ack=5410 Win=260864 Len=0"
"734","55.475534","2001:4cd0:dc00:1::d419:458f","2a06:c701:46db:1a00:21d9:6346:9b9b:3579","TLSv1.3","105","Application Data"
"735","55.475905","2a06:c701:46db:1a00:21d9:6346:9b9b:3579","2001:4cd0:dc00:1::d419:458f","TCP","74","51824  >  443 [ACK] Seq=803 Ack=5441 Win=260864 Len=0"
"736","55.476833","2a06:c701:46db:1a00:21d9:6346:9b9b:3579","2620:1ec:c11::200","TCP","86","51825  >  443 [SYN] Seq=0 Win=65535 Len=0 MSS=1440 WS=256 SACK_PERM"
"737","55.487748","2620:1ec:c11::200","2a06:c701:46db:1a00:21d9:6346:9b9b:3579","TCP","86","443  >  51825 [SYN, ACK] Seq=0 Ack=1 Win=65535 Len=0 MSS=1400 WS=256 SACK_PERM"
"738","55.488074","2a06:c701:46db:1a00:21d9:6346:9b9b:3579","2620:1ec:c11::200","TCP","74","51825  >  443 [ACK] Seq=1 Ack=1 Win=262144 Len=0"
"739","55.489470","2a06:c701:46db:1a00:21d9:6346:9b9b:3579","2620:1ec:c11::200","TLSv1.2","349","Client Hello"
"740","55.507128","2620:1ec:c11::200","2a06:c701:46db:1a00:21d9:6346:9b9b:3579","TCP","74","443  >  51825 [ACK] Seq=1 Ack=276 Win=4194048 Len=0"
"741","55.511797","2620:1ec:c11::200","2a06:c701:46db:1a00:21d9:6346:9b9b:3579","TCP","1506","443  >  51825 [ACK] Seq=1 Ack=276 Win=4194048 Len=1432 [TCP segment of a reassembled PDU]"
"742","55.511797","2620:1ec:c11::200","2a06:c701:46db:1a00:21d9:6346:9b9b:3579","TCP","1506","443  >  51825 [ACK] Seq=1433 Ack=276 Win=4194048 Len=1432 [TCP segment of a reassembled PDU]"
"743","55.512511","2a06:c701:46db:1a00:21d9:6346:9b9b:3579","2620:1ec:c11::200","TCP","74","51825  >  443 [ACK] Seq=276 Ack=2865 Win=262144 Len=0"
"744","55.512778","2620:1ec:c11::200","2a06:c701:46db:1a00:21d9:6346:9b9b:3579","TCP","1506","443  >  51825 [ACK] Seq=2865 Ack=276 Win=4194048 Len=1432 [TCP segment of a reassembled PDU]"
"745","55.512778","2620:1ec:c11::200","2a06:c701:46db:1a00:21d9:6346:9b9b:3579","TLSv1.2","1060","Server Hello, Certificate, Server Key Exchange, Server Hello Done"
"746","55.513086","2a06:c701:46db:1a00:21d9:6346:9b9b:3579","2620:1ec:c11::200","TCP","74","51825  >  443 [ACK] Seq=276 Ack=5283 Win=262144 Len=0"
"747","55.516898","2a06:c701:46db:1a00:21d9:6346:9b9b:3579","2620:1ec:c11::200","TLSv1.2","232","Client Key Exchange, Change Cipher Spec, Encrypted Handshake Message"
"748","55.517282","2a06:c701:46db:1a00:21d9:6346:9b9b:3579","2620:1ec:c11::200","TLSv1.2","161","Application Data"
"749","55.529308","2620:1ec:c11::200","2a06:c701:46db:1a00:21d9:6346:9b9b:3579","TCP","74","443  >  51825 [ACK] Seq=5283 Ack=521 Win=4193792 Len=0"
"750","55.530580","2620:1ec:c11::200","2a06:c701:46db:1a00:21d9:6346:9b9b:3579","TLSv1.2","416","New Session Ticket, Change Cipher Spec, Encrypted Handshake Message"
"751","55.530580","2620:1ec:c11::200","2a06:c701:46db:1a00:21d9:6346:9b9b:3579","TLSv1.2","143","Application Data"
"752","55.530697","2a06:c701:46db:1a00:21d9:6346:9b9b:3579","2620:1ec:c11::200","TCP","74","51825  >  443 [ACK] Seq=521 Ack=5694 Win=261632 Len=0"
"753","55.531513","2a06:c701:46db:1a00:21d9:6346:9b9b:3579","2620:1ec:c11::200","TLSv1.2","810","Application Data"
"754","55.531637","2a06:c701:46db:1a00:21d9:6346:9b9b:3579","2620:1ec:c11::200","TLSv1.2","112","Application Data"
"755","55.539444","2620:1ec:c11::200","2a06:c701:46db:1a00:21d9:6346:9b9b:3579","TLSv1.2","112","Application Data"
"756","55.539665","2a06:c701:46db:1a00:21d9:6346:9b9b:3579","2620:1ec:c11::200","TCP","74","51825  >  443 [ACK] Seq=1295 Ack=5732 Win=261632 Len=0"
"757","55.541117","2620:1ec:c11::200","2a06:c701:46db:1a00:21d9:6346:9b9b:3579","TCP","74","443  >  51825 [ACK] Seq=5732 Ack=1295 Win=4193024 Len=0"
"758","55.611218","2620:1ec:c11::200","2a06:c701:46db:1a00:21d9:6346:9b9b:3579","TLSv1.2","480","Application Data"
"759","55.611420","2a06:c701:46db:1a00:21d9:6346:9b9b:3579","2620:1ec:c11::200","TCP","74","51825  >  443 [ACK] Seq=1295 Ack=6138 Win=261120 Len=0"
"760","55.613615","2a06:c701:46db:1a00:21d9:6346:9b9b:3579","2001:4cd0:dc00:1::d419:458f","TLSv1.3","221","Application Data"
"761","55.621949","2001:4cd0:dc00:1::d419:458f","2a06:c701:46db:1a00:21d9:6346:9b9b:3579","TCP","74","443  >  51824 [ACK] Seq=5441 Ack=950 Win=64256 Len=0"
"762","55.878393","2001:4cd0:dc00:1::d419:458f","2a06:c701:46db:1a00:21d9:6346:9b9b:3579","TLSv1.3","495","Application Data"
"763","55.878625","2a06:c701:46db:1a00:21d9:6346:9b9b:3579","2001:4cd0:dc00:1::d419:458f","TCP","74","51824  >  443 [ACK] Seq=950 Ack=5862 Win=262144 Len=0"
"764","55.881800","2a06:c701:46db:1a00:21d9:6346:9b9b:3579","2620:1ec:c11::200","TLSv1.2","655","Application Data"
"765","55.891639","2620:1ec:c11::200","2a06:c701:46db:1a00:21d9:6346:9b9b:3579","TCP","74","443  >  51825 [ACK] Seq=6138 Ack=1876 Win=4194304 Len=0"
"766","55.900380","2001:4cd0:dc00:1::d419:458f","2a06:c701:46db:1a00:21d9:6346:9b9b:3579","TLSv1.3","105","Application Data"
"767","55.900521","2a06:c701:46db:1a00:21d9:6346:9b9b:3579","2001:4cd0:dc00:1::d419:458f","TCP","74","51824  >  443 [ACK] Seq=950 Ack=5893 Win=261888 Len=0"
"768","55.961344","2620:1ec:c11::200","2a06:c701:46db:1a00:21d9:6346:9b9b:3579","TLSv1.2","223","Application Data"
"769","55.961494","2a06:c701:46db:1a00:21d9:6346:9b9b:3579","2620:1ec:c11::200","TCP","74","51825  >  443 [ACK] Seq=1876 Ack=6287 Win=261120 Len=0"
"770","55.963677","2a06:c701:46db:1a00:21d9:6346:9b9b:3579","2001:4cd0:dc00:1::d419:458f","TLSv1.3","112","Application Data"
"771","55.971991","2001:4cd0:dc00:1::d419:458f","2a06:c701:46db:1a00:21d9:6346:9b9b:3579","TCP","74","443  >  51824 [ACK] Seq=5893 Ack=988 Win=64256 Len=0"
"772","56.195897","2001:4cd0:dc00:1::d419:458f","2a06:c701:46db:1a00:21d9:6346:9b9b:3579","TLSv1.3","494","Application Data"
"773","56.196122","2a06:c701:46db:1a00:21d9:6346:9b9b:3579","2001:4cd0:dc00:1::d419:458f","TCP","74","51824  >  443 [ACK] Seq=988 Ack=6313 Win=261632 Len=0"
"774","56.199226","2a06:c701:46db:1a00:21d9:6346:9b9b:3579","2620:1ec:c11::200","TLSv1.2","655","Application Data"
"775","56.208639","2620:1ec:c11::200","2a06:c701:46db:1a00:21d9:6346:9b9b:3579","TCP","74","443  >  51825 [ACK] Seq=6287 Ack=2457 Win=4193536 Len=0"
"776","56.267095","2001:4cd0:dc00:1::d419:458f","2a06:c701:46db:1a00:21d9:6346:9b9b:3579","TLSv1.3","105","Application Data"
"777","56.267254","2a06:c701:46db:1a00:21d9:6346:9b9b:3579","2001:4cd0:dc00:1::d419:458f","TCP","74","51824  >  443 [ACK] Seq=988 Ack=6344 Win=261632 Len=0"
"778","56.279226","2620:1ec:c11::200","2a06:c701:46db:1a00:21d9:6346:9b9b:3579","TLSv1.2","224","Application Data"
"779","56.279453","2a06:c701:46db:1a00:21d9:6346:9b9b:3579","2620:1ec:c11::200","TCP","74","51825  >  443 [ACK] Seq=2457 Ack=6437 Win=260864 Len=0"
"780","56.282288","2a06:c701:46db:1a00:21d9:6346:9b9b:3579","2001:4cd0:dc00:1::d419:458f","TLSv1.3","298","Application Data"
"781","56.295707","2001:4cd0:dc00:1::d419:458f","2a06:c701:46db:1a00:21d9:6346:9b9b:3579","TCP","74","443  >  51824 [ACK] Seq=6344 Ack=1212 Win=64128 Len=0"
"782","56.530261","2001:4cd0:dc00:1::d419:458f","2a06:c701:46db:1a00:21d9:6346:9b9b:3579","TLSv1.3","493","Application Data"
"783","56.530489","2a06:c701:46db:1a00:21d9:6346:9b9b:3579","2001:4cd0:dc00:1::d419:458f","TCP","74","51824  >  443 [ACK] Seq=1212 Ack=6763 Win=261120 Len=0"
"784","56.552211","2001:4cd0:dc00:1::d419:458f","2a06:c701:46db:1a00:21d9:6346:9b9b:3579","TLSv1.3","105","Application Data"
"785","56.552322","2a06:c701:46db:1a00:21d9:6346:9b9b:3579","2001:4cd0:dc00:1::d419:458f","TCP","74","51824  >  443 [ACK] Seq=1212 Ack=6794 Win=261120 Len=0"
"787","58.139696","34.85.166.233","10.0.0.7","TLSv1.2","82","Application Data"
"788","58.140470","10.0.0.7","34.85.166.233","TLSv1.2","86","Application Data"
"789","58.288864","34.85.166.233","10.0.0.7","TCP","56","443  >  51721 [ACK] Seq=139 Ack=159 Win=331 Len=0"
"806","60.234822","10.0.0.7","34.96.118.58","TCP","55","[TCP Keep-Alive] 63560  >  443 [ACK] Seq=1 Ack=1 Win=1025 Len=1"
"807","60.244027","34.96.118.58","10.0.0.7","TCP","66","[TCP Keep-Alive ACK] 443  >  63560 [ACK] Seq=1 Ack=2 Win=7308 Len=0 SLE=1 SRE=2"
"812","60.849575","2a06:c701:46db:1a00:21d9:6346:9b9b:3579","2620:1ec:c11::200","TCP","74","51825  >  443 [RST, ACK] Seq=2457 Ack=6437 Win=0 Len=0"
"813","60.850309","2a06:c701:46db:1a00:21d9:6346:9b9b:3579","2001:4cd0:dc00:1::d419:458f","TCP","74","51824  >  443 [RST, ACK] Seq=1212 Ack=6794 Win=0 Len=0"
"818","61.206913","10.0.0.7","13.107.42.12","TCP","66","51826  >  443 [SYN] Seq=0 Win=64240 Len=0 MSS=1460 WS=256 SACK_PERM"
"819","61.219885","13.107.42.12","10.0.0.7","TCP","66","443  >  51826 [SYN, ACK] Seq=0 Ack=1 Win=65535 Len=0 MSS=1440 WS=256 SACK_PERM"
"820","61.220044","10.0.0.7","13.107.42.12","TCP","54","51826  >  443 [ACK] Seq=1 Ack=1 Win=132352 Len=0"
"821","61.220409","10.0.0.7","13.107.42.12","TLSv1.2","543","Client Hello"
"822","61.233093","13.107.42.12","10.0.0.7","TCP","60","443  >  51826 [ACK] Seq=1 Ack=490 Win=4194304 Len=0"
"823","61.234874","13.107.42.12","10.0.0.7","TLSv1.2","195","Server Hello, Change Cipher Spec, Encrypted Handshake Message"
"824","61.235516","10.0.0.7","13.107.42.12","TLSv1.2","105","Change Cipher Spec, Encrypted Handshake Message"
"825","61.236172","10.0.0.7","13.107.42.12","TLSv1.2","1716","Application Data"
"826","61.245640","13.107.42.12","10.0.0.7","TCP","60","443  >  51826 [ACK] Seq=142 Ack=541 Win=4194304 Len=0"
"827","61.248553","13.107.42.12","10.0.0.7","TCP","60","443  >  51826 [ACK] Seq=142 Ack=1981 Win=4194816 Len=0"
"828","61.249444","13.107.42.12","10.0.0.7","TCP","60","443  >  51826 [ACK] Seq=142 Ack=2203 Win=4194560 Len=0"
"831","61.357004","13.107.42.12","10.0.0.7","TLSv1.2","593","Application Data"
"832","61.405699","10.0.0.7","13.107.42.12","TCP","54","51826  >  443 [ACK] Seq=2203 Ack=681 Win=131584 Len=0"
"841","63.634985","2a06:c701:46db:1a00:21d9:6346:9b9b:3579","2a03:2880:f242:c8:face:b00c:0:167","TLSv1.2","144","Application Data"
"842","63.681926","2a03:2880:f242:c8:face:b00c:0:167","2a06:c701:46db:1a00:21d9:6346:9b9b:3579","TCP","74","443  >  51770 [ACK] Seq=2565 Ack=1335 Win=296 Len=0"
"843","63.769103","2a03:2880:f242:c8:face:b00c:0:167","2a06:c701:46db:1a00:21d9:6346:9b9b:3579","TLSv1.2","146","Application Data"
"844","63.813273","2a06:c701:46db:1a00:21d9:6346:9b9b:3579","2a03:2880:f242:c8:face:b00c:0:167","TCP","74","51770  >  443 [ACK] Seq=1335 Ack=2637 Win=514 Len=0"
"848","64.438459","34.85.166.233","10.0.0.7","TLSv1.2","81","Application Data"
"849","64.439709","10.0.0.7","34.85.166.233","TLSv1.2","85","Application Data"
"850","64.587322","34.85.166.233","10.0.0.7","TCP","56","443  >  51721 [ACK] Seq=166 Ack=190 Win=331 Len=0"
"873","69.740221","2a06:c701:46db:1a00:21d9:6346:9b9b:3579","2600:9000:21f8:6400:1b:1fa2:78c0:93a1","TCP","75","[TCP Keep-Alive] 51778  >  443 [ACK] Seq=99 Ack=413 Win=514 Len=1"
"874","69.750558","2600:9000:21f8:6400:1b:1fa2:78c0:93a1","2a06:c701:46db:1a00:21d9:6346:9b9b:3579","TCP","86","[TCP Keep-Alive ACK] 443  >  51778 [ACK] Seq=413 Ack=100 Win=133 Len=0 SLE=99 SRE=100"
"900","73.648417","10.0.0.7","199.232.82.132","TCP","55","[TCP Keep-Alive] 51785  >  443 [ACK] Seq=1 Ack=1 Win=511 Len=1"
"901","73.695214","199.232.82.132","10.0.0.7","TCP","66","[TCP Keep-Alive ACK] 443  >  51785 [ACK] Seq=1 Ack=2 Win=290 Len=0 SLE=1 SRE=2"
"904","73.862996","10.0.0.7","146.75.58.217","TCP","55","[TCP Keep-Alive] 51784  >  443 [ACK] Seq=1 Ack=1 Win=510 Len=1"
"905","73.884636","2a03:2880:f242:c8:face:b00c:0:167","2a06:c701:46db:1a00:21d9:6346:9b9b:3579","TLSv1.2","630","Application Data"
"906","73.929039","2a06:c701:46db:1a00:21d9:6346:9b9b:3579","2a03:2880:f242:c8:face:b00c:0:167","TCP","74","51770  >  443 [ACK] Seq=1335 Ack=3193 Win=511 Len=0"
"907","73.938265","146.75.58.217","10.0.0.7","TCP","66","[TCP Keep-Alive ACK] 443  >  51784 [ACK] Seq=1 Ack=2 Win=298 Len=0 SLE=1 SRE=2"
"908","73.953465","20.199.120.151","10.0.0.7","TLSv1.2","433","Application Data"
"909","73.956983","2a06:c701:46db:1a00:21d9:6346:9b9b:3579","2a03:2880:f242:c8:face:b00c:0:167","TLSv1.2","170","Application Data"
"910","73.963471","10.0.0.7","20.199.120.151","TLSv1.2","188","Application Data"
"911","74.006766","2a03:2880:f242:c8:face:b00c:0:167","2a06:c701:46db:1a00:21d9:6346:9b9b:3579","TCP","74","443  >  51770 [ACK] Seq=3193 Ack=1431 Win=296 Len=0"
"912","74.081407","20.199.120.151","10.0.0.7","TCP","60","443  >  49605 [ACK] Seq=747 Ack=269 Win=7823 Len=0"
"918","74.209569","10.0.0.7","20.199.120.182","TLSv1.2","98","Application Data"
"919","74.275164","20.199.120.182","10.0.0.7","TLSv1.2","229","Application Data"
"920","74.322709","10.0.0.7","20.199.120.182","TCP","54","61001  >  443 [ACK] Seq=89 Ack=351 Win=513 Len=0"
"949","74.618202","2a06:c701:46db:1a00:21d9:6346:9b9b:3579","2a03:2880:f242:c8:face:b00c:0:167","TLSv1.3","115","Application Data"
"953","74.665499","2a03:2880:f242:c8:face:b00c:0:167","2a06:c701:46db:1a00:21d9:6346:9b9b:3579","TCP","74","443  >  51821 [ACK] Seq=6102 Ack=732 Win=67840 Len=0"
"954","74.665499","2a03:2880:f242:c8:face:b00c:0:167","2a06:c701:46db:1a00:21d9:6346:9b9b:3579","TLSv1.3","109","Application Data"
"955","74.665611","2a06:c701:46db:1a00:21d9:6346:9b9b:3579","2a03:2880:f242:c8:face:b00c:0:167","TCP","74","51821  >  443 [ACK] Seq=732 Ack=6137 Win=261888 Len=0"
"956","74.667389","2a03:2880:f242:c8:face:b00c:0:167","2a06:c701:46db:1a00:21d9:6346:9b9b:3579","TCP","1466","443  >  51821 [ACK] Seq=6137 Ack=732 Win=67840 Len=1392 [TCP segment of a reassembled PDU]"
"957","74.667389","2a03:2880:f242:c8:face:b00c:0:167","2a06:c701:46db:1a00:21d9:6346:9b9b:3579","TLSv1.3","1107","Application Data, Application Data"
"959","74.667467","2a06:c701:46db:1a00:21d9:6346:9b9b:3579","2a03:2880:f242:c8:face:b00c:0:167","TCP","74","51821  >  443 [ACK] Seq=732 Ack=8562 Win=262144 Len=0"
"962","75.129180","2a06:c701:46db:1a00:21d9:6346:9b9b:3579","2600:9000:21f8:6400:1b:1fa2:78c0:93a1","TLSv1.2","133","Application Data"
"963","75.129268","2a06:c701:46db:1a00:21d9:6346:9b9b:3579","2600:9000:21f8:6400:1b:1fa2:78c0:93a1","TLSv1.2","113","Application Data"
"964","75.141559","2600:9000:21f8:6400:1b:1fa2:78c0:93a1","2a06:c701:46db:1a00:21d9:6346:9b9b:3579","TCP","74","443  >  51778 [ACK] Seq=413 Ack=159 Win=133 Len=0"
"965","75.141559","2600:9000:21f8:6400:1b:1fa2:78c0:93a1","2a06:c701:46db:1a00:21d9:6346:9b9b:3579","TCP","74","443  >  51778 [ACK] Seq=413 Ack=198 Win=133 Len=0"
"966","75.141559","2600:9000:21f8:6400:1b:1fa2:78c0:93a1","2a06:c701:46db:1a00:21d9:6346:9b9b:3579","TLSv1.2","113","Application Data"
"967","75.183171","2a06:c701:46db:1a00:21d9:6346:9b9b:3579","2600:9000:21f8:6400:1b:1fa2:78c0:93a1","TCP","74","51778  >  443 [ACK] Seq=198 Ack=452 Win=514 Len=0"
"976","75.398044","2600:9000:21f8:6400:1b:1fa2:78c0:93a1","2a06:c701:46db:1a00:21d9:6346:9b9b:3579","TLSv1.2","446","Application Data"
"977","75.449026","2a06:c701:46db:1a00:21d9:6346:9b9b:3579","2600:9000:21f8:6400:1b:1fa2:78c0:93a1","TCP","74","51778  >  443 [ACK] Seq=198 Ack=824 Win=513 Len=0"
"981","78.416140","140.82.121.6","10.0.0.7","TLSv1.2","93","Application Data"
"982","78.416140","140.82.121.6","10.0.0.7","TLSv1.2","78","Application Data"
"983","78.416358","10.0.0.7","140.82.121.6","TCP","54","51813  >  443 [ACK] Seq=2 Ack=64 Win=511 Len=0"
"984","78.416510","140.82.121.6","10.0.0.7","TCP","60","443  >  51813 [FIN, ACK] Seq=64 Ack=2 Win=75 Len=0"
"985","78.416643","10.0.0.7","140.82.121.6","TCP","54","51813  >  443 [FIN, ACK] Seq=2 Ack=65 Win=511 Len=0"
"986","78.483799","140.82.121.6","10.0.0.7","TCP","60","443  >  51813 [ACK] Seq=65 Ack=3 Win=75 Len=0"
"987","78.642489","34.85.166.233","10.0.0.7","TLSv1.2","82","Application Data"
"988","78.642957","10.0.0.7","34.85.166.233","TLSv1.2","86","Application Data"
"989","78.790186","34.85.166.233","10.0.0.7","TCP","56","443  >  51721 [ACK] Seq=194 Ack=222 Win=331 Len=0"
"991","81.439091","2a03:2880:f242:c8:face:b00c:0:167","2a06:c701:46db:1a00:21d9:6346:9b9b:3579","TLSv1.2","193","Application Data"
"993","81.441916","2a06:c701:46db:1a00:21d9:6346:9b9b:3579","2a03:2880:f242:c8:face:b00c:0:167","TLSv1.2","170","Application Data"
"995","81.488596","2a03:2880:f242:c8:face:b00c:0:167","2a06:c701:46db:1a00:21d9:6346:9b9b:3579","TCP","74","443  >  51770 [ACK] Seq=3312 Ack=1527 Win=296 Len=0"
"998","83.645707","10.0.0.7","20.93.28.56","TCP","55","[TCP Keep-Alive] 63908  >  443 [ACK] Seq=1 Ack=1 Win=516 Len=1"
"999","83.723583","20.93.28.56","10.0.0.7","TCP","66","[TCP Keep-Alive ACK] 443  >  63908 [ACK] Seq=1 Ack=2 Win=501 Len=0 SLE=1 SRE=2"
"1002","85.366538","2a06:c701:46db:1a00:21d9:6346:9b9b:3579","2a03:2880:f242:c8:face:b00c:0:167","TLSv1.2","144","Application Data"
"1004","85.413330","2a03:2880:f242:c8:face:b00c:0:167","2a06:c701:46db:1a00:21d9:6346:9b9b:3579","TCP","74","443  >  51770 [ACK] Seq=3312 Ack=1597 Win=296 Len=0"
"1005","85.499346","2a03:2880:f242:c8:face:b00c:0:167","2a06:c701:46db:1a00:21d9:6346:9b9b:3579","TLSv1.2","146","Application Data"
"1006","85.547566","2a06:c701:46db:1a00:21d9:6346:9b9b:3579","2a03:2880:f242:c8:face:b00c:0:167","TCP","74","51770  >  443 [ACK] Seq=1597 Ack=3384 Win=511 Len=0"
"1007","86.157240","10.0.0.7","13.226.2.52","TCP","55","[TCP Keep-Alive] 51773  >  443 [ACK] Seq=1 Ack=1 Win=517 Len=1"
"1008","86.167699","13.226.2.52","10.0.0.7","TCP","66","[TCP Keep-Alive ACK] 443  >  51773 [ACK] Seq=1 Ack=2 Win=136 Len=0 SLE=1 SRE=2"
"1011","88.302594","10.0.0.7","107.178.240.159","TCP","55","[TCP Keep-Alive] 51787  >  443 [ACK] Seq=1 Ack=1 Win=512 Len=1"
"1012","88.311781","107.178.240.159","10.0.0.7","TCP","66","[TCP Keep-Alive ACK] 443  >  51787 [ACK] Seq=1 Ack=2 Win=332 Len=0 SLE=1 SRE=2"
"1017","89.937138","2a06:c701:46db:1a00:21d9:6346:9b9b:3579","2603:1026:c0d:c06::2","TCP","86","51829  >  443 [SYN] Seq=0 Win=65535 Len=0 MSS=1440 WS=256 SACK_PERM"
"1018","89.997705","2603:1026:c0d:c06::2","2a06:c701:46db:1a00:21d9:6346:9b9b:3579","TCP","86","443  >  51829 [SYN, ACK] Seq=0 Ack=1 Win=65535 Len=0 MSS=1432 WS=256 SACK_PERM"
"1019","89.997862","2a06:c701:46db:1a00:21d9:6346:9b9b:3579","2603:1026:c0d:c06::2","TCP","74","51829  >  443 [ACK] Seq=1 Ack=1 Win=262144 Len=0"
"1020","90.001275","2a06:c701:46db:1a00:21d9:6346:9b9b:3579","2603:1026:c0d:c06::2","TLSv1.3","359","Client Hello"
"1038","90.067736","2603:1026:c0d:c06::2","2a06:c701:46db:1a00:21d9:6346:9b9b:3579","TLSv1.3","173","Hello Retry Request, Change Cipher Spec"
"1039","90.068036","2a06:c701:46db:1a00:21d9:6346:9b9b:3579","2603:1026:c0d:c06::2","TCP","74","51829  >  443 [ACK] Seq=286 Ack=100 Win=261888 Len=0"
"1040","90.069549","2a06:c701:46db:1a00:21d9:6346:9b9b:3579","2603:1026:c0d:c06::2","TLSv1.3","430","Change Cipher Spec, Client Hello"
"1041","90.133010","2603:1026:c0d:c06::2","2a06:c701:46db:1a00:21d9:6346:9b9b:3579","TLSv1.3","1506","Server Hello"
"1042","90.133010","2603:1026:c0d:c06::2","2a06:c701:46db:1a00:21d9:6346:9b9b:3579","TCP","1506","443  >  51829 [ACK] Seq=1532 Ack=642 Win=4193536 Len=1432 [TCP segment of a reassembled PDU]"
"1043","90.133010","2603:1026:c0d:c06::2","2a06:c701:46db:1a00:21d9:6346:9b9b:3579","TLSv1.3","1253","Application Data"
"1044","90.133404","2a06:c701:46db:1a00:21d9:6346:9b9b:3579","2603:1026:c0d:c06::2","TCP","74","51829  >  443 [ACK] Seq=642 Ack=4143 Win=262144 Len=0"
"1045","90.139358","2a06:c701:46db:1a00:21d9:6346:9b9b:3579","2603:1026:c0d:c06::2","TLSv1.3","148","Application Data"
"1046","90.150513","2a06:c701:46db:1a00:21d9:6346:9b9b:3579","2603:1026:c0d:c06::2","TLSv1.3","154","Application Data"
"1047","90.152251","2a06:c701:46db:1a00:21d9:6346:9b9b:3579","2603:1026:c0d:c06::2","TLSv1.3","1332","Application Data"
"1050","90.199395","2603:1026:c0d:c06::2","2a06:c701:46db:1a00:21d9:6346:9b9b:3579","TLSv1.3","533","Application Data"
"1051","90.199635","2a06:c701:46db:1a00:21d9:6346:9b9b:3579","2603:1026:c0d:c06::2","TCP","74","51829  >  443 [ACK] Seq=2054 Ack=4602 Win=261632 Len=0"
"1052","90.200014","2603:1026:c0d:c06::2","2a06:c701:46db:1a00:21d9:6346:9b9b:3579","TLSv1.3","136","Application Data"
"1053","90.200234","2a06:c701:46db:1a00:21d9:6346:9b9b:3579","2603:1026:c0d:c06::2","TCP","74","51829  >  443 [ACK] Seq=2054 Ack=4664 Win=261376 Len=0"
"1054","90.200881","2a06:c701:46db:1a00:21d9:6346:9b9b:3579","2603:1026:c0d:c06::2","TLSv1.3","105","Application Data"
"1056","90.213429","2603:1026:c0d:c06::2","2a06:c701:46db:1a00:21d9:6346:9b9b:3579","TLSv1.3","105","Application Data"
"1057","90.213664","2a06:c701:46db:1a00:21d9:6346:9b9b:3579","2603:1026:c0d:c06::2","TCP","74","51829  >  443 [ACK] Seq=2085 Ack=4695 Win=261376 Len=0"
"1058","90.246963","2603:1026:c0d:c06::2","2a06:c701:46db:1a00:21d9:6346:9b9b:3579","TLSv1.3","1165","Application Data"
"1059","90.246963","2603:1026:c0d:c06::2","2a06:c701:46db:1a00:21d9:6346:9b9b:3579","TLSv1.3","105","Application Data"
"1060","90.247269","2a06:c701:46db:1a00:21d9:6346:9b9b:3579","2603:1026:c0d:c06::2","TCP","74","51829  >  443 [ACK] Seq=2085 Ack=5817 Win=262144 Len=0"
"1062","90.310471","2603:1026:c0d:c06::2","2a06:c701:46db:1a00:21d9:6346:9b9b:3579","TCP","74","443  >  51829 [ACK] Seq=5817 Ack=2085 Win=4194048 Len=0"
"1063","90.318960","2a06:c701:46db:1a00:21d9:6346:9b9b:3579","2603:1026:c0d:c06::2","TLSv1.3","218","Application Data"
"1064","90.373833","34.85.166.233","10.0.0.7","TLSv1.2","81","Application Data"
"1065","90.374936","10.0.0.7","34.85.166.233","TLSv1.2","85","Application Data"
"1068","90.427418","2603:1026:c0d:c06::2","2a06:c701:46db:1a00:21d9:6346:9b9b:3579","TLSv1.3","1299","Application Data"
"1069","90.427418","2603:1026:c0d:c06::2","2a06:c701:46db:1a00:21d9:6346:9b9b:3579","TLSv1.3","105","Application Data"
"1070","90.427699","2a06:c701:46db:1a00:21d9:6346:9b9b:3579","2603:1026:c0d:c06::2","TCP","74","51829  >  443 [ACK] Seq=2229 Ack=7073 Win=260864 Len=0"
"1071","90.439579","2a06:c701:46db:1a00:21d9:6346:9b9b:3579","2603:1026:c0d:c06::2","TLSv1.3","275","Application Data"
"1072","90.521352","2a03:2880:f242:c8:face:b00c:0:167","2a06:c701:46db:1a00:21d9:6346:9b9b:3579","TLSv1.3","113","Application Data"
"1073","90.521352","2a03:2880:f242:c8:face:b00c:0:167","2a06:c701:46db:1a00:21d9:6346:9b9b:3579","TCP","74","443  >  51820 [FIN, ACK] Seq=3568 Ack=627 Win=67840 Len=0"
"1074","90.521609","2a06:c701:46db:1a00:21d9:6346:9b9b:3579","2a03:2880:f242:c8:face:b00c:0:167","TCP","74","51820  >  443 [ACK] Seq=627 Ack=3569 Win=261632 Len=0"
"1075","90.521900","2a06:c701:46db:1a00:21d9:6346:9b9b:3579","2a03:2880:f242:c8:face:b00c:0:167","TCP","74","51820  >  443 [FIN, ACK] Seq=627 Ack=3569 Win=261632 Len=0"
"1076","90.522417","34.85.166.233","10.0.0.7","TCP","56","443  >  51721 [ACK] Seq=221 Ack=253 Win=331 Len=0"
"1077","90.539904","2603:1026:c0d:c06::2","2a06:c701:46db:1a00:21d9:6346:9b9b:3579","TLSv1.3","443","Application Data"
"1078","90.540117","2a06:c701:46db:1a00:21d9:6346:9b9b:3579","2603:1026:c0d:c06::2","TCP","74","51829  >  443 [ACK] Seq=2430 Ack=7442 Win=262144 Len=0"
"1079","90.540294","2603:1026:c0d:c06::2","2a06:c701:46db:1a00:21d9:6346:9b9b:3579","TLSv1.3","105","Application Data"
"1080","90.540388","2a06:c701:46db:1a00:21d9:6346:9b9b:3579","2603:1026:c0d:c06::2","TCP","74","51829  >  443 [ACK] Seq=2430 Ack=7473 Win=261888 Len=0"
"1081","90.557141","2a06:c701:46db:1a00:21d9:6346:9b9b:3579","2603:1026:c0d:c06::2","TLSv1.3","309","Application Data"
"1082","90.570019","2a03:2880:f242:c8:face:b00c:0:167","2a06:c701:46db:1a00:21d9:6346:9b9b:3579","TCP","74","443  >  51820 [ACK] Seq=3569 Ack=628 Win=67840 Len=0"
"1084","90.629638","10.0.0.7","20.93.28.56","TCP","55","[TCP Keep-Alive] 63905  >  443 [ACK] Seq=1 Ack=1 Win=516 Len=1"
"1087","90.669654","2603:1026:c0d:c06::2","2a06:c701:46db:1a00:21d9:6346:9b9b:3579","TCP","74","443  >  51829 [ACK] Seq=7473 Ack=2665 Win=4193536 Len=0"
"1088","90.716863","20.93.28.56","10.0.0.7","TCP","66","[TCP Keep-Alive ACK] 443  >  63905 [ACK] Seq=1 Ack=2 Win=501 Len=0 SLE=1 SRE=2"
"1093","90.748048","10.0.0.7","52.168.117.170","TCP","66","51830  >  443 [SYN] Seq=0 Win=65535 Len=0 MSS=1460 WS=256 SACK_PERM"
"1094","90.754828","2603:1026:c0d:c06::2","2a06:c701:46db:1a00:21d9:6346:9b9b:3579","TLSv1.3","514","Application Data"
"1095","90.754828","2603:1026:c0d:c06::2","2a06:c701:46db:1a00:21d9:6346:9b9b:3579","TLSv1.3","105","Application Data"
"1096","90.755104","2a06:c701:46db:1a00:21d9:6346:9b9b:3579","2603:1026:c0d:c06::2","TCP","74","51829  >  443 [ACK] Seq=2665 Ack=7944 Win=261632 Len=0"
"1097","90.783193","2a06:c701:46db:1a00:21d9:6346:9b9b:3579","2603:1026:c0d:c06::2","TLSv1.3","480","Application Data"
"1098","90.783471","2a06:c701:46db:1a00:21d9:6346:9b9b:3579","2603:1026:c0d:c06::2","TLSv1.3","485","Application Data"
"1099","90.783679","2a06:c701:46db:1a00:21d9:6346:9b9b:3579","2603:1026:c0d:c06::2","TLSv1.3","1581","Application Data"
"1100","90.784185","2a06:c701:46db:1a00:21d9:6346:9b9b:3579","2603:1026:c0d:c06::2","TLSv1.3","485","Application Data"
"1102","90.844385","2603:1026:c0d:c06::2","2a06:c701:46db:1a00:21d9:6346:9b9b:3579","TCP","74","443  >  51829 [ACK] Seq=7944 Ack=3482 Win=4192768 Len=0"
"1103","90.846290","2603:1026:c0d:c06::2","2a06:c701:46db:1a00:21d9:6346:9b9b:3579","TCP","74","443  >  51829 [ACK] Seq=7944 Ack=4989 Win=4194304 Len=0"
"1105","90.884686","2603:1026:c0d:c06::2","2a06:c701:46db:1a00:21d9:6346:9b9b:3579","TLSv1.3","686","Application Data"
"1106","90.884686","2603:1026:c0d:c06::2","2a06:c701:46db:1a00:21d9:6346:9b9b:3579","TLSv1.3","105","Application Data"
"1107","90.884971","2a06:c701:46db:1a00:21d9:6346:9b9b:3579","2603:1026:c0d:c06::2","TCP","74","51829  >  443 [ACK] Seq=5400 Ack=8587 Win=260864 Len=0"
"1108","90.892888","2603:1026:c0d:c06::2","2a06:c701:46db:1a00:21d9:6346:9b9b:3579","TLSv1.3","1287","Application Data"
"1109","90.893018","2a06:c701:46db:1a00:21d9:6346:9b9b:3579","2603:1026:c0d:c06::2","TCP","74","51829  >  443 [ACK] Seq=5400 Ack=9800 Win=262144 Len=0"
"1110","90.893129","2603:1026:c0d:c06::2","2a06:c701:46db:1a00:21d9:6346:9b9b:3579","TLSv1.3","105","Application Data"
"1111","90.893214","2a06:c701:46db:1a00:21d9:6346:9b9b:3579","2603:1026:c0d:c06::2","TCP","74","51829  >  443 [ACK] Seq=5400 Ack=9831 Win=261888 Len=0"
"1112","90.894560","2603:1026:c0d:c06::2","2a06:c701:46db:1a00:21d9:6346:9b9b:3579","TLSv1.3","673","Application Data"
"1113","90.894560","2603:1026:c0d:c06::2","2a06:c701:46db:1a00:21d9:6346:9b9b:3579","TLSv1.3","105","Application Data"
"1114","90.894698","2a06:c701:46db:1a00:21d9:6346:9b9b:3579","2603:1026:c0d:c06::2","TCP","74","51829  >  443 [ACK] Seq=5400 Ack=10461 Win=261376 Len=0"
"1115","90.900021","52.168.117.170","10.0.0.7","TCP","66","443  >  51830 [SYN, ACK] Seq=0 Ack=1 Win=65535 Len=0 MSS=1440 WS=256 SACK_PERM"
"1116","90.900199","10.0.0.7","52.168.117.170","TCP","54","51830  >  443 [ACK] Seq=1 Ack=1 Win=262144 Len=0"
"1117","90.901964","10.0.0.7","52.168.117.170","TLSv1.2","351","Client Hello"
"1118","90.903688","2603:1026:c0d:c06::2","2a06:c701:46db:1a00:21d9:6346:9b9b:3579","TLSv1.3","761","Application Data"
"1119","90.903848","2a06:c701:46db:1a00:21d9:6346:9b9b:3579","2603:1026:c0d:c06::2","TCP","74","51829  >  443 [ACK] Seq=5400 Ack=11148 Win=260608 Len=0"
"1120","90.903989","2603:1026:c0d:c06::2","2a06:c701:46db:1a00:21d9:6346:9b9b:3579","TLSv1.3","105","Application Data"
"1121","90.904051","2a06:c701:46db:1a00:21d9:6346:9b9b:3579","2603:1026:c0d:c06::2","TCP","74","51829  >  443 [ACK] Seq=5400 Ack=11179 Win=260608 Len=0"
"1123","91.060431","52.168.117.170","10.0.0.7","TCP","1465","443  >  51830 [ACK] Seq=1 Ack=298 Win=524544 Len=1411 [TCP segment of a reassembled PDU]"
"1124","91.060626","10.0.0.7","52.168.117.170","TCP","54","51830  >  443 [ACK] Seq=298 Ack=1412 Win=260608 Len=0"
"1125","91.060709","52.168.117.170","10.0.0.7","TCP","1465","443  >  51830 [ACK] Seq=1412 Ack=298 Win=524544 Len=1411 [TCP segment of a reassembled PDU]"
"1126","91.060806","10.0.0.7","52.168.117.170","TCP","54","51830  >  443 [ACK] Seq=298 Ack=2823 Win=262144 Len=0"
"1127","91.061060","52.168.117.170","10.0.0.7","TCP","1465","443  >  51830 [ACK] Seq=2823 Ack=298 Win=524544 Len=1411 [TCP segment of a reassembled PDU]"
"1128","91.061060","52.168.117.170","10.0.0.7","TLSv1.2","334","Server Hello, Certificate, Server Key Exchange, Server Hello Done"
"1129","91.061318","10.0.0.7","52.168.117.170","TCP","54","51830  >  443 [ACK] Seq=298 Ack=4514 Win=262144 Len=0"
"1130","91.065049","10.0.0.7","52.168.117.170","TLSv1.2","212","Client Key Exchange, Change Cipher Spec, Encrypted Handshake Message"
"1132","91.214751","52.168.117.170","10.0.0.7","TLSv1.2","105","Change Cipher Spec, Encrypted Handshake Message"
"1133","91.214751","52.168.117.170","10.0.0.7","TLSv1.2","123","Application Data"
"1134","91.214859","10.0.0.7","52.168.117.170","TCP","54","51830  >  443 [ACK] Seq=456 Ack=4634 Win=261888 Len=0"
"1135","91.216018","10.0.0.7","52.168.117.170","TLSv1.2","141","Application Data"
"1136","91.216146","10.0.0.7","52.168.117.170","TLSv1.2","92","Application Data"
"1137","91.216241","10.0.0.7","52.168.117.170","TLSv1.2","357","Application Data"
"1138","91.216410","10.0.0.7","52.168.117.170","TLSv1.2","1413","Application Data"
"1139","91.216526","10.0.0.7","52.168.117.170","TLSv1.2","92","Application Data"
"1142","91.368338","52.168.117.170","10.0.0.7","TLSv1.2","92","Application Data"
"1143","91.368457","10.0.0.7","52.168.117.170","TCP","54","51830  >  443 [ACK] Seq=2281 Ack=4672 Win=261888 Len=0"
"1144","91.368892","52.168.117.170","10.0.0.7","TCP","60","443  >  51830 [ACK] Seq=4634 Ack=884 Win=523776 Len=0"
"1145","91.368914","10.0.0.7","52.168.117.170","TCP","54","[TCP Dup ACK 1143#1] 51830  >  443 [ACK] Seq=2281 Ack=4672 Win=261888 Len=0"
"1146","91.384739","52.168.117.170","10.0.0.7","TLSv1.2","109","Application Data"
"1147","91.384831","10.0.0.7","52.168.117.170","TCP","54","51830  >  443 [ACK] Seq=2281 Ack=4727 Win=261888 Len=0"
"1148","91.385002","52.168.117.170","10.0.0.7","TCP","60","443  >  51830 [ACK] Seq=4672 Ack=2243 Win=524800 Len=0"
"1149","91.385022","10.0.0.7","52.168.117.170","TCP","54","[TCP Dup ACK 1147#1] 51830  >  443 [ACK] Seq=2281 Ack=4727 Win=261888 Len=0"
"1150","91.385273","52.168.117.170","10.0.0.7","TCP","60","443  >  51830 [ACK] Seq=4672 Ack=2281 Win=524800 Len=0"
"1151","91.385291","10.0.0.7","52.168.117.170","TCP","54","[TCP Dup ACK 1147#2] 51830  >  443 [ACK] Seq=2281 Ack=4727 Win=261888 Len=0"
"1152","91.387029","52.168.117.170","10.0.0.7","TLSv1.2","338","Application Data"
"1153","91.387139","10.0.0.7","52.168.117.170","TCP","54","51830  >  443 [ACK] Seq=2281 Ack=5011 Win=261632 Len=0"
"1156","91.734003","10.0.0.7","52.168.117.170","TLSv1.2","134","Application Data"
"1157","91.734299","10.0.0.7","52.168.117.170","TLSv1.2","1217","Application Data"
"1158","91.734418","10.0.0.7","52.168.117.170","TLSv1.2","92","Application Data"
"1159","91.787352","10.0.0.7","52.168.117.170","TLSv1.2","134","Application Data"
"1160","91.787611","10.0.0.7","52.168.117.170","TLSv1.2","1031","Application Data"
"1161","91.787763","10.0.0.7","52.168.117.170","TLSv1.2","92","Application Data"
"1162","91.885121","52.168.117.170","10.0.0.7","TCP","56","443  >  51830 [ACK] Seq=5011 Ack=3562 Win=523520 Len=0"
"1163","91.888959","52.168.117.170","10.0.0.7","TLSv1.2","109","Application Data"
"1164","91.889175","10.0.0.7","52.168.117.170","TCP","54","51830  >  443 [ACK] Seq=4657 Ack=5066 Win=261376 Len=0"
"1165","91.892341","52.168.117.170","10.0.0.7","TLSv1.2","159","Application Data"
"1166","91.892489","10.0.0.7","52.168.117.170","TCP","54","51830  >  443 [ACK] Seq=4657 Ack=5171 Win=261376 Len=0"
"1169","91.938034","52.168.117.170","10.0.0.7","TCP","56","443  >  51830 [ACK] Seq=5171 Ack=4657 Win=524800 Len=0"
"1170","91.940860","52.168.117.170","10.0.0.7","TLSv1.2","109","Application Data"
"1171","91.941074","10.0.0.7","52.168.117.170","TCP","54","51830  >  443 [ACK] Seq=4657 Ack=5226 Win=261376 Len=0"
"1172","91.980341","52.168.117.170","10.0.0.7","TLSv1.2","136","Application Data"
"1173","91.980486","10.0.0.7","52.168.117.170","TCP","54","51830  >  443 [ACK] Seq=4657 Ack=5308 Win=261120 Len=0"
"1174","92.510489","10.0.0.7","13.248.151.210","TCP","55","[TCP Keep-Alive] 63770  >  443 [ACK] Seq=1 Ack=1 Win=514 Len=1"
"1175","92.586767","13.248.151.210","10.0.0.7","TCP","66","[TCP Keep-Alive ACK] 443  >  63770 [ACK] Seq=1 Ack=2 Win=129 Len=0 SLE=1 SRE=2"
"1178","93.137094","10.0.0.7","15.197.213.252","TCP","55","[TCP Keep-Alive] 63394  >  443 [ACK] Seq=84 Ack=41 Win=513 Len=1"
"1179","93.212554","15.197.213.252","10.0.0.7","TCP","66","[TCP Keep-Alive ACK] 443  >  63394 [ACK] Seq=41 Ack=85 Win=129 Len=0 SLE=84 SRE=85"
"1180","93.250469","10.0.0.7","15.197.213.252","TCP","55","[TCP Keep-Alive] 63903  >  443 [ACK] Seq=1 Ack=1 Win=515 Len=1"
"1181","93.326697","15.197.213.252","10.0.0.7","TCP","66","[TCP Keep-Alive ACK] 443  >  63903 [ACK] Seq=1 Ack=2 Win=114 Len=0 SLE=1 SRE=2"
"1182","93.646714","2a06:c701:46db:1a00:21d9:6346:9b9b:3579","2a00:1450:4028:801::2005","TCP","75","[TCP Keep-Alive] 63768  >  443 [ACK] Seq=1 Ack=1 Win=1024 Len=1"
"1183","93.654840","2a00:1450:4028:801::2005","2a06:c701:46db:1a00:21d9:6346:9b9b:3579","TCP","86","[TCP Keep-Alive ACK] 443  >  63768 [ACK] Seq=1 Ack=2 Win=3977 Len=0 SLE=1 SRE=2"
"1190","94.538144","10.0.0.7","13.248.151.210","TCP","55","[TCP Keep-Alive] 63736  >  443 [ACK] Seq=1 Ack=1 Win=514 Len=1"
"1191","94.616128","13.248.151.210","10.0.0.7","TCP","66","[TCP Keep-Alive ACK] 443  >  63736 [ACK] Seq=1 Ack=2 Win=162 Len=0 SLE=1 SRE=2"
"1196","96.240271","10.0.0.7","20.189.173.11","TCP","66","51831  >  443 [SYN] Seq=0 Win=65535 Len=0 MSS=1460 WS=256 SACK_PERM"
"1197","96.454115","20.189.173.11","10.0.0.7","TCP","66","443  >  51831 [SYN, ACK] Seq=0 Ack=1 Win=65535 Len=0 MSS=1440 WS=256 SACK_PERM"
"1198","96.454428","10.0.0.7","20.189.173.11","TCP","54","51831  >  443 [ACK] Seq=1 Ack=1 Win=262144 Len=0"
"1199","96.455420","10.0.0.7","20.189.173.11","TLSv1.2","272","Client Hello"
"1200","96.673406","20.189.173.11","10.0.0.7","TCP","1465","443  >  51831 [ACK] Seq=1 Ack=219 Win=524544 Len=1411 [TCP segment of a reassembled PDU]"
"1201","96.673621","10.0.0.7","20.189.173.11","TCP","54","51831  >  443 [ACK] Seq=219 Ack=1412 Win=260608 Len=0"
"1202","96.673706","20.189.173.11","10.0.0.7","TCP","1465","443  >  51831 [ACK] Seq=1412 Ack=219 Win=524544 Len=1411 [TCP segment of a reassembled PDU]"
"1203","96.673776","10.0.0.7","20.189.173.11","TCP","54","51831  >  443 [ACK] Seq=219 Ack=2823 Win=262144 Len=0"
"1204","96.673867","20.189.173.11","10.0.0.7","TCP","1465","443  >  51831 [ACK] Seq=2823 Ack=219 Win=524544 Len=1411 [TCP segment of a reassembled PDU]"
"1205","96.673929","10.0.0.7","20.189.173.11","TCP","54","51831  >  443 [ACK] Seq=219 Ack=4234 Win=260608 Len=0"
"1206","96.674121","20.189.173.11","10.0.0.7","TLSv1.2","327","Server Hello, Certificate, Server Key Exchange, Server Hello Done"
"1207","96.674163","10.0.0.7","20.189.173.11","TCP","54","51831  >  443 [ACK] Seq=219 Ack=4507 Win=262144 Len=0"
"1208","96.678363","10.0.0.7","20.189.173.11","TLSv1.2","212","Client Key Exchange, Change Cipher Spec, Encrypted Handshake Message"
"1209","96.904793","20.189.173.11","10.0.0.7","TLSv1.2","105","Change Cipher Spec, Encrypted Handshake Message"
"1210","96.905022","10.0.0.7","20.189.173.11","TCP","54","51831  >  443 [ACK] Seq=377 Ack=4558 Win=261888 Len=0"
"1211","96.906784","10.0.0.7","20.189.173.11","TLSv1.2","912","Application Data"
"1212","96.907128","10.0.0.7","20.189.173.11","TLSv1.2","3728","Application Data"
"1213","97.121240","20.189.173.11","10.0.0.7","TLSv1.2","108","Application Data"
"1214","97.121409","10.0.0.7","20.189.173.11","TCP","54","51831  >  443 [ACK] Seq=4909 Ack=4612 Win=261888 Len=0"
"1215","97.123096","20.189.173.11","10.0.0.7","TCP","60","443  >  51831 [ACK] Seq=4612 Ack=2675 Win=524800 Len=0"
"1216","97.124893","20.189.173.11","10.0.0.7","TCP","60","443  >  51831 [ACK] Seq=4612 Ack=4115 Win=524800 Len=0"
"1217","97.128027","20.189.173.11","10.0.0.7","TLSv1.2","507","Application Data"
"1218","97.128256","10.0.0.7","20.189.173.11","TCP","54","51831  >  443 [ACK] Seq=4909 Ack=5065 Win=261376 Len=0"
"1221","98.366939","10.0.0.7","76.223.31.44","TCP","55","[TCP Keep-Alive] 63564  >  443 [ACK] Seq=1 Ack=1 Win=513 Len=1"
"1222","98.443362","76.223.31.44","10.0.0.7","TCP","66","[TCP Keep-Alive ACK] 443  >  63564 [ACK] Seq=1 Ack=2 Win=168 Len=0 SLE=1 SRE=2"
"1224","99.060716","34.85.166.233","10.0.0.7","TLSv1.2","82","Application Data"
"1225","99.061488","10.0.0.7","34.85.166.233","TLSv1.2","86","Application Data"
"1226","99.209856","34.85.166.233","10.0.0.7","TCP","56","443  >  51721 [ACK] Seq=249 Ack=285 Win=331 Len=0"
"1267","105.246641","10.0.0.7","34.96.118.58","TCP","55","[TCP Keep-Alive] 63560  >  443 [ACK] Seq=1 Ack=1 Win=1025 Len=1"
"1268","105.256553","34.96.118.58","10.0.0.7","TCP","66","[TCP Keep-Alive ACK] 443  >  63560 [ACK] Seq=1 Ack=2 Win=7308 Len=0 SLE=1 SRE=2"
"1298","112.541610","2a06:c701:46db:1a00:21d9:6346:9b9b:3579","2a03:2880:f242:c8:face:b00c:0:167","TLSv1.2","144","Application Data"
"1299","112.588022","2a03:2880:f242:c8:face:b00c:0:167","2a06:c701:46db:1a00:21d9:6346:9b9b:3579","TCP","74","443  >  51770 [ACK] Seq=3384 Ack=1667 Win=296 Len=0"
"1300","112.674818","2a03:2880:f242:c8:face:b00c:0:167","2a06:c701:46db:1a00:21d9:6346:9b9b:3579","TLSv1.2","146","Application Data"
"1301","112.722102","2a06:c701:46db:1a00:21d9:6346:9b9b:3579","2a03:2880:f242:c8:face:b00c:0:167","TCP","74","51770  >  443 [ACK] Seq=1667 Ack=3456 Win=516 Len=0"
"1306","114.198965","10.0.0.7","20.74.47.205","TCP","54","51823  >  443 [RST, ACK] Seq=3220 Ack=7828 Win=0 Len=0"
"1308","116.157076","34.85.166.233","10.0.0.7","TLSv1.2","81","Application Data"
"1309","116.158442","10.0.0.7","34.85.166.233","TLSv1.2","85","Application Data"
"1310","116.306801","34.85.166.233","10.0.0.7","TCP","56","443  >  51721 [ACK] Seq=276 Ack=316 Win=331 Len=0"
"1311","118.709217","10.0.0.7","199.232.82.132","TCP","55","[TCP Keep-Alive] 51785  >  443 [ACK] Seq=1 Ack=1 Win=511 Len=1"
"1312","118.756060","199.232.82.132","10.0.0.7","TCP","66","[TCP Keep-Alive ACK] 443  >  51785 [ACK] Seq=1 Ack=2 Win=290 Len=0 SLE=1 SRE=2"
"1315","118.941531","10.0.0.7","146.75.58.217","TCP","55","[TCP Keep-Alive] 51784  >  443 [ACK] Seq=1 Ack=1 Win=510 Len=1"
"1316","119.017183","146.75.58.217","10.0.0.7","TCP","66","[TCP Keep-Alive ACK] 443  >  51784 [ACK] Seq=1 Ack=2 Win=298 Len=0 SLE=1 SRE=2"
"1317","119.223598","10.0.0.7","20.199.120.182","TLSv1.2","98","Application Data"
"1318","119.288511","20.199.120.182","10.0.0.7","TLSv1.2","229","Application Data"
"1319","119.337877","10.0.0.7","20.199.120.182","TCP","54","61001  >  443 [ACK] Seq=133 Ack=526 Win=512 Len=0"
"1320","119.446942","34.85.166.233","10.0.0.7","TLSv1.2","82","Application Data"
"1321","119.447737","10.0.0.7","34.85.166.233","TLSv1.2","86","Application Data"
"1322","119.596702","34.85.166.233","10.0.0.7","TCP","56","443  >  51721 [ACK] Seq=304 Ack=348 Win=331 Len=0"
"1331","120.411473","2a06:c701:46db:1a00:21d9:6346:9b9b:3579","2600:9000:21f8:6400:1b:1fa2:78c0:93a1","TCP","75","[TCP Keep-Alive] 51778  >  443 [ACK] Seq=197 Ack=824 Win=513 Len=1"
"1332","120.421257","2600:9000:21f8:6400:1b:1fa2:78c0:93a1","2a06:c701:46db:1a00:21d9:6346:9b9b:3579","TCP","86","[TCP Keep-Alive ACK] 443  >  51778 [ACK] Seq=824 Ack=198 Win=133 Len=0 SLE=197 SRE=198"
"1333","122.485570","2a03:2880:f242:c8:face:b00c:0:167","2a06:c701:46db:1a00:21d9:6346:9b9b:3579","TLSv1.2","534","Application Data"
"1334","122.538036","2a06:c701:46db:1a00:21d9:6346:9b9b:3579","2a03:2880:f242:c8:face:b00c:0:167","TCP","74","51770  >  443 [ACK] Seq=1667 Ack=3916 Win=514 Len=0"
"1335","122.546803","20.199.120.151","10.0.0.7","TLSv1.2","433","Application Data"
"1336","122.558558","10.0.0.7","20.199.120.151","TLSv1.2","188","Application Data"
"1337","122.563858","2a06:c701:46db:1a00:21d9:6346:9b9b:3579","2a03:2880:f242:c8:face:b00c:0:167","TLSv1.2","170","Application Data"
"1339","122.610646","2a03:2880:f242:c8:face:b00c:0:167","2a06:c701:46db:1a00:21d9:6346:9b9b:3579","TCP","74","443  >  51770 [ACK] Seq=3916 Ack=1763 Win=296 Len=0"
"1340","122.678281","20.199.120.151","10.0.0.7","TCP","56","443  >  49605 [ACK] Seq=1126 Ack=403 Win=7689 Len=0"
"1375","123.200356","2a06:c701:46db:1a00:21d9:6346:9b9b:3579","2a03:2880:f242:c8:face:b00c:0:167","TLSv1.3","112","Application Data"
"1381","123.247616","2a03:2880:f242:c8:face:b00c:0:167","2a06:c701:46db:1a00:21d9:6346:9b9b:3579","TLSv1.3","109","Application Data"
"1382","123.247814","2a06:c701:46db:1a00:21d9:6346:9b9b:3579","2a03:2880:f242:c8:face:b00c:0:167","TCP","74","51821  >  443 [ACK] Seq=770 Ack=8597 Win=261888 Len=0"
"1383","123.247972","2a03:2880:f242:c8:face:b00c:0:167","2a06:c701:46db:1a00:21d9:6346:9b9b:3579","TCP","1466","443  >  51821 [ACK] Seq=8597 Ack=770 Win=67840 Len=1392 [TCP segment of a reassembled PDU]"
"1384","123.248108","2a06:c701:46db:1a00:21d9:6346:9b9b:3579","2a03:2880:f242:c8:face:b00c:0:167","TCP","74","51821  >  443 [ACK] Seq=770 Ack=9989 Win=262144 Len=0"
"1385","123.248266","2a03:2880:f242:c8:face:b00c:0:167","2a06:c701:46db:1a00:21d9:6346:9b9b:3579","TLSv1.3","1107","Application Data, Application Data"
"1386","123.248376","2a06:c701:46db:1a00:21d9:6346:9b9b:3579","2a03:2880:f242:c8:face:b00c:0:167","TCP","74","51821  >  443 [ACK] Seq=770 Ack=11022 Win=260864 Len=0"
"1387","123.738046","2a06:c701:46db:1a00:21d9:6346:9b9b:3579","2600:9000:21f8:6400:1b:1fa2:78c0:93a1","TLSv1.2","133","Application Data"
"1388","123.738137","2a06:c701:46db:1a00:21d9:6346:9b9b:3579","2600:9000:21f8:6400:1b:1fa2:78c0:93a1","TLSv1.2","113","Application Data"
"1389","123.750811","2600:9000:21f8:6400:1b:1fa2:78c0:93a1","2a06:c701:46db:1a00:21d9:6346:9b9b:3579","TCP","74","443  >  51778 [ACK] Seq=824 Ack=257 Win=133 Len=0"
"1390","123.750811","2600:9000:21f8:6400:1b:1fa2:78c0:93a1","2a06:c701:46db:1a00:21d9:6346:9b9b:3579","TCP","74","443  >  51778 [ACK] Seq=824 Ack=296 Win=133 Len=0"
"1391","123.750811","2600:9000:21f8:6400:1b:1fa2:78c0:93a1","2a06:c701:46db:1a00:21d9:6346:9b9b:3579","TLSv1.2","113","Application Data"
"1392","123.791598","2a06:c701:46db:1a00:21d9:6346:9b9b:3579","2600:9000:21f8:6400:1b:1fa2:78c0:93a1","TCP","74","51778  >  443 [ACK] Seq=296 Ack=863 Win=512 Len=0"
"1393","124.004454","2600:9000:21f8:6400:1b:1fa2:78c0:93a1","2a06:c701:46db:1a00:21d9:6346:9b9b:3579","TLSv1.2","447","Application Data"
"1394","124.055872","2a06:c701:46db:1a00:21d9:6346:9b9b:3579","2600:9000:21f8:6400:1b:1fa2:78c0:93a1","TCP","74","51778  >  443 [ACK] Seq=296 Ack=1236 Win=511 Len=0"
